{"run":23,"commit":"5daffbc","metric":44.16725,"metrics":{"build_ms":3713.096,"vm_output":29678473,"go_output":29678473,"binary_size_bytes":22937554},"status":"keep","description":"Emit Dynamic union match cases after concrete cases","timestamp":1777349030179,"segment":0,"confidence":0.2937985078350471,"iterationTokens":9856,"asi":{"hypothesis":"Go type switches place `case any` before `case string` for unions like `Str | Dynamic`, causing strings to take the Dynamic arm and perform an unnecessary decodeString call in decode.from_json","result":"Median improved from 45.00ms to 44.17ms (~1.9%) with checks passing","why_it_worked":"FromJson(payload) now matches the concrete string case before the catch-all Dynamic/any case, avoiding extra result construction and decodeString per iteration","correctness_note":"This is also a semantic fix for unions containing Dynamic because the catch-all `any` case should not shadow more specific cases","next_action_hint":"Add a focused test for Dynamic case ordering if not already covered; continue looking for generated decode closure allocation overhead"}}
{"run":24,"commit":"5daffbc","metric":45.006875,"metrics":{"build_ms":3554.799,"vm_output":29678473,"go_output":29678473,"binary_size_bytes":22954258},"status":"discard","description":"Use one-slice string-key MapKeys fast path","timestamp":1777349085530,"segment":0,"confidence":0.29239547344684197,"iterationTokens":1668,"asi":{"hypothesis":"MapKeys string fast path currently allocates []string then converts back to []K; sorting one []K slice with string type assertions might reduce allocation overhead","result":"Median regressed from 44.17ms to 45.01ms; fewer slices did not compensate for per-comparison type assertions and larger binary","rollback_reason":"Primary metric worsened","next_action_hint":"Keep sort.Strings two-slice implementation. For further MapKeys wins, consider specialized helper functions emitted for concrete map types rather than generic runtime type assertions"}}
{"run":25,"commit":"8e6aa6a","metric":44.107875,"metrics":{"build_ms":3576.346,"vm_output":29678473,"go_output":29678473,"binary_size_bytes":22937186},"status":"keep","description":"Use direct Result literals in decode extern helpers","timestamp":1777349166680,"segment":0,"confidence":0.29034531488610665,"iterationTokens":3717,"asi":{"hypothesis":"Decode extern helper success paths call generic Ok/Err constructors; direct Result literals inside package ardgo may reduce helper overhead and code size","result":"Median slightly improved from 44.17ms to 44.11ms and binary size dropped by ~368 bytes","why_it_worked":"Small reduction in generated/runtime helper calls for every successful scalar decode","risk":"Uses Result field names inside package ardgo, which is safe unless Result layout changes","next_action_hint":"Try direct Result literals in builtinDecodeInt/List/Map/ExtractField themselves or other hot successful Result constructors"}}
{"run":26,"commit":"8e6aa6a","metric":44.46175,"metrics":{"build_ms":3579.828,"vm_output":29678473,"go_output":29678473,"binary_size_bytes":22937186},"status":"discard","description":"Use direct Result literals throughout decode builtins","timestamp":1777349221832,"segment":0,"confidence":0.28870693141370657,"iterationTokens":2976,"asi":{"hypothesis":"Replacing Ok constructors with direct Result literals in builtin decode success paths may reduce call overhead beyond the extern helper literals","result":"Median regressed from 44.11ms to 44.46ms; compiler likely inlines Ok constructors well, and broader literal changes did not help","rollback_reason":"Primary metric worsened","next_action_hint":"Keep direct literals only in decode extern helpers; do not broadly replace Ok in builtin decode functions"}}
{"run":27,"commit":"8e6aa6a","metric":0,"metrics":{"build_ms":0,"vm_output":0,"go_output":0,"binary_size_bytes":0},"status":"crash","description":"Rewrite decode error-size matches as if/else in stdlib","timestamp":1777349299532,"segment":0,"confidence":0.28870693141370657,"iterationTokens":3218,"asi":{"hypothesis":"Using if/else instead of integer match for `errors.size()` in std_lib/decode.ard may produce simpler generated Go without nested closure expressions on hot successful decode paths","failure_mode":"Generated decode_pipeline panicked with nil pointer dereference in Field after changing the match to if/else, indicating different value-return lowering or semantic issue for generic Result-returning if expressions","rollback_reason":"Benchmark crashed; semantic/codegen issue, not safe optimization","next_action_hint":"Do not rewrite these stdlib matches to if/else without first adding a focused compiler regression test for generic Result-returning if expressions"}}
{"run":28,"commit":"800b5ea","metric":41.82025,"metrics":{"build_ms":3576.264,"vm_output":29678473,"go_output":29678473,"binary_size_bytes":22953810},"status":"keep","description":"Inline string and int decode logic in typed decode extern helpers","timestamp":1777349360630,"segment":0,"confidence":0.2535362510491008,"iterationTokens":2823,"asi":{"hypothesis":"DecodeStringExtern and DecodeIntExtern are hot and currently call builtinDecodeString/Int, creating an intermediate Result before constructing the target Result; inlining success-path logic should remove that overhead","result":"Median improved from 44.11ms to 41.82ms (~5.2%) with checks passing","why_it_worked":"decode_pipeline decodes 24 ints plus 4 string map keys per iteration; eliminating intermediate Result construction/function calls on those paths adds up","scope":"Only typed extern helper success paths are inlined; error paths still build/coerce decode errors","next_action_hint":"Inline DynamicToListExtern/DynamicToMapExtern/ExtractFieldExtern/JsonToDynamicExtern success paths or DecodeFloat/Bool if relevant to other benchmarks"}}
{"run":29,"commit":"800b5ea","metric":42.038792,"metrics":{"build_ms":3517.155,"vm_output":29678473,"go_output":29678473,"binary_size_bytes":22953938},"status":"discard","description":"Inline ExtractFieldExtern success path","timestamp":1777349397813,"segment":0,"confidence":0.24966816630448782,"iterationTokens":1334,"asi":{"hypothesis":"ExtractFieldExtern is called several times per decode and can avoid calling builtinExtractField by inlining the map lookup fast path","result":"Median regressed from 41.82ms to 42.04ms and binary grew slightly; inlining this helper did not help","rollback_reason":"Primary metric worsened","next_action_hint":"Keep ExtractFieldExtern as a small wrapper; Go compiler likely inlines it adequately or larger code hurts instruction cache"}}
{"run":30,"commit":"800b5ea","metric":41.905375,"metrics":{"build_ms":3533.099,"vm_output":29678473,"go_output":29678473,"binary_size_bytes":22953938},"status":"discard","description":"Inline DynamicToListExtern common []any path","timestamp":1777349426298,"segment":0,"confidence":0.2663908508042306,"iterationTokens":987,"asi":{"hypothesis":"DynamicToListExtern is called for units and weights each iteration; inlining the common []any path may avoid wrapper overhead","result":"Median regressed slightly from 41.82ms to 41.91ms and binary grew; no benefit","rollback_reason":"Primary metric worsened","next_action_hint":"Do not inline DynamicToListExtern common path independently; current builtin wrapper is likely inlined sufficiently"}}
{"run":31,"commit":"800b5ea","metric":42.247542,"metrics":{"build_ms":3521.058,"vm_output":29678473,"go_output":29678473,"binary_size_bytes":22953746},"status":"discard","description":"Keep only int decode extern inlined; restore string wrapper","timestamp":1777349471237,"segment":0,"confidence":0.28658107030550906,"iterationTokens":1677,"asi":{"hypothesis":"The previous string+int inline win may be mostly from int decoding; restoring DecodeStringExtern wrapper could reduce code size without hurting runtime","result":"Median regressed from 41.82ms to 42.25ms, so string inline contributes meaningfully despite fewer calls","rollback_reason":"Primary metric worsened","next_action_hint":"Keep both DecodeStringExtern and DecodeIntExtern inlined"}}
{"run":32,"commit":"800b5ea","metric":41.85425,"metrics":{"build_ms":3498.316,"vm_output":29678473,"go_output":29678473,"binary_size_bytes":22953810},"status":"discard","description":"Check hot decode extern success types before nil","timestamp":1777349579389,"segment":0,"confidence":0.28724298049955677,"iterationTokens":1755,"asi":{"hypothesis":"DecodeStringExtern and DecodeIntExtern hot paths receive non-nil string/float64 values, so checking success type before nil may reduce branch overhead","result":"Median regressed slightly from 41.82ms to 41.85ms; within noise but not an improvement","rollback_reason":"Primary metric worsened","next_action_hint":"Keep current nil-first DecodeInt/StringExtern layout"}}
{"run":33,"commit":"0d23bfe","metric":41.293,"metrics":{"build_ms":3599.363,"vm_output":29678473,"go_output":29678473,"binary_size_bytes":22953810},"status":"keep","description":"Fast-path raw string and numeric values before Dynamic conversion","timestamp":1777349640308,"segment":0,"confidence":0.28427814757604053,"iterationTokens":2365,"asi":{"hypothesis":"DecodeStringExtern/DecodeIntExtern hot inputs are already raw Go string/float64 JSON values, so checking those before builtinDynamicValue avoids an Encodable type assertion per scalar decode","result":"Median improved from 41.82ms to 41.29ms (~1.3%) with checks passing","why_it_worked":"The benchmark performs many scalar decodes from JSON dynamic values that do not need Encodable unwrapping","risk":"Fallback still calls builtinDynamicValue, preserving behavior for Encodable dynamic wrappers","next_action_hint":"Apply similar raw-value fast paths to DynamicToListExtern/DynamicToMapExtern/ExtractFieldExtern only if benchmarking shows benefit; previous naive list/field inlining regressed"}}
{"run":34,"commit":"0d23bfe","metric":41.39725,"metrics":{"build_ms":3514.758,"vm_output":29678473,"go_output":29678473,"binary_size_bytes":22953874},"status":"discard","description":"Fast-path raw []any in DynamicToListExtern","timestamp":1777349671211,"segment":0,"confidence":0.5440137353949627,"iterationTokens":1119,"asi":{"hypothesis":"DynamicToListExtern hot inputs are raw []any JSON arrays, so checking before builtinDynamicValue may avoid Encodable assertion overhead","result":"Median regressed from 41.29ms to 41.40ms and binary grew slightly","rollback_reason":"Primary metric worsened","next_action_hint":"Do not add raw []any fast path to DynamicToListExtern; unlike scalar decoders it does not pay off"}}
{"run":35,"commit":"0d23bfe","metric":41.501459,"metrics":{"build_ms":3502.18,"vm_output":29678473,"go_output":29678473,"binary_size_bytes":22953874},"status":"discard","description":"Fast-path raw map[string]any in DynamicToMapExtern","timestamp":1777349727021,"segment":0,"confidence":9.449919181484539,"iterationTokens":1007,"asi":{"hypothesis":"DynamicToMapExtern hot input for counts is a raw map[string]any; checking this before builtinDynamicValue may avoid Encodable assertion overhead","result":"Median regressed from 41.29ms to 41.50ms; duplication of map-copy logic increased code without improving runtime","rollback_reason":"Primary metric worsened","next_action_hint":"Keep DynamicToMapExtern as wrapper around builtinDynamicToMap"}}
{"run":36,"commit":"9bd1676","metric":42.001625,"metrics":{"build_ms":3508.591,"vm_output":29678473,"go_output":29678473,"binary_size_bytes":22953874},"status":"discard","description":"Inline JsonToDynamicExtern parser wrapper","timestamp":1777349790714,"segment":0,"confidence":9.700071341672116,"iterationTokens":1887,"asi":{"hypothesis":"JsonToDynamicExtern is called once per decode; inlining builtinJsonToDynamic may remove a wrapper call and direct Result construction overhead","result":"Median regressed from 41.29ms to 42.00ms and binary grew; wrapper is likely inlined already or larger code hurts","rollback_reason":"Primary metric worsened","next_action_hint":"Keep JsonToDynamicExtern as wrapper around builtinJsonToDynamic"}}
{"run":37,"commit":"9bd1676","metric":41.580375,"metrics":{"build_ms":3550.493,"vm_output":29678473,"go_output":29678473,"binary_size_bytes":22953810},"status":"discard","description":"Add single-entry fast path to MapKeys","timestamp":1777349841722,"segment":0,"confidence":9.963827347066115,"iterationTokens":1930,"asi":{"hypothesis":"MapKeys can skip allocation/sort setup for one-entry maps, which may help small dynamic maps generally","result":"decode_pipeline maps have more than one entry; median regressed from 41.29ms to 41.58ms due extra branch/code","rollback_reason":"Primary metric worsened","next_action_hint":"Avoid MapKeys branches that do not match this workload; consider specialized emitted map iteration helpers instead"}}
{"run":38,"commit":"9bd1676","metric":41.376708,"metrics":{"build_ms":3574.843,"vm_output":29678473,"go_output":29678473,"binary_size_bytes":22954290},"status":"discard","description":"Move scalar decode extern error paths to noinline helpers","timestamp":1777349907085,"segment":0,"confidence":10.200052491007042,"iterationTokens":3408,"asi":{"hypothesis":"DecodeStringExtern/DecodeIntExtern hot success paths may inline better if cold error construction/coercion is moved to noinline helpers","result":"Median regressed from 41.29ms to 41.38ms and binary grew; noinline split did not help","rollback_reason":"Primary metric worsened","next_action_hint":"Keep scalar decode extern helpers as single functions"}}
{"run":39,"commit":"9bd1676","metric":41.479334,"metrics":{"build_ms":3621.499,"vm_output":29678473,"go_output":29678473,"binary_size_bytes":22954290},"status":"discard","description":"Split scalar decode extern Encodable fallback into slow helpers","timestamp":1777349956914,"segment":0,"confidence":10.5023358305831,"iterationTokens":2117,"asi":{"hypothesis":"Keeping DecodeStringExtern/DecodeIntExtern hot raw-value paths tiny and moving builtinDynamicValue fallback to helper functions may improve inlining/instruction cache","result":"Median regressed from 41.29ms to 41.48ms and binary grew; helper split did not help","rollback_reason":"Primary metric worsened","next_action_hint":"Keep scalar decode raw fast paths in a single function"}}
{"run":40,"commit":"daa1c86","metric":41.23625,"metrics":{"build_ms":3474.949,"vm_output":29678473,"go_output":29678473,"binary_size_bytes":22953810},"status":"keep","description":"Return sorted string key slice directly for map[string] MapKeys","timestamp":1777350001948,"segment":0,"confidence":10.486791328587998,"iterationTokens":1392,"asi":{"hypothesis":"MapKeys string fast path converts sorted []string back to []K even when K is string; a generic type assertion can return []string directly for map[string]V callers","result":"Median improved slightly from 41.29ms to 41.24ms with checks passing","why_it_worked":"The benchmark iterates final decoded counts as map[string]int; this avoids one slice allocation/copy on that path while preserving map[any] fallback","risk":"Uses a runtime type assertion on []string to []K; safe and falls back for K=any or other key types","next_action_hint":"Further MapKeys gains may need backend-emitted concrete key helper calls rather than generic runtime detection"}}
{"run":41,"commit":"daa1c86","metric":41.68025,"metrics":{"build_ms":3693.627,"vm_output":29678473,"go_output":29678473,"binary_size_bytes":22953442},"status":"discard","description":"Emit MapStringKeys for string-key for-in-map loops","timestamp":1777350087048,"segment":0,"confidence":10.540740060985407,"iterationTokens":4304,"asi":{"hypothesis":"ForInMapStmt can carry key type info so string-key maps call a specialized MapStringKeys helper instead of generic MapKeys runtime detection","result":"Median regressed from 41.24ms to 41.68ms despite smaller binary; extra IR/type plumbing or helper split did not improve runtime","rollback_reason":"Primary metric worsened","next_action_hint":"Keep generic MapKeys with []string direct return; do not add ForInMap key-type specialization for this workload"}}
{"run":42,"commit":"0f122ee","metric":41.197333,"metrics":{"build_ms":3493.523,"vm_output":29678473,"go_output":29678473,"binary_size_bytes":22953810},"status":"keep","description":"Limit raw DecodeIntExtern fast path to float64 JSON numbers","timestamp":1777350135728,"segment":0,"confidence":10.924414597765916,"iterationTokens":1350,"asi":{"hypothesis":"The raw-value fast path in DecodeIntExtern is for JSON numbers, which are float64; raw int/int64 cases can fall through to the existing builtinDynamicValue fallback to keep the hot path smaller","result":"Median improved slightly from 41.24ms to 41.20ms with checks passing","why_it_worked":"Hot decode_pipeline numeric values are float64, so removing extra raw switch cases reduces fast-path code while preserving int/int64 behavior through fallback","risk":"Non-JSON raw int/int64 decode now does one extra builtinDynamicValue call before success, a small tradeoff for JSON-heavy path","next_action_hint":"Consider measuring broader benchmarks before finalizing, since this favors JSON dynamic decode workloads"}}
{"run":43,"commit":"d4b1d01","metric":41.550541,"metrics":{"build_ms":3605.572,"vm_output":29678473,"go_output":29678473,"binary_size_bytes":22953890},"status":"discard","description":"Add List::with_capacity and use it for decode list output preallocation","timestamp":1777350438627,"segment":0,"confidence":11.413189181701696,"iterationTokens":6051,"asi":{"hypothesis":"decode.list appends a known number of items, so preallocating output capacity with a List::with_capacity helper should reduce append reallocations","result":"Median regressed from 41.20ms to 41.55ms despite checks passing; extra capacity helper plumbing/calls outweighed any append allocation savings for 12-item lists","rollback_reason":"Primary metric worsened","next_action_hint":"Do not add stdlib List::with_capacity for this workload. If preallocation is revisited, prefer backend pattern optimization that emits make([]T,0,len(raw)) without a user-visible helper."}}
{"run":44,"commit":"10b2691","metric":41.107167,"metrics":{"build_ms":3521.796,"vm_output":29678473,"go_output":29678473,"binary_size_bytes":22936642},"status":"keep","description":"Fast-path common Dynamic raw types before Encodable assertion","timestamp":1777350520150,"segment":0,"confidence":11.358969271746215,"iterationTokens":4716,"asi":{"hypothesis":"builtinDynamicValue is hot for JSON Dynamic arrays/maps/fields; most values are already raw Go primitives/collections, so checking common raw types before the Encodable interface assertion should reduce overhead","result":"Median improved from 41.20ms to 41.11ms and binary size dropped by ~17KB with checks passing","why_it_worked":"DynamicToList/Map/ExtractField still call builtinDynamicValue on raw JSON []any/map[string]any values, avoiding Encodable assertion on those paths helps slightly","risk":"Adds type switch to builtinDynamicValue; uncommon raw types now take an extra switch before Encodable check but semantics preserved","next_action_hint":"Consider whether all needed raw types are covered; avoid overfitting with benchmark-only shapes"}}
{"run":45,"commit":"10b2691","metric":42.097916,"metrics":{"build_ms":3680.203,"vm_output":29678473,"go_output":29678473,"binary_size_bytes":22936642},"status":"discard","description":"Remove scalar decode raw prechecks after Dynamic fast path","timestamp":1777350572699,"segment":0,"confidence":11.394390613102596,"iterationTokens":1949,"asi":{"hypothesis":"After builtinDynamicValue gained raw-type fast paths, DecodeStringExtern/DecodeIntExtern raw prechecks might be redundant and removable","result":"Median regressed from 41.11ms to 42.10ms; direct raw prechecks are still important for hot scalar decode","rollback_reason":"Primary metric worsened significantly","next_action_hint":"Keep raw string/float64 prechecks in scalar decode extern helpers even with builtinDynamicValue fast path"}}
{"run":46,"commit":"10b2691","metric":41.245625,"metrics":{"build_ms":3770.054,"vm_output":29678473,"go_output":29678473,"binary_size_bytes":22936594},"status":"discard","description":"Emit MapAnyKeys for Dynamic-key for-in-map loops","timestamp":1777350647238,"segment":0,"confidence":12.284163856519084,"iterationTokens":2741,"asi":{"hypothesis":"decode.map iterates a map[Dynamic:Dynamic] (generated as map[any]any); a specialized MapAnyKeys helper should avoid generic MapKeys conversions for dynamic-key maps","result":"Median regressed from 41.11ms to 41.25ms despite slightly smaller binary; helper/type-plumbing did not help runtime","rollback_reason":"Primary metric worsened","next_action_hint":"Keep generic MapKeys path; prior MapStringKeys specialization also regressed, suggesting map key iteration is no longer a profitable target"}}
{"run":47,"commit":"10b2691","metric":41.317417,"metrics":{"build_ms":3567.577,"vm_output":29678473,"go_output":29678473,"binary_size_bytes":22936642},"status":"discard","description":"Reorder Result fields to put ok flag first","timestamp":1777350804710,"segment":0,"confidence":13.324670134150516,"iterationTokens":4228,"asi":{"hypothesis":"Putting the Result ok flag first may improve field access locality for IsOk/IsErr and the CoerceExtern fixed-index fast path","result":"Median regressed from 41.11ms to 41.32ms; field reordering did not help the generated decode workload","rollback_reason":"Primary metric worsened","next_action_hint":"Keep Result field order value, err, ok. Do not retry field layout changes without broader profiling."}}
