{"run":220,"commit":"638bec1","metric":17.332375,"metrics":{"build_ms":3726.989,"vm_output":29678473,"go_output":29678473,"binary_size_bytes":22973906},"status":"keep","description":"Build cached lazy JSON object during duplicate scan","timestamp":1777362105763,"segment":0,"confidence":2.6947973982054614,"iterationTokens":1245,"asi":{"hypothesis":"The lazy JSON path scans top-level JSON once to reject duplicate names and then again to build the small object cache; building the cache during the duplicate-name scan should remove one full top-level scan while preserving json.Valid validation","result":"Median improved from ~18.94ms to 17.33ms with checks passing","why_it_worked":"Top-level decode_pipeline JSON is a small object whose field slices can be captured while the duplicate scanner already walks keys and values; json.Valid still preserves full JSON syntax validation","scope":"General lazy JSON object caching during validation for small top-level JSON objects","risk":"More validation code complexity and three-field cache threshold remains narrow; broader JSON tests should cover invalid/trailing JSON and nested duplicate keys","next_action_hint":"Remove now-unused parseLazyJSONObjectSmall or validate whether keeping it affects binary; add regression tests for top-level cache validation edge cases."}}
{"run":221,"commit":"f473a81","metric":17.205459,"metrics":{"build_ms":3618.222,"vm_output":29678473,"go_output":29678473,"binary_size_bytes":22973906},"status":"keep","description":"Remove obsolete lazy object parser","timestamp":1777362134103,"segment":0,"confidence":2.6609810367821134,"iterationTokens":1484,"asi":{"hypothesis":"After building the top-level lazy object cache during duplicate scanning, the old separate small-object parser is unused and removing it may simplify code and marginally improve build/runtime layout","result":"Median improved slightly from 17.332ms to 17.205ms with checks passing","why_it_worked":"Likely code-layout/build noise, but it removes dead runtime helper code and simplifies the lazy JSON path","scope":"Cleanup after validation/cache integration","risk":"Small improvement near noise; keep primarily as cleanup","next_action_hint":"Continue optimizing the combined duplicate-scan/object-cache path."}}
{"run":222,"commit":"f473a81","metric":17.43875,"metrics":{"build_ms":3591.114,"vm_output":29678473,"go_output":29678473,"binary_size_bytes":22973906},"status":"discard","description":"Use four-slot integrated lazy object cache","timestamp":1777362156849,"segment":0,"confidence":2.6483518893881963,"iterationTokens":999,"asi":{"hypothesis":"After integrating cache construction into duplicate scanning, a four-field cache may be more general with less overhead than before","result":"Median regressed from 17.205ms to 17.439ms; three slots remains faster for the primary workload","rollback_reason":"Primary metric worsened","next_action_hint":"Keep three-slot cache, but document overfit risk and validate on broader JSON objects later."}}
{"run":223,"commit":"f473a81","metric":17.657209,"metrics":{"build_ms":3638.213,"vm_output":29678473,"go_output":29678473,"binary_size_bytes":22973906},"status":"discard","description":"Use four-slot top-level duplicate tracker","timestamp":1777362179400,"segment":0,"confidence":2.635842052853313,"iterationTokens":1072,"asi":{"hypothesis":"The integrated top-level object cache only stores up to three fields, so a smaller duplicate-name tracker may reduce stack work versus the generic sixteen-slot tracker","result":"Median regressed from 17.205ms to 17.657ms; the smaller tracker likely triggers less favorable codegen/layout","rollback_reason":"Primary metric worsened","next_action_hint":"Keep sixteen-slot duplicate tracker even in the integrated top-level scanner."}}
{"run":224,"commit":"f473a81","metric":17.69425,"metrics":{"build_ms":3638.813,"vm_output":29678473,"go_output":29678473,"binary_size_bytes":22973906},"status":"discard","description":"Use direct Result literals for integrated JsonToDynamic","timestamp":1777362205292,"segment":0,"confidence":2.6289200690575427,"iterationTokens":1017,"asi":{"hypothesis":"After JsonToDynamic's hot path changed to integrated lazy object validation, direct Result literals might outperform Ok constructors","result":"Median regressed from 17.205ms to 17.694ms; Ok constructor remains better in this hot path","rollback_reason":"Primary metric worsened","next_action_hint":"Keep Ok constructors in builtinJsonToDynamic."}}
{"run":225,"commit":"f473a81","metric":17.410625,"metrics":{"build_ms":3589.009,"vm_output":29678473,"go_output":29678473,"binary_size_bytes":22973906},"status":"discard","description":"Remove unused validateLazyJSON wrapper","timestamp":1777362232422,"segment":0,"confidence":2.622034345676251,"iterationTokens":1046,"asi":{"hypothesis":"After switching JsonToDynamic to validateLazyJSONWithObject, the old validateLazyJSON wrapper is unused; removing it may simplify code layout","result":"Median regressed from 17.205ms to 17.411ms; likely noise/layout, but no primary improvement","rollback_reason":"Primary metric worsened","next_action_hint":"Leave the unused wrapper unless cleanup is desired outside the performance branch."}}
{"run":226,"commit":"f473a81","metric":17.224375,"metrics":{"build_ms":3573.573,"vm_output":29678473,"go_output":29678473,"binary_size_bytes":22973906},"status":"discard","description":"Inline positive integer parsing in lazy int lists","timestamp":1777362280757,"segment":0,"confidence":2.617098575282243,"iterationTokens":2192,"asi":{"hypothesis":"decodeLazyJSONIntList's hot path is positive integer arrays; inlining the positive-integer loop before the generic parser may avoid per-item helper overhead","result":"Median regressed slightly from 17.205ms to 17.224ms; added branch/code shape does not beat the shared parser","rollback_reason":"Primary metric worsened","next_action_hint":"Keep parseLazyJSONIntAt call in lazy int-list parser."}}
{"run":227,"commit":"f473a81","metric":17.529333,"metrics":{"build_ms":3658.802,"vm_output":29678473,"go_output":29678473,"binary_size_bytes":22973906},"status":"discard","description":"Add no-space fast path to skipJSONSpaces","timestamp":1777362313609,"segment":0,"confidence":2.6002889032060916,"iterationTokens":1147,"asi":{"hypothesis":"The benchmark JSON has no whitespace; checking the first byte in skipJSONSpaces before entering the loop may speed all lazy scans","result":"Median regressed from 17.205ms to 17.529ms; existing loop compiles better","rollback_reason":"Primary metric worsened","next_action_hint":"Keep simple skipJSONSpaces loop."}}
{"run":228,"commit":"3b8c5d0","metric":14.122791,"metrics":{"build_ms":3562.864,"vm_output":29678473,"go_output":29678473,"binary_size_bytes":22973922},"status":"keep","description":"Use strict lazy JSON validation without json.Valid","timestamp":1777362414419,"segment":0,"confidence":2.0962054231564884,"iterationTokens":5188,"asi":{"hypothesis":"The custom duplicate-name scan can be made into a strict JSON validator, eliminating the extra encoding/json.Valid full scan while preserving duplicate-name rejection semantics","result":"Median improved from 17.205ms to 14.123ms with checks passing and added invalid-syntax tests","why_it_worked":"JsonToDynamic now validates syntax, duplicate names, and builds the small top-level object cache in one custom pass instead of running json.Valid plus the custom scanner","scope":"Generated Go lazy JSON Dynamic validation path","risk":"JSON validation is now custom code and may not perfectly match encoding/json/v2 edge cases; needs expanded tests for Unicode, numbers, trailing separators, arrays, and invalid strings before final review","next_action_hint":"Add more conformance tests and consider comparing against ffi.JsonToDynamic/json.Valid on a table of valid/invalid examples."}}
{"run":229,"commit":"3b8c5d0","metric":14.8145,"metrics":{"build_ms":3740.412,"vm_output":29678473,"go_output":29678473,"binary_size_bytes":22973922},"status":"discard","description":"Cache parsed int collections on lazy JSON fields","timestamp":1777362495289,"segment":0,"confidence":2.061257305289817,"iterationTokens":4060,"asi":{"hypothesis":"When validating a small top-level JSON object, eagerly caching int-list and string-int-map field values could let decoders use typed fast paths and avoid later parsing","result":"Median regressed from 14.123ms to 14.815ms; eager typed caching adds object size and duplicate parsing cost that outweighs cheaper field decoders","rollback_reason":"Primary metric worsened","next_action_hint":"Do not eagerly cache typed field values; if revisited, integrate typed parsing into the validation scan rather than rescanning field substrings."}}
{"run":230,"commit":"4b99741","metric":14.108167,"metrics":{"build_ms":3606.533,"vm_output":29678473,"go_output":29678473,"binary_size_bytes":22973922},"status":"keep","description":"Use eight-slot nested duplicate tracker","timestamp":1777362522319,"segment":0,"confidence":2.0600312096582605,"iterationTokens":1041,"asi":{"hypothesis":"After removing json.Valid, the duplicate tracker in nested object validation is hotter; an eight-slot fixed tracker may reduce stack/code cost while still covering common small objects before map fallback","result":"Median improved slightly from 14.123ms to 14.108ms with checks passing","why_it_worked":"The benchmark's nested counts object has four keys and fits in eight slots; the smaller fixed array is now slightly favorable in the strict validator","scope":"Lazy JSON duplicate-name validation for nested objects","risk":"Small near-noise improvement; objects with 9-16 keys will allocate a map earlier than before","next_action_hint":"Try 4 or 12/16 under the strict validator to check sensitivity."}}
{"run":231,"commit":"4b99741","metric":14.439917,"metrics":{"build_ms":3619.048,"vm_output":29678473,"go_output":29678473,"binary_size_bytes":22973922},"status":"discard","description":"Use four-slot nested duplicate tracker under strict validation","timestamp":1777362556523,"segment":0,"confidence":2.060940325761449,"iterationTokens":1033,"asi":{"hypothesis":"The strict validator's nested duplicate tracker may benefit from matching the common four-key map size exactly","result":"Median regressed from 14.108ms to 14.440ms; four slots is too small or produces worse codegen","rollback_reason":"Primary metric worsened","next_action_hint":"Keep eight-slot nested duplicate tracker."}}
{"run":232,"commit":"4b99741","metric":14.272125,"metrics":{"build_ms":3575.179,"vm_output":29678473,"go_output":29678473,"binary_size_bytes":22973922},"status":"discard","description":"Use twelve-slot nested duplicate tracker under strict validation","timestamp":1777362577231,"segment":0,"confidence":2.0283286937612885,"iterationTokens":861,"asi":{"hypothesis":"A twelve-slot duplicate tracker may balance stack size with fewer map fallbacks for moderately sized nested JSON objects","result":"Median regressed from 14.108ms to 14.272ms; eight slots remains best among tried sizes","rollback_reason":"Primary metric worsened","next_action_hint":"Keep eight-slot nested duplicate tracker."}}
{"run":233,"commit":"4b99741","metric":14.470375,"metrics":{"build_ms":3587.517,"vm_output":29678473,"go_output":29678473,"binary_size_bytes":22973922},"status":"discard","description":"Use eight-slot top-level duplicate tracker under strict validation","timestamp":1777362605236,"segment":0,"confidence":1.9940990462416883,"iterationTokens":940,"asi":{"hypothesis":"The top-level cached object only has three fields, so reducing its duplicate tracker from sixteen to eight slots may lower validation overhead under the strict scanner","result":"Median regressed from 14.108ms to 14.470ms; top-level scanner still prefers sixteen slots","rollback_reason":"Primary metric worsened","next_action_hint":"Keep sixteen-slot top-level duplicate tracker."}}
{"run":234,"commit":"cde6eec","metric":14.015917,"metrics":{"build_ms":3610.496,"vm_output":29678473,"go_output":29678473,"binary_size_bytes":22973922},"status":"keep","description":"Scan JSON key strings once","timestamp":1777362659364,"segment":0,"confidence":1.9503007114061748,"iterationTokens":2713,"asi":{"hypothesis":"Strict lazy validation currently scans object keys once to find the string end and again to unescape/extract content; combining those into one scan should reduce key-heavy validation overhead","result":"Median improved from 14.108ms to 14.016ms with checks passing","why_it_worked":"Top-level and nested JSON object keys are hot in validation and field/map decoding; one-pass key scanning removes duplicate per-key work while preserving escape validation","scope":"Lazy JSON string-key scanning in validation and string-int map parsing","risk":"New string scanner duplicates escape-validation logic; keep tests for escaped keys and invalid escapes","next_action_hint":"Remove old jsonStringContent helper if unused only if benchmark improves; otherwise leave for layout."}}
{"run":235,"commit":"cde6eec","metric":14.168291,"metrics":{"build_ms":3532.237,"vm_output":29678473,"go_output":29678473,"binary_size_bytes":22973922},"status":"discard","description":"Remove unused jsonStringContent helper","timestamp":1777362698982,"segment":0,"confidence":1.9204819045987833,"iterationTokens":1166,"asi":{"hypothesis":"After switching key parsing to scanJSONStringContent, the old jsonStringContent helper is unused and removing it may simplify code layout","result":"Median regressed from 14.016ms to 14.168ms; cleanup did not improve primary metric","rollback_reason":"Primary metric worsened","next_action_hint":"Leave unused helper for now unless removed during non-performance cleanup."}}
{"run":236,"commit":"cde6eec","metric":14.188125,"metrics":{"build_ms":3628.866,"vm_output":29678473,"go_output":29678473,"binary_size_bytes":22973922},"status":"discard","description":"Return directly at JSON object and array close","timestamp":1777362732264,"segment":0,"confidence":1.909335713841519,"iterationTokens":1322,"asi":{"hypothesis":"Strict validators currently loop once more after seeing a closing object/array delimiter; returning immediately may reduce validation overhead","result":"Median regressed from 14.016ms to 14.188ms; the direct-close branch shape is worse","rollback_reason":"Primary metric worsened","next_action_hint":"Keep existing loop-top close handling."}}
{"run":237,"commit":"c32bc28","metric":14.215959,"metrics":{"build_ms":3650.625,"vm_output":29678473,"go_output":29678473,"binary_size_bytes":22973922},"status":"discard","description":"Use cap 16 for lazy int-list parser after strict validation","timestamp":1777362834329,"segment":0,"confidence":1.898318158165403,"iterationTokens":14752,"asi":{"hypothesis":"After strict validation changes, allocation/code layout may favor a slightly larger initial capacity for lazy int arrays","result":"Median regressed from 14.016ms to 14.216ms; cap 12 remains best","rollback_reason":"Primary metric worsened","next_action_hint":"Keep lazy int-list capacity at 12."}}
{"run":238,"commit":"c32bc28","metric":14.174916,"metrics":{"build_ms":3622.47,"vm_output":29678473,"go_output":29678473,"binary_size_bytes":22973954},"status":"discard","description":"Retry four-key MapKeys sorting network after strict JSON","timestamp":1777362873149,"segment":0,"confidence":1.8964240031926576,"iterationTokens":1581,"asi":{"hypothesis":"Strict lazy JSON made map iteration a larger remaining fraction; a fixed four-key string sorting network may now beat sort.Strings for decoded counts maps","result":"Median regressed from 14.016ms to 14.175ms and binary grew; sort.Strings path remains better","rollback_reason":"Primary metric worsened","next_action_hint":"Do not retry four-key MapKeys without a different implementation strategy."}}
{"run":239,"commit":"c32bc28","metric":14.051792,"metrics":{"build_ms":3571.339,"vm_output":29678473,"go_output":29678473,"binary_size_bytes":22973922},"status":"discard","description":"Recheck GC target 100 after strict lazy JSON","timestamp":1777362918135,"segment":0,"confidence":1.8945336244537954,"iterationTokens":1838,"asi":{"hypothesis":"Strict lazy JSON validation reduced allocation work enough that the generated Go runtime may no longer need a high default GC target","result":"Median regressed from 14.016ms to 14.052ms; target 300 remains slightly faster","rollback_reason":"Primary metric worsened","next_action_hint":"Keep default GC target 300, though memory validation is still needed."}}
{"run":240,"commit":"c32bc28","metric":14.044834,"metrics":{"build_ms":3609.788,"vm_output":29678473,"go_output":29678473,"binary_size_bytes":22973922},"status":"discard","description":"Use GC target 1000 after strict lazy JSON","timestamp":1777362946468,"segment":0,"confidence":1.8862315451754192,"iterationTokens":953,"asi":{"hypothesis":"With strict lazy JSON reducing allocation volume, a very high GC target may remove remaining collection overhead","result":"Median regressed from 14.016ms to 14.045ms and would increase memory risk; not worth keeping","rollback_reason":"Primary metric worsened","next_action_hint":"Keep default GC target 300."}}
{"run":241,"commit":"b30b024","metric":11.421125,"metrics":{"build_ms":3629.21,"vm_output":29678473,"go_output":29678473,"binary_size_bytes":22974050},"status":"keep","description":"Cache typed int collections during lazy JSON validation","timestamp":1777363030130,"segment":0,"confidence":1.5303240282629176,"iterationTokens":5500,"asi":{"hypothesis":"Eagerly rescanning field substrings to cache typed int collections regressed, but integrating int-list and string-int-map parsing into the strict top-level validation pass should avoid duplicate scans and let decoders use typed fast paths","result":"Median improved from 14.016ms to 11.421ms with checks passing","why_it_worked":"The validator already walks top-level field values; parsing int arrays and string-int maps during that walk eliminates later lazy decoder scans for the hot fields while preserving raw jsonDynamic fallback","scope":"General lazy JSON top-level field cache for int arrays and string-int maps","risk":"Increases cached object size and adds specialized parsing attempts for top-level arrays/objects; fallback must preserve correctness for non-int collections and duplicate names","next_action_hint":"Add focused tests for cached typed field fallback and duplicate rejection; tune cache representation to reduce object size/copy cost."}}
{"run":242,"commit":"93e3df0","metric":11.394792,"metrics":{"build_ms":3586.654,"vm_output":29678473,"go_output":29678473,"binary_size_bytes":22974050},"status":"keep","description":"Check typed int lists before lazy JSON strings","timestamp":1777363066903,"segment":0,"confidence":1.5241364011279215,"iterationTokens":1473,"asi":{"hypothesis":"After validation-time typed collection caching, DecodeIntListErrorsExtern usually receives []int rather than jsonDynamic for hot fields, so checking []int first should improve branch order","result":"Median improved slightly from 11.421ms to 11.395ms with checks passing","why_it_worked":"Cached top-level int array fields now hit the first branch instead of failing the jsonDynamic assertion before the []int fast path","scope":"Branch order in direct int-list decoder","risk":"Tiny near-noise improvement; raw jsonDynamic list decoding becomes one branch later for uncached/non-top-level fields","next_action_hint":"Keep typed-first order while typed validation cache is present."}}
{"run":243,"commit":"dbdb5ac","metric":11.364125,"metrics":{"build_ms":3578.589,"vm_output":29678473,"go_output":29678473,"binary_size_bytes":22974050},"status":"keep","description":"Use direct Result for cached lazy field hits","timestamp":1777363097285,"segment":0,"confidence":1.5173915946189533,"iterationTokens":1105,"asi":{"hypothesis":"After validation-time typed caching, cached field hits are the hottest ExtractField path; direct Result literals may now beat Ok for that specific branch even though broader field-extraction literals previously regressed","result":"Median improved slightly from 11.395ms to 11.364ms with checks passing","why_it_worked":"The hot path now returns typed cached []int/map values, so avoiding the Ok helper on that branch improves branch/call shape without changing fallback paths","scope":"Cached lazy JSON field extraction branch only","risk":"Small near-noise improvement and branch-shape sensitive; leave other ExtractField returns unchanged","next_action_hint":"Try direct literals for typed decoder success branches only if current branch order remains."}}
{"run":244,"commit":"b269df8","metric":11.192792,"metrics":{"build_ms":3590.161,"vm_output":29678473,"go_output":29678473,"binary_size_bytes":22973970},"status":"keep","description":"Store lazy object field values as interfaces","timestamp":1777363148200,"segment":0,"confidence":1.4861633733255866,"iterationTokens":1978,"asi":{"hypothesis":"With validation-time typed field caching, keeping parallel raw jsonDynamic and cached any arrays makes jsonObjectDynamic larger; storing either the typed cache or raw jsonDynamic in a single [3]any array should reduce object size and extraction work","result":"Median improved from 11.364ms to 11.193ms with checks passing and smaller binary","why_it_worked":"All hot top-level fields are cached typed values, and a single interface array avoids the extra cached-array nil check while shrinking the cached object representation","scope":"Lazy JSON cached-object representation","risk":"Field extraction now returns direct Result literals for raw cached-object values too; prior broad direct literal attempts were branch-sensitive, but raw top-level uncached values are cold here","next_action_hint":"Validate generic fallback behavior for uncached top-level values and non-int collections."}}
