{"run":146,"commit":"0102bb6","metric":31.459125,"metrics":{"build_ms":3538.403,"vm_output":29678473,"go_output":29678473,"binary_size_bytes":22956626},"status":"discard","description":"Use GC target 350 for generated runtime","timestamp":1777357174419,"segment":0,"confidence":7.01952663127849,"iterationTokens":843,"asi":{"hypothesis":"A GC target between 300 and 400 may improve on 300 while avoiding the poor 400 result","result":"Median regressed from 31.206ms to 31.459ms; 350 is worse than 300","rollback_reason":"Primary metric worsened","next_action_hint":"Keep GC target 300 as best tested value."}}
{"run":147,"commit":"ff7ff68","metric":31.125667,"metrics":{"build_ms":3593.21,"vm_output":29678473,"go_output":29678473,"binary_size_bytes":22956626},"status":"keep","description":"Respect GOGC when setting generated runtime GC target","timestamp":1777357208528,"segment":0,"confidence":6.469352760582543,"iterationTokens":1112,"asi":{"hypothesis":"Keeping the generated runtime's GC target at 300 but skipping it when the user explicitly sets GOGC preserves configurability and may avoid unwanted process-wide overrides with negligible startup cost","result":"Median improved from 31.206ms to 31.126ms with checks passing and unchanged binary size","why_it_worked":"The benchmark still uses the 300 target, while the added environment check is startup-only and does not affect the hot decode loop; variance favored this safer shape","scope":"General generated Go runtime behavior: Ard supplies a throughput-oriented default only when the host environment has not chosen one","risk":"Still changes default peak heap behavior for generated Go programs; memory-sensitive validation is needed","next_action_hint":"Measure peak RSS and broad benchmarks; consider documenting ARD generated Go defaults and GOGC override."}}
{"run":148,"commit":"f0cd460","metric":31.082417,"metrics":{"build_ms":3490.836,"vm_output":29678473,"go_output":29678473,"binary_size_bytes":22956402},"status":"keep","description":"Call int decode slow path from direct decoders","timestamp":1777357272922,"segment":0,"confidence":6.482284281119894,"iterationTokens":2780,"asi":{"hypothesis":"Direct int-list and string-int map decoders already handle raw float64 and int values before fallback; calling decodeIntErrorsSlow directly can avoid duplicating the scalar fast checks in cold fallback code and shrink generated shape","result":"Median improved from 31.126ms to 31.082ms with checks passing; binary shrank by 224 bytes","why_it_worked":"The direct helper hot loops remain unchanged for JSON numbers, while the fallback path no longer includes redundant DecodeIntErrorsExtern fast-path code","scope":"General cleanup for direct integer collection decoders that own their fast paths","risk":"Fallback still preserves DecodeIntErrors semantics via decodeIntErrorsSlow, but future changes to DecodeIntErrorsExtern fast paths must consider direct helpers separately"}}
{"run":149,"commit":"f0cd460","metric":31.3305,"metrics":{"build_ms":3500.685,"vm_output":29678473,"go_output":29678473,"binary_size_bytes":22956402},"status":"discard","description":"Remove raw int fast path from direct int-list decoder after slow fallback change","timestamp":1777357305866,"segment":0,"confidence":6.4883450579271456,"iterationTokens":1117,"asi":{"hypothesis":"After direct decoders call decodeIntErrorsSlow for fallback, the raw int branch in DecodeIntListErrorsExtern may be redundant code on the JSON float64 hot path","result":"Median regressed from 31.082ms to 31.331ms; the raw int branch still helps codegen/layout or fallback handling","rollback_reason":"Primary metric worsened","next_action_hint":"Keep raw int branch in DecodeIntListErrorsExtern."}}
{"run":150,"commit":"f0cd460","metric":31.449542,"metrics":{"build_ms":3535.67,"vm_output":29678473,"go_output":29678473,"binary_size_bytes":22956402},"status":"discard","description":"Remove raw int fast path from direct string-int map decoder after slow fallback change","timestamp":1777357336040,"segment":0,"confidence":6.486709332037762,"iterationTokens":928,"asi":{"hypothesis":"After direct decoders call decodeIntErrorsSlow for fallback, the raw int branch in DecodeStringIntMapErrorsExtern may be unnecessary on JSON float64 maps","result":"Median regressed from 31.082ms to 31.450ms; the raw int branch remains important","rollback_reason":"Primary metric worsened","next_action_hint":"Keep raw int branch in DecodeStringIntMapErrorsExtern."}}
{"run":151,"commit":"f0cd460","metric":31.20925,"metrics":{"build_ms":3492.633,"vm_output":29678473,"go_output":29678473,"binary_size_bytes":22956626},"status":"discard","description":"Split direct int-list slow path after slow fallback change","timestamp":1777357379062,"segment":0,"confidence":6.4692149256576865,"iterationTokens":1224,"asi":{"hypothesis":"Now that direct integer decoders call decodeIntErrorsSlow, moving the remaining indexed error-path work to a helper might shrink the int-list hot loop","result":"Median regressed from 31.082ms to 31.209ms and binary grew; inline fallback remains better","rollback_reason":"Primary metric worsened","next_action_hint":"Keep direct int-list fallback code inline."}}
{"run":152,"commit":"522adbd","metric":31.340416,"metrics":{"build_ms":3545.434,"vm_output":29678473,"go_output":29678473,"binary_size_bytes":22956402},"status":"discard","description":"Fast-path already-typed string-int maps","timestamp":1777357455121,"segment":0,"confidence":6.47828718068962,"iterationTokens":4338,"asi":{"hypothesis":"DecodeStringIntMapErrorsExtern can immediately return map[string]int values that are already decoded, improving non-JSON Dynamic maps while preserving JSON fallback","result":"Median regressed from 31.082ms to 31.340ms; the extra type assertion hurts the hot JSON map path","rollback_reason":"Primary metric worsened","next_action_hint":"Do not add typed map fast paths before JSON map conversion in DecodeStringIntMapErrorsExtern."}}
{"run":153,"commit":"7306b13","metric":31.008167,"metrics":{"build_ms":3487.315,"vm_output":29678473,"go_output":29678473,"binary_size_bytes":22956402},"status":"keep","description":"Fast-path already-typed int lists","timestamp":1777357492369,"segment":0,"confidence":6.491025380969939,"iterationTokens":1024,"asi":{"hypothesis":"DecodeIntListErrorsExtern can immediately return []int values that are already decoded; the extra assertion before the []any JSON path may be cheap enough and improve code layout or non-JSON callers","result":"Median improved from 31.082ms to 31.008ms with checks passing and unchanged binary size","why_it_worked":"The typed []int fast path avoids all conversion for already-decoded lists and unexpectedly does not penalize the JSON []any path","scope":"General direct int-list decoder optimization for both typed Ard/Go lists and JSON arrays","risk":"Returns the original []int slice without copying, matching other fast paths but preserving aliasing with the input value"}}
{"run":154,"commit":"7306b13","metric":31.194167,"metrics":{"build_ms":3539.938,"vm_output":29678473,"go_output":29678473,"binary_size_bytes":22956402},"status":"discard","description":"Check []any before typed []int in direct int-list decoder","timestamp":1777357526964,"segment":0,"confidence":6.4629801602292725,"iterationTokens":1177,"asi":{"hypothesis":"Since JSON arrays arrive as []any, checking []any before the newly kept []int fast path might optimize the primary hot input while retaining typed-list support","result":"Median regressed from 31.008ms to 31.194ms; the typed []int-first order has better code layout despite JSON []any inputs","rollback_reason":"Primary metric worsened","next_action_hint":"Keep []int assertion before []any in DecodeIntListErrorsExtern."}}
{"run":155,"commit":"7306b13","metric":31.338667,"metrics":{"build_ms":3553.381,"vm_output":29678473,"go_output":29678473,"binary_size_bytes":22956402},"status":"discard","description":"Copy already-typed int lists in direct decoder","timestamp":1777357562759,"segment":0,"confidence":6.435176242108089,"iterationTokens":1231,"asi":{"hypothesis":"The []int fast path can preserve generic decode.list copy semantics by copying the typed input before returning while still optimizing typed-list conversion","result":"Median regressed from 31.008ms to 31.339ms; copying removes the benefit and hurts the JSON path code shape","rollback_reason":"Primary metric worsened","next_action_hint":"Review whether the kept aliasing []int fast path is semantically acceptable; if not, revert it despite speed."}}
{"run":156,"commit":"7306b13","metric":31.220333,"metrics":{"build_ms":3511.149,"vm_output":29678473,"go_output":29678473,"binary_size_bytes":22956402},"status":"discard","description":"Fast-path float64 slices in direct int-list decoder","timestamp":1777357605605,"segment":0,"confidence":6.425092994266182,"iterationTokens":1607,"asi":{"hypothesis":"DecodeIntListErrorsExtern could decode []float64 lists directly for non-interface numeric Dynamic arrays while preserving indexed errors","result":"Median regressed from 31.008ms to 31.220ms; extra branch and code size hurt the JSON []any path","rollback_reason":"Primary metric worsened","next_action_hint":"Keep only []int and []any top-level list fast paths."}}
{"run":157,"commit":"7306b13","metric":31.465917,"metrics":{"build_ms":3486.729,"vm_output":29678473,"go_output":29678473,"binary_size_bytes":22956402},"status":"discard","description":"Recheck GC target 200 after decoder changes","timestamp":1777357639909,"segment":0,"confidence":6.410673937901892,"iterationTokens":1038,"asi":{"hypothesis":"After reducing direct decoder overhead, the best GC target may shift lower; target 200 could reduce memory risk while retaining speed","result":"Median regressed from 31.008ms to 31.466ms; target 300 remains better","rollback_reason":"Primary metric worsened","next_action_hint":"Keep default generated runtime GC target 300."}}
{"run":158,"commit":"757d95b","metric":31.789416,"metrics":{"build_ms":3497.558,"vm_output":29678473,"go_output":29678473,"binary_size_bytes":22956482},"status":"discard","description":"Recheck slices.Sort for all-string MapKeys","timestamp":1777357695824,"segment":0,"confidence":6.439603138334319,"iterationTokens":1958,"asi":{"hypothesis":"After pre-sizing MapKeys and other runtime changes, slices.Sort might now beat sort.Strings for the all-string key path","result":"Median regressed badly from 31.008ms to 31.789ms and binary grew; sort.Strings remains better","rollback_reason":"Primary metric worsened","next_action_hint":"Keep sort.Strings in MapKeys."}}
{"run":159,"commit":"757d95b","metric":31.454334,"metrics":{"build_ms":3541.146,"vm_output":29678473,"go_output":29678473,"binary_size_bytes":22956402},"status":"discard","description":"Use type switch for top-level int-list input","timestamp":1777357742958,"segment":0,"confidence":6.424399450962111,"iterationTokens":1751,"asi":{"hypothesis":"DecodeIntListErrorsExtern now checks both []int and []any inputs; a type switch may be cleaner and faster than sequential assertions","result":"Median regressed from 31.008ms to 31.454ms; sequential []int then []any assertions are much better","rollback_reason":"Primary metric worsened","next_action_hint":"Keep top-level int-list input checks as sequential comma-ok assertions."}}
{"run":160,"commit":"757d95b","metric":31.3995,"metrics":{"build_ms":3632.307,"vm_output":29678473,"go_output":29678473,"binary_size_bytes":22956402},"status":"discard","description":"Bind non-addressable result_expect calls to temps","timestamp":1777357890581,"segment":0,"confidence":6.4388790496890325,"iterationTokens":10261,"asi":{"hypothesis":"Generated code like decode.FromJson(...).Expect copies Result values; binding non-addressable result_expect subjects to temporaries and calling ExpectRef may avoid those copies","result":"Median regressed from 31.008ms to 31.400ms despite a promising manual micro-benchmark; extra statements/temps hurt full generated code","rollback_reason":"Primary metric worsened","next_action_hint":"Keep result_expect temp binding limited to existing addressable cases; do not add statement-level temps for all bind expressions."}}
{"run":161,"commit":"a106e4d","metric":30.927959,"metrics":{"build_ms":3504.415,"vm_output":29678473,"go_output":29678473,"binary_size_bytes":22956322},"status":"keep","description":"Use direct Result literal for string-map dynamic fast path","timestamp":1777357991556,"segment":0,"confidence":6.437122356063171,"iterationTokens":4329,"asi":{"hypothesis":"Earlier direct Result literals in DynamicToStringMapExtern regressed, but after direct map/list decoder and GC changes, returning a literal for the hot map[string]any path may shrink code and avoid Ok constructor overhead","result":"Median improved from 31.008ms to 30.928ms with checks passing; binary shrank by 80 bytes","why_it_worked":"counts decoding calls DynamicToStringMapExtern for raw JSON objects on every iteration, and the direct literal now codegens better in the current helper shape","scope":"General Go Dynamic-to-string-map fast path for raw map[string]any values","risk":"Very small semantic risk; equivalent to Ok(items) but branch-shape sensitive based on prior regressions"}}
{"run":162,"commit":"a106e4d","metric":31.558333,"metrics":{"build_ms":3560.765,"vm_output":29678473,"go_output":29678473,"binary_size_bytes":22956322},"status":"discard","description":"Recheck direct Result literals in ExtractField raw map path","timestamp":1777358048043,"segment":0,"confidence":6.774121367718121,"iterationTokens":1820,"asi":{"hypothesis":"After current helper and GC changes, direct Result literals in builtinExtractField's hot raw map path might now beat Ok constructors","result":"Median regressed badly from 30.928ms to 31.558ms; Ok constructors remain better for ExtractField","rollback_reason":"Primary metric worsened","next_action_hint":"Keep Ok constructors in builtinExtractField raw map fast path."}}
{"run":163,"commit":"a106e4d","metric":31.541833,"metrics":{"build_ms":3537.623,"vm_output":29678473,"go_output":29678473,"binary_size_bytes":22956322},"status":"discard","description":"Recheck direct Result literals in JsonToDynamic after runtime changes","timestamp":1777358084869,"segment":0,"confidence":7.319577315622874,"iterationTokens":998,"asi":{"hypothesis":"Direct Result literals in builtinJsonToDynamic previously regressed, but after GC and decoder changes they may now codegen better on the parse-success path","result":"Median regressed badly from 30.928ms to 31.542ms; Ok/Err constructors remain better for JsonToDynamic","rollback_reason":"Primary metric worsened","next_action_hint":"Keep Ok/Err constructors in builtinJsonToDynamic."}}
{"run":164,"commit":"cc0384a","metric":31.608833,"metrics":{"build_ms":3557.507,"vm_output":29678473,"go_output":29678473,"binary_size_bytes":22956418},"status":"discard","description":"Use Ok constructor for typed int-list fast path","timestamp":1777358138016,"segment":0,"confidence":7.451995907757825,"iterationTokens":1591,"asi":{"hypothesis":"The typed []int fast path in DecodeIntListErrorsExtern is cold for JSON; using the Ok constructor may reduce code size or improve branch layout","result":"Median regressed from 30.928ms to 31.609ms and binary grew; direct Result literal is much better","rollback_reason":"Primary metric worsened","next_action_hint":"Keep direct Result literal for the typed []int fast path."}}
{"run":165,"commit":"a0ef2c7","metric":31.130167,"metrics":{"build_ms":3579.041,"vm_output":29678473,"go_output":29678473,"binary_size_bytes":22956322},"status":"discard","description":"Retry raw map precheck after string-map Result literal","timestamp":1777358216890,"segment":0,"confidence":7.580304075301188,"iterationTokens":2676,"asi":{"hypothesis":"Now that DynamicToStringMapExtern's raw map path uses a direct Result literal, duplicating the raw map check inside DecodeStringIntMapErrorsExtern might interact differently and avoid even that small Result construction","result":"Median regressed from 30.928ms to 31.130ms; keeping the conversion helper call is still better","rollback_reason":"Primary metric worsened","next_action_hint":"Do not duplicate raw map checks in DecodeStringIntMapErrorsExtern."}}
{"run":166,"commit":"39ff371","metric":31.392709,"metrics":{"build_ms":3592.143,"vm_output":29678473,"go_output":29678473,"binary_size_bytes":22956322},"status":"discard","description":"Add direct raw list fast path to DynamicToListExtern","timestamp":1777358315989,"segment":0,"confidence":7.6460122537100945,"iterationTokens":5260,"asi":{"hypothesis":"After DynamicToStringMapExtern's raw map Result literal became profitable, DynamicToListExtern might benefit from an analogous raw []any direct Result path for decode.list callers","result":"Median regressed from 30.928ms to 31.393ms; direct int-list decoder already owns the hot []any path and the extra wrapper branch hurts","rollback_reason":"Primary metric worsened","next_action_hint":"Keep DynamicToListExtern delegating to builtinDynamicToList."}}
{"run":167,"commit":"39ff371","metric":31.283833,"metrics":{"build_ms":3588.243,"vm_output":29678473,"go_output":29678473,"binary_size_bytes":22956322},"status":"discard","description":"Invert string-int map conversion branch to ok-first","timestamp":1777358380810,"segment":0,"confidence":7.652908420833321,"iterationTokens":2074,"asi":{"hypothesis":"DecodeStringIntMapErrorsExtern almost always has a successful map conversion; making the ok branch syntactically first may improve branch layout","result":"Median regressed from 30.928ms to 31.284ms; the existing early-error return shape is better","rollback_reason":"Primary metric worsened","next_action_hint":"Keep `if !mapResult.ok { return err }` in DecodeStringIntMapErrorsExtern."}}
{"run":168,"commit":"39ff371","metric":31.467958,"metrics":{"build_ms":3560.27,"vm_output":29678473,"go_output":29678473,"binary_size_bytes":22956370},"status":"discard","description":"Use fixed array sort for four string MapKeys","timestamp":1777358437418,"segment":0,"confidence":7.829779784620012,"iterationTokens":2259,"asi":{"hypothesis":"MapKeys often sees four-key string maps; using a fixed [4]string plus compare-swap network may avoid the heap slice make while preserving deterministic order","result":"Median regressed from 30.928ms to 31.468ms and binary grew; fixed-array special case is worse","rollback_reason":"Primary metric worsened","next_action_hint":"Keep generic pre-sized []string plus sort.Strings for all string-key map sizes."}}
{"run":169,"commit":"39ff371","metric":31.868917,"metrics":{"build_ms":3805.159,"vm_output":29678473,"go_output":29678473,"binary_size_bytes":22956322},"status":"discard","description":"Recheck unconditional GC target 300 after latest decoder changes","timestamp":1777358477556,"segment":0,"confidence":7.9421224251239355,"iterationTokens":1003,"asi":{"hypothesis":"The GOGC environment check is startup-only, but after latest changes an unconditional SetGCPercent(300) might be faster and simpler","result":"Median regressed from 30.928ms to 31.869ms; preserving the GOGC check remains better and safer","rollback_reason":"Primary metric worsened","next_action_hint":"Keep generated runtime GC tuning conditional on GOGC being unset."}}
{"run":170,"commit":"39ff371","metric":32.046458,"metrics":{"build_ms":3729.965,"vm_output":29678473,"go_output":29678473,"binary_size_bytes":22956482},"status":"discard","description":"Lower ignored-key map loops through MapValues","timestamp":1777358559238,"segment":0,"confidence":8.055159738003816,"iterationTokens":3114,"asi":{"hypothesis":"For map loops where the key binding is ignored, generating a sorted values slice can move key lookup out of the loop body and simplify generated code while preserving deterministic key order","result":"Median regressed from 30.928ms to 32.046ms and binary grew; extra values slice allocation and helper overhead dominate","rollback_reason":"Primary metric worsened","next_action_hint":"Keep ignored-key map loops using MapKeys plus map lookup in the generated loop."}}
{"run":171,"commit":"39ff371","metric":31.698375,"metrics":{"build_ms":3554.029,"vm_output":29678473,"go_output":29678473,"binary_size_bytes":22956322},"status":"discard","description":"Cap-limit typed int-list fast path","timestamp":1777358603866,"segment":0,"confidence":8.171461144687738,"iterationTokens":1155,"asi":{"hypothesis":"Returning typed[:len:len] from DecodeIntListErrorsExtern may reduce append aliasing risk for already-typed []int inputs without copying","result":"Median regressed from 30.928ms to 31.698ms; full-slice expression hurts codegen and still aliases elements","rollback_reason":"Primary metric worsened","next_action_hint":"Keep the plain typed []int return if accepting the aliasing fast path, or copy/revert it for semantic reasons outside the perf loop."}}
{"run":172,"commit":"4454609","metric":31.289583,"metrics":{"build_ms":3615.304,"vm_output":29678473,"go_output":29678473,"binary_size_bytes":22956322},"status":"discard","description":"Use GC target 275 for generated runtime","timestamp":1777358653759,"segment":0,"confidence":8.18949268795272,"iterationTokens":1350,"asi":{"hypothesis":"A GC target slightly below 300 may reduce memory growth while retaining the throughput benefit after latest decoder changes","result":"Median regressed from 30.928ms to 31.290ms; target 300 remains best tested","rollback_reason":"Primary metric worsened","next_action_hint":"Keep default generated runtime GC target at 300."}}
