{"run":72,"commit":"d9c818d","metric":36.592584,"metrics":{"build_ms":3952.234,"vm_output":29678473,"go_output":29678473,"binary_size_bytes":22952978},"status":"keep","description":"Emit direct primitive-to-Dynamic extern bodies","timestamp":1777352899941,"segment":0,"confidence":16.80534297769741,"iterationTokens":3159,"asi":{"hypothesis":"After decode.map switched to string-key maps, each key is wrapped with Dyn::from_str; direct-emitting primitive Dynamic conversion externs avoids CallExtern registry dispatch on every map key and helps other generated Go programs too","result":"Median improved from 38.94ms to 36.59ms (~6.0%) with checks passing and slightly smaller binary","why_it_worked":"dynamic.FromStr now compiles to `return val` instead of CallExtern+CoerceExtern; decode_pipeline calls this for every decoded map key","scope":"General Go backend direct extern emission for Str/Int/Float/Bool/Void-to-Dynamic conversions","risk":"Backend now knows more builtin extern bindings; keep direct behavior in sync with ard/dynamic stdlib and runtime semantics","next_action_hint":"Consider direct-emitting ListToDynamic/MapToDynamic only if benchmarks use encode/dynamic construction; decode_pipeline likely does not."}}
{"run":73,"commit":"1078a7b","metric":36.4895,"metrics":{"build_ms":3547.245,"vm_output":29678473,"go_output":29678473,"binary_size_bytes":22953042},"status":"keep","description":"Fast-path raw map[string]any in DynamicToStringMapExtern","timestamp":1777352936203,"segment":0,"confidence":16.45493072960967,"iterationTokens":1502,"asi":{"hypothesis":"DynamicToStringMapExtern hot inputs are already raw JSON map[string]any values, so checking that before builtinDynamicValue avoids an extra raw-type switch/Encodable assertion","result":"Median improved from 36.59ms to 36.49ms with checks passing; binary grew by 64 bytes","why_it_worked":"decode.map now calls DynamicToStringMapExtern for counts; the common raw JSON object path can return immediately","scope":"General fast path for string-key Dynamic map decoding in generated Go","next_action_hint":"Try similar raw map[string]any fast path in ExtractFieldExtern, which also receives JSON objects for field lookups, although prior ExtractField inlining regressed."}}
{"run":74,"commit":"1078a7b","metric":36.528334,"metrics":{"build_ms":3531.173,"vm_output":29678473,"go_output":29678473,"binary_size_bytes":22953106},"status":"discard","description":"Fast-path raw map[string]any in ExtractFieldExtern","timestamp":1777352964964,"segment":0,"confidence":16.314992315215886,"iterationTokens":1130,"asi":{"hypothesis":"ExtractFieldExtern hot inputs are raw JSON map[string]any objects for units/weights/counts field access, so checking that before builtinDynamicValue may avoid raw-type switch overhead","result":"Median regressed slightly from 36.49ms to 36.53ms and binary grew; prior ExtractField inlining/regression pattern still holds","rollback_reason":"Primary metric worsened","next_action_hint":"Keep ExtractFieldExtern as a wrapper around builtinExtractField; do not duplicate its raw map path."}}
{"run":75,"commit":"1078a7b","metric":36.604334,"metrics":{"build_ms":3559.394,"vm_output":29678473,"go_output":29678473,"binary_size_bytes":22953026},"status":"discard","description":"Use direct Result literal in DynamicToStringMapExtern fast path","timestamp":1777352994253,"segment":0,"confidence":16.17741399895281,"iterationTokens":1049,"asi":{"hypothesis":"The new hot DynamicToStringMapExtern raw map fast path can avoid an Ok constructor by returning a direct Result literal inside ardgo","result":"Median regressed from 36.49ms to 36.60ms; Ok constructor codegen remains better for this helper","rollback_reason":"Primary metric worsened","next_action_hint":"Keep Ok constructor in DynamicToStringMapExtern fast path."}}
{"run":76,"commit":"1078a7b","metric":36.637166,"metrics":{"build_ms":3614.081,"vm_output":29678473,"go_output":29678473,"binary_size_bytes":22953042},"status":"discard","description":"Limit direct Dynamic conversion extern emission to StrToDynamic","timestamp":1777353026509,"segment":0,"confidence":16.28995172099294,"iterationTokens":1293,"asi":{"hypothesis":"decode_pipeline only uses Dyn::from_str after the string-key map change, so restricting direct Dynamic conversion emission to StrToDynamic might reduce unused generated code and improve runtime/code size","result":"Median regressed from 36.49ms to 36.64ms; keeping all primitive/Void direct Dynamic conversions is better or noise favors the broader shape","rollback_reason":"Primary metric worsened","next_action_hint":"Keep direct emission for all primitive/Void-to-Dynamic externs."}}
{"run":77,"commit":"1078a7b","metric":36.548666,"metrics":{"build_ms":3579.872,"vm_output":29678473,"go_output":29678473,"binary_size_bytes":22952978},"status":"discard","description":"Lower primitive Dynamic constructors as Go intrinsics","timestamp":1777353137318,"segment":0,"confidence":16.404066142244847,"iterationTokens":11880,"asi":{"hypothesis":"Inlining Dyn::from_str at lowering time should remove the generated dynamic.FromStr function call and reduce boxing/allocation in decode.map key decoding","result":"Median regressed from 36.49ms to 36.55ms despite smaller binary; direct module-call lowering did not improve runtime","rollback_reason":"Primary metric worsened","next_action_hint":"Keep direct extern bodies in ard/dynamic but do not lower dynamic constructors as expression intrinsics."}}
{"run":78,"commit":"d87e7ad","metric":36.518,"metrics":{"build_ms":3732.581,"vm_output":29678473,"go_output":29678473,"binary_size_bytes":22953042},"status":"discard","description":"Preallocate empty list binds before append loops","timestamp":1777353301990,"segment":0,"confidence":16.26438251998416,"iterationTokens":12599,"asi":{"hypothesis":"decode.list appends a known raw list length into an initially empty output list; a backend peephole can emit make([]T,0,len(raw)) for empty list binds that are appended inside following for-in-list loops","result":"Median regressed slightly from 36.49ms to 36.52ms; direct preallocation did not overcome extra make/capacity overhead for 12-element lists","rollback_reason":"Primary metric worsened","next_action_hint":"Do not pursue list preallocation for this workload unless deeper allocation profiling shows a narrower profitable pattern."}}
{"run":79,"commit":"d87e7ad","metric":36.543042,"metrics":{"build_ms":3509.398,"vm_output":29678473,"go_output":29678473,"binary_size_bytes":22953042},"status":"discard","description":"Remove map[any]any from builtinDynamicValue raw fast path","timestamp":1777353346617,"segment":0,"confidence":16.12705767546202,"iterationTokens":1408,"asi":{"hypothesis":"After decode.map switched to string-key maps, map[any]any is no longer hot in builtinDynamicValue; removing it from the raw type switch may shrink the common switch path","result":"Median regressed from 36.49ms to 36.54ms; keeping map[any]any in the raw fast path remains better or neutral","rollback_reason":"Primary metric worsened","next_action_hint":"Keep the existing builtinDynamicValue raw type set."}}
{"run":80,"commit":"197feea","metric":35.584542,"metrics":{"build_ms":3692.23,"vm_output":29678473,"go_output":29678473,"binary_size_bytes":22954738},"status":"keep","description":"Add scalar decode externs that return error lists directly","timestamp":1777353476773,"segment":0,"confidence":15.981527927389012,"iterationTokens":7689,"asi":{"hypothesis":"decode.string and decode.int immediately wrap scalar decode errors into single-element error lists; dedicated builtins returning Result[T, []Error] can avoid the intermediate Result[T, Error], try/ExpectRef success unwrap, and Ok rewrap on hot scalar decode paths","result":"Median improved from 36.49ms to 35.58ms (~2.5%) with checks passing; binary grew ~1.7KB","why_it_worked":"decode_pipeline decodes many ints and map string keys; generated decode.String/Int now delegate to direct DecodeStringErrors/DecodeIntErrors externs instead of try-wrapping DecodeString/DecodeInt","scope":"General stdlib scalar decoder optimization for Go, JS, and VM support; existing Error-returning private decoders remain for from_json raw Dynamic handling","risk":"Adds additional FFI surface and backend direct cases that must stay consistent with decode Error shape","next_action_hint":"Try analogous DecodeFloatErrors/DecodeBoolErrors for completeness only if broader benchmarks use them; decode_pipeline likely unaffected."}}
{"run":81,"commit":"c479e9b","metric":35.075791,"metrics":{"build_ms":3493.674,"vm_output":29678473,"go_output":29678473,"binary_size_bytes":22954354},"status":"keep","description":"Use direct Result literals in scalar error-list decode externs","timestamp":1777353520171,"segment":0,"confidence":16.01208034573447,"iterationTokens":2204,"asi":{"hypothesis":"The new DecodeStringErrors/DecodeIntErrors helpers are hot and live inside ardgo, so direct Result literals can avoid generic Ok/Err constructor overhead on successful scalar decodes","result":"Median improved from 35.58ms to 35.08ms (~1.4%) with checks passing and binary size down ~384 bytes","why_it_worked":"Unlike some broader literal rewrites, these helpers are tiny and directly on the hot string/int decode success paths","scope":"Only the scalar error-list helper functions use direct literals; existing generic constructors remain unchanged","next_action_hint":"Evaluate whether DecodeIntErrors can drop uncommon raw int/int64 fallback cases from its fast helper like DecodeIntExtern did."}}
{"run":82,"commit":"8d35d67","metric":34.998583,"metrics":{"build_ms":3706.626,"vm_output":29678473,"go_output":29678473,"binary_size_bytes":22954354},"status":"keep","description":"Avoid string-to-byte copy in JsonToDynamic","timestamp":1777353584496,"segment":0,"confidence":15.681102901099113,"iterationTokens":3396,"asi":{"hypothesis":"JsonToDynamic allocates and copies []byte(jsonString) on every parse; using an unsafe read-only byte slice view of the string can remove that allocation while preserving json/v2 parsing semantics","result":"Median improved from 35.08ms to 35.00ms with checks passing and unchanged binary size","why_it_worked":"decode_pipeline parses the same JSON string every iteration; avoiding the string-to-byte copy reduces per-parse allocation/copy overhead without caching or changing parsed values","risk":"Relies on encoding/json/v2 not mutating the input byte slice; this is expected for unmarshal but uses unsafe and should be reviewed carefully","next_action_hint":"Inspect allocation profile again; remaining dominant allocations are json/v2 object/array creation, list outputs, MapKeys, and Dyn::from_str boxing."}}
{"run":83,"commit":"ba76c2d","metric":34.905125,"metrics":{"build_ms":3468.691,"vm_output":29678473,"go_output":29678473,"binary_size_bytes":22954834},"status":"keep","description":"Split scalar error-list decode slow paths","timestamp":1777353651175,"segment":0,"confidence":15.355007108896347,"iterationTokens":4677,"asi":{"hypothesis":"DecodeStringErrors/DecodeIntErrors are too complex to inline on the shape instantiation; moving Encodable/error fallback work to slow helpers can keep hot raw string/float64 success paths smaller","result":"Median improved from 35.00ms to 34.91ms with checks passing; binary grew ~480 bytes","why_it_worked":"Hot scalar error-list decodes almost always hit the first raw string/float64 check, so smaller fast helpers offset the extra slow helper code","risk":"Adds generic slow helper functions and may hurt workloads dominated by failed or Encodable scalar decodes","next_action_hint":"Check gc inlining for the shape helpers; consider applying a similar split to DecodeStringExtern/DecodeIntExtern only if prior regressions no longer apply after current changes."}}
{"run":84,"commit":"ba76c2d","metric":34.943375,"metrics":{"build_ms":3468.662,"vm_output":29678473,"go_output":29678473,"binary_size_bytes":22954834},"status":"discard","description":"Mark scalar error-list slow helpers noinline","timestamp":1777353699389,"segment":0,"confidence":14.834178027773264,"iterationTokens":3500,"asi":{"hypothesis":"The scalar error-list fast helpers are just over the shape inlining budget; marking slow fallback helpers noinline may reduce inliner cost or improve hot code layout","result":"Median regressed from 34.91ms to 34.94ms; noinline annotation did not help","rollback_reason":"Primary metric worsened","next_action_hint":"Keep slow helper split without noinline annotations."}}
{"run":85,"commit":"ba76c2d","metric":35.098708,"metrics":{"build_ms":3559.915,"vm_output":29678473,"go_output":29678473,"binary_size_bytes":22954962},"status":"discard","description":"Inline scalar error-list raw success in generated extern wrappers","timestamp":1777353766876,"segment":0,"confidence":14.347522004181942,"iterationTokens":3588,"asi":{"hypothesis":"Generated decode.String/Int wrappers can check raw string/float64 and return Ok before calling ardgo.DecodeStringErrorsExtern/DecodeIntErrorsExtern, avoiding the non-inlined ardgo shape helper on hot success paths","result":"Median regressed from 34.91ms to 35.10ms; duplicating raw success checks in generated wrappers worsened codegen and binary size","rollback_reason":"Primary metric worsened","next_action_hint":"Keep scalar error-list raw success logic centralized in ardgo helpers."}}
{"run":86,"commit":"ba76c2d","metric":35.0385,"metrics":{"build_ms":3479.914,"vm_output":29678473,"go_output":29678473,"binary_size_bytes":22954658},"status":"discard","description":"Use type switch in DecodeStringErrorsExtern fast path","timestamp":1777353810806,"segment":0,"confidence":13.518638652207587,"iterationTokens":1180,"asi":{"hypothesis":"A one-case type switch may reduce inliner cost or improve codegen for the DecodeStringErrorsExtern raw string fast path compared with comma-ok assertion","result":"Median regressed from 34.91ms to 35.04ms; type switch did not help","rollback_reason":"Primary metric worsened","next_action_hint":"Keep comma-ok string assertion in DecodeStringErrorsExtern."}}
{"run":87,"commit":"ba76c2d","metric":35.055,"metrics":{"build_ms":3510.236,"vm_output":29678473,"go_output":29678473,"binary_size_bytes":22954834},"status":"discard","description":"Collapse DecodeIntErrorsExtern float64 integer check","timestamp":1777353842224,"segment":0,"confidence":12.508744084304436,"iterationTokens":1156,"asi":{"hypothesis":"Combining the float64 assertion and integer equality check into one condition may reduce branch/inliner overhead in the hot int error-list decoder","result":"Median regressed from 34.91ms to 35.06ms; double int conversion/condition shape is worse","rollback_reason":"Primary metric worsened","next_action_hint":"Keep DecodeIntErrorsExtern using a named intValue temporary."}}
{"run":88,"commit":"ba76c2d","metric":35.047042,"metrics":{"build_ms":3377.782,"vm_output":29678473,"go_output":29678473,"binary_size_bytes":22954834},"status":"discard","description":"Remove now-unused private decode int extern from stdlib","timestamp":1777353901635,"segment":0,"confidence":12.475211837487938,"iterationTokens":1325,"asi":{"hypothesis":"After public decode.int switched to DecodeIntErrors, the private _decode_int extern is unused; removing it may reduce generated package work or binary size","result":"Median regressed from 34.91ms to 35.05ms and binary size was unchanged; dead code was already eliminated or irrelevant","rollback_reason":"Primary metric worsened","next_action_hint":"Keep stdlib extern definitions for clarity unless broader cleanup is desired outside the performance loop."}}
{"run":89,"commit":"ba76c2d","metric":35.234584,"metrics":{"build_ms":3490.265,"vm_output":29678473,"go_output":29678473,"binary_size_bytes":22954930},"status":"discard","description":"Use Ok constructor in DecodeStringErrorsExtern fast path","timestamp":1777353938602,"segment":0,"confidence":12.400239797504327,"iterationTokens":1153,"asi":{"hypothesis":"Using the generic Ok constructor in the split DecodeStringErrorsExtern fast path might lower inliner cost enough to offset constructor overhead","result":"Median regressed from 34.91ms to 35.23ms and binary grew; direct Result literal remains better","rollback_reason":"Primary metric worsened","next_action_hint":"Keep direct Result literals in scalar error-list fast paths."}}
{"run":90,"commit":"ba76c2d","metric":35.729875,"metrics":{"build_ms":3672.852,"vm_output":29678473,"go_output":29678473,"binary_size_bytes":22954834},"status":"discard","description":"Unmarshal top-level JSON objects into map[string]any directly","timestamp":1777353988228,"segment":0,"confidence":12.199346854096607,"iterationTokens":1368,"asi":{"hypothesis":"Most decode inputs are JSON objects; detecting a top-level `{` and unmarshalling into map[string]any directly might avoid interface destination overhead while preserving non-object fallback behavior","result":"Median regressed badly from 34.91ms to 35.73ms; the leading-byte scan and/or map target path is slower than unmarshalling into any","rollback_reason":"Primary metric worsened","next_action_hint":"Keep JsonToDynamic unmarshalling into any with unsafe string bytes; do not special-case top-level objects this way."}}
{"run":91,"commit":"cac798e","metric":35.016417,"metrics":{"build_ms":3694.711,"vm_output":29678473,"go_output":29678473,"binary_size_bytes":22954834},"status":"discard","description":"Inline unsafe string byte view in JsonToDynamic","timestamp":1777354128289,"segment":0,"confidence":12.004859362570206,"iterationTokens":1368,"asi":{"hypothesis":"Inlining unsafe.Slice/StringData in JsonToDynamic may avoid a helper call/empty-string branch before json/v2 unmarshal","result":"Median regressed from 34.91ms to 35.02ms; helper was already inlined or empty guard helps codegen","rollback_reason":"Primary metric worsened","next_action_hint":"Keep unsafeStringBytes helper for JsonToDynamic."}}
{"run":92,"commit":"cac798e","metric":34.944792,"metrics":{"build_ms":3590.321,"vm_output":29678473,"go_output":29678473,"binary_size_bytes":22954834},"status":"discard","description":"Emit nil slices for empty list literals","timestamp":1777354216638,"segment":0,"confidence":11.424015351098614,"iterationTokens":5714,"asi":{"hypothesis":"Many generated decode success paths initialize empty output/error lists; emitting []T(nil) instead of []T{} may reduce empty slice literal overhead while preserving len/append behavior","result":"Median regressed from 34.91ms to 34.94ms; no runtime benefit and nil slice semantics are riskier for JSON/interop","rollback_reason":"Primary metric worsened","next_action_hint":"Keep empty list literals as []T{}."}}
{"run":93,"commit":"cac798e","metric":35.042166,"metrics":{"build_ms":3523.378,"vm_output":29678473,"go_output":29678473,"binary_size_bytes":22954594},"status":"discard","description":"Replace RegisterBuiltinExterns sync.Once with plain guard","timestamp":1777354286486,"segment":0,"confidence":10.896784515726202,"iterationTokens":5077,"asi":{"hypothesis":"Generated Go programs call RegisterBuiltinExterns during startup; replacing sync.Once with a simple boolean guard may reduce startup overhead and binary size for single-threaded registration","result":"Median regressed from 34.91ms to 35.04ms despite smaller binary; sync.Once is not a profitable bottleneck and the simple guard loses thread-safety","rollback_reason":"Primary metric worsened and safety degraded","next_action_hint":"Keep sync.Once registration guard."}}
{"run":94,"commit":"3d0327f","metric":34.874,"metrics":{"build_ms":3528.894,"vm_output":29678473,"go_output":29678473,"binary_size_bytes":22954834},"status":"keep","description":"Fast-path raw string maps inside builtinExtractField","timestamp":1777354352206,"segment":0,"confidence":10.289274845697,"iterationTokens":2815,"asi":{"hypothesis":"ExtractField still calls builtinDynamicValue before checking the common JSON object map[string]any path; moving that raw map lookup inside builtinExtractField can avoid the Dynamic raw-type switch on field access without duplicating the extern wrapper","result":"Median improved slightly from 34.91ms to 34.87ms with checks passing","why_it_worked":"decode_pipeline extracts units, weights, and counts from raw JSON objects every iteration; the builtin now handles that map shape immediately","scope":"General Go decode field extraction fast path for raw map[string]any Dynamic values","risk":"Adds a duplicated map[string]any branch before the generic Dynamic conversion fallback; semantics preserved for Encodable and other map shapes","next_action_hint":"Try similar raw []any precheck inside builtinDynamicToList rather than in the extern wrapper, since list decoding still calls builtinDynamicValue before the common JSON array path."}}
{"run":95,"commit":"3d0327f","metric":35.508583,"metrics":{"build_ms":3504.672,"vm_output":29678473,"go_output":29678473,"binary_size_bytes":22954834},"status":"discard","description":"Fast-path raw lists inside builtinDynamicToList","timestamp":1777354402943,"segment":0,"confidence":9.753712740098539,"iterationTokens":1664,"asi":{"hypothesis":"DynamicToList also receives raw JSON []any arrays; checking that inside builtinDynamicToList before builtinDynamicValue may avoid the raw-type switch on list decode","result":"Median regressed badly from 34.87ms to 35.51ms; duplicating the raw []any branch hurts codegen/noise despite matching the workload","rollback_reason":"Primary metric worsened","next_action_hint":"Keep builtinDynamicToList's existing builtinDynamicValue-first shape; do not retry raw []any prechecks."}}
