{"run":299,"commit":"6bd6b8b","metric":11.345042,"metrics":{"build_ms":3719.101,"vm_output":29678473,"go_output":29678473,"binary_size_bytes":22974050},"status":"discard","description":"Recheck ok-first Result expect branches","timestamp":1777367210379,"segment":0,"confidence":1.1028876008876094,"iterationTokens":1309,"asi":{"hypothesis":"After decode_pipeline became dominated by successful Result expects, returning on ok first in Expect/ExpectRef may improve branch prediction/layout","result":"Median regressed from 11.066ms to 11.345ms; existing !ok panic branch remains better","rollback_reason":"Primary metric worsened","next_action_hint":"Keep current Result Expect/ExpectRef branch order."}}
{"run":300,"commit":"1327cb1","metric":11.676083,"metrics":{"build_ms":3713.658,"vm_output":29678473,"go_output":29678473,"binary_size_bytes":22974050},"status":"discard","description":"Recheck GC target 200 after strict integer fixes","timestamp":1777367322840,"segment":0,"confidence":1.101404606561458,"iterationTokens":3123,"asi":{"hypothesis":"After strict integer validation changes shifted runtime costs, a lower GOGC target might be competitive and reduce memory risk","result":"Median regressed from 11.066ms to 11.676ms; target 300 remains best","rollback_reason":"Primary metric worsened","next_action_hint":"Keep generated Go default GOGC at 300."}}
