{"run":271,"commit":"b56d54a","metric":11.068291,"metrics":{"build_ms":3687.363,"vm_output":29678473,"go_output":29678473,"binary_size_bytes":22973970},"status":"keep","description":"Separate zero and nonzero lazy integer parsing","timestamp":1777365211551,"segment":0,"confidence":1.2342293980295003,"iterationTokens":2086,"asi":{"hypothesis":"The leading-zero correctness check added an extra branch to every positive integer; splitting the zero case from the nonzero digit path should preserve validation while recovering hot-path speed","result":"Median improved from 11.495ms to 11.068ms with checks passing","why_it_worked":"Benchmark integers are nonzero positives, so the hot parser path no longer tests s[idx]=='0' inside the general digit branch while still rejecting leading-zero forms","scope":"Strict lazy JSON integer parser","risk":"Still slower than pre-correctness best; keep searching for lower-overhead validation","next_action_hint":"Try analogous negative zero restructuring or validating leading zeros in typed scanners only if correctness tests remain."}}
{"run":272,"commit":"b56d54a","metric":11.454792,"metrics":{"build_ms":3674.862,"vm_output":29678473,"go_output":29678473,"binary_size_bytes":22973970},"status":"discard","description":"Cache first byte in lazy integer parser","timestamp":1777365289045,"segment":0,"confidence":1.2293198896712116,"iterationTokens":4316,"asi":{"hypothesis":"Caching s[idx] in parseLazyJSONIntAt may avoid repeated indexing in the top-level digit/zero/negative branch checks","result":"Median regressed from 11.068ms to 11.455ms; repeated direct indexing compiles better","rollback_reason":"Primary metric worsened","next_action_hint":"Keep current parseLazyJSONIntAt branch checks."}}
{"run":273,"commit":"51115a9","metric":11.043875,"metrics":{"build_ms":3666.772,"vm_output":29678473,"go_output":29678473,"binary_size_bytes":22974050},"status":"keep","description":"Split slow lazy integer parsing paths","timestamp":1777365346771,"segment":0,"confidence":1.2237866140706948,"iterationTokens":2842,"asi":{"hypothesis":"Moving zero/negative/float fallback handling into a slow helper can keep the nonzero positive integer path smaller while preserving leading-zero validation","result":"Median improved slightly from 11.068ms to 11.044ms with checks passing","why_it_worked":"The hot typed JSON cache sees nonzero positive integers; the slower correctness-heavy cases now sit behind parseLazyJSONIntSlow","scope":"Strict lazy JSON integer parser layout","risk":"Small improvement and binary grew modestly; still above pre-correctness runtime","next_action_hint":"Try noinline/inline-shape changes to the slow helper only if checks remain stable."}}
{"run":274,"commit":"51115a9","metric":12.030167,"metrics":{"build_ms":3677.622,"vm_output":29678473,"go_output":29678473,"binary_size_bytes":22974050},"status":"discard","description":"Noinline slow lazy integer parser","timestamp":1777365385975,"segment":0,"confidence":1.2020763376460388,"iterationTokens":1042,"asi":{"hypothesis":"Marking the zero/negative/float lazy integer slow path noinline may keep the hot positive parser smaller","result":"Median regressed from 11.044ms to 12.030ms; Go's default inlining decisions are better","rollback_reason":"Primary metric worsened","next_action_hint":"Do not mark parseLazyJSONIntSlow noinline."}}
{"run":275,"commit":"edf3fdc","metric":11.008541,"metrics":{"build_ms":3638.193,"vm_output":29678473,"go_output":29678473,"binary_size_bytes":22974050},"status":"keep","description":"Inline value-end switch in positive integer parser","timestamp":1777365440123,"segment":0,"confidence":1.184269402587467,"iterationTokens":1223,"asi":{"hypothesis":"The hot positive integer parser calls isJSONValueEnd once per value at delimiters; inlining that small delimiter switch in the hot branch may reduce call/branch overhead","result":"Median improved slightly from 11.044ms to 11.009ms with checks passing","why_it_worked":"All benchmark typed-cache integers are positive and hit the delimiter branch, so keeping the delimiter switch local improves layout marginally","scope":"Strict lazy JSON positive integer parser","risk":"Small near-noise improvement; duplicated delimiter logic must stay consistent with isJSONValueEnd","next_action_hint":"Consider similar layout only where the hot path demonstrably benefits."}}
{"run":276,"commit":"edf3fdc","metric":11.851166,"metrics":{"build_ms":3798.234,"vm_output":29678473,"go_output":29678473,"binary_size_bytes":22974050},"status":"discard","description":"Limit integer parser start variable to hot branch","timestamp":1777365496988,"segment":0,"confidence":1.1780918679509376,"iterationTokens":1986,"asi":{"hypothesis":"The positive integer hot path rarely needs the original start offset except for fallback; scoping start to that branch may reduce live state","result":"Median regressed from 11.009ms to 11.851ms; original start variable placement compiles much better","rollback_reason":"Primary metric worsened","next_action_hint":"Keep start initialized before integer branch checks."}}
{"run":277,"commit":"edf3fdc","metric":11.353458,"metrics":{"build_ms":3736.328,"vm_output":29678473,"go_output":29678473,"binary_size_bytes":22974050},"status":"discard","description":"Validate leading zeros after digit scan","timestamp":1777365551571,"segment":0,"confidence":1.1719784469392864,"iterationTokens":2122,"asi":{"hypothesis":"A unified digit loop with leading-zero validation at delimiter/fallback may recover the simpler pre-correctness hot branch while preserving strict number syntax","result":"Median regressed from 11.009ms to 11.353ms; post-scan leading-zero checks are worse than the split zero/nonzero parser","rollback_reason":"Primary metric worsened","next_action_hint":"Keep separate nonzero and zero branches in parseLazyJSONIntAt."}}
{"run":278,"commit":"9c79e93","metric":11.641541,"metrics":{"build_ms":3665.15,"vm_output":29678473,"go_output":29678473,"binary_size_bytes":22973970},"status":"discard","description":"Bulk-register builtin externs under one lock","timestamp":1777365680201,"segment":0,"confidence":1.172173876169959,"iterationTokens":4222,"asi":{"hypothesis":"Generated program startup registers many builtin externs; replacing per-extern RegisterExtern lock/defer calls with a single bulk lock could reduce startup overhead","result":"Median regressed from 11.009ms to 11.642ms; local register closure / code layout is worse","rollback_reason":"Primary metric worsened","next_action_hint":"Keep existing RegisterExtern calls despite startup cost."}}
{"run":279,"commit":"9c79e93","metric":11.831917,"metrics":{"build_ms":3636.429,"vm_output":29678473,"go_output":29678473,"binary_size_bytes":22974050},"status":"discard","description":"Disable default GC for generated Go","timestamp":1777365732065,"segment":0,"confidence":1.1723693705877578,"iterationTokens":1472,"asi":{"hypothesis":"After lazy JSON reduced allocations, disabling GC by default might remove residual collection overhead for short-lived generated programs","result":"Median regressed from 11.009ms to 11.832ms and memory risk would be high","rollback_reason":"Primary metric worsened and disabling GC is a poor general default","next_action_hint":"Keep default GC target 300."}}
{"run":280,"commit":"9c79e93","metric":11.162208,"metrics":{"build_ms":3830.218,"vm_output":29678473,"go_output":29678473,"binary_size_bytes":22973986},"status":"discard","description":"Direct-emit Print extern body in generated Go","timestamp":1777365827284,"segment":0,"confidence":1.1543663634922559,"iterationTokens":5948,"asi":{"hypothesis":"Generated programs often print once at the end; direct-emitting the Print extern body can avoid a CallExtern registry lookup on startup/output path","result":"Median regressed from 11.009ms to 11.162ms and build/binary grew; the single lookup is not the bottleneck","rollback_reason":"Primary metric worsened","next_action_hint":"Keep Print through normal extern registry for now."}}
{"run":281,"commit":"dcb9fd5","metric":12.21675,"metrics":{"build_ms":3713.773,"vm_output":29678473,"go_output":29678473,"binary_size_bytes":22974050},"status":"discard","description":"Reorder positive integer delimiter switch","timestamp":1777365904291,"segment":0,"confidence":1.134789546032532,"iterationTokens":2073,"asi":{"hypothesis":"The typed integer parser sees array closing ']' more often than object closing '}', so ordering the delimiter switch as comma, bracket, brace may improve branch layout","result":"Median regressed from 11.009ms to 12.217ms; original delimiter switch order is much better","rollback_reason":"Primary metric worsened","next_action_hint":"Keep comma, brace, bracket delimiter ordering."}}
{"run":282,"commit":"f760064","metric":11.351084,"metrics":{"build_ms":3771.622,"vm_output":29678473,"go_output":29678473,"binary_size_bytes":22974050},"status":"discard","description":"Inline positive integer parsing in typed array scanner","timestamp":1777366014969,"segment":0,"confidence":1.1343639591091954,"iterationTokens":2073,"asi":{"hypothesis":"Validation-time typed array parsing handles many positive integers; inlining the hot positive parser inside scanJSONIntArray may avoid per-item helper calls","result":"Median regressed from 11.009ms to 11.351ms; duplicated inline parser worsens code shape","rollback_reason":"Primary metric worsened","next_action_hint":"Keep shared parseLazyJSONIntAt in typed array scanner."}}
{"run":283,"commit":"f760064","metric":11.527459,"metrics":{"build_ms":3744.354,"vm_output":29678473,"go_output":29678473,"binary_size_bytes":22974050},"status":"discard","description":"Use type switch in lazy field extraction","timestamp":1777366065761,"segment":0,"confidence":1.132832057929185,"iterationTokens":1751,"asi":{"hypothesis":"After lazy object typed caching, builtinExtractField is mostly a *jsonObjectDynamic assertion; a type switch may improve dispatch/layout versus sequential assertions","result":"Median regressed from 11.009ms to 11.527ms; sequential assertions remain faster","rollback_reason":"Primary metric worsened","next_action_hint":"Keep existing builtinExtractField branch shape."}}
{"run":284,"commit":"f760064","metric":11.355958,"metrics":{"build_ms":3740.553,"vm_output":29678473,"go_output":29678473,"binary_size_bytes":22974050},"status":"discard","description":"Store typed int-array caches inside lazy object","timestamp":1777366146660,"segment":0,"confidence":1.1268143841931981,"iterationTokens":2176,"asi":{"hypothesis":"Validation-time typed int arrays currently allocate backing slices; storing fixed 12-int arrays inside the lazy object and returning slices over them may reduce allocations","result":"Median regressed from 11.009ms to 11.356ms; larger lazy object and extra fixed-array handling outweigh allocation savings","rollback_reason":"Primary metric worsened","next_action_hint":"Keep separately allocated make([]int,0,12) typed array caches."}}
{"run":285,"commit":"f760064","metric":11.444167,"metrics":{"build_ms":3699.058,"vm_output":29678473,"go_output":29678473,"binary_size_bytes":22974050},"status":"discard","description":"Assign lazy object raw field after allocation","timestamp":1777366197084,"segment":0,"confidence":1.1208603051461081,"iterationTokens":1299,"asi":{"hypothesis":"Constructing jsonObjectDynamic with a zero literal then assigning raw may reduce composite literal setup costs","result":"Median regressed from 11.009ms to 11.444ms; composite literal is better","rollback_reason":"Primary metric worsened","next_action_hint":"Keep &jsonObjectDynamic{raw: jsonDynamic(s)}."}}
{"run":286,"commit":"757b2ab","metric":11.33575,"metrics":{"build_ms":3672.46,"vm_output":29678473,"go_output":29678473,"binary_size_bytes":22974050},"status":"keep","description":"Reject sign-only numbers in typed lazy JSON caches","timestamp":1777366263084,"segment":0,"confidence":1.1188036968712594,"iterationTokens":1543,"asi":{"hypothesis":"Typed validation-time int caches must reject malformed negative numbers like '-' in arrays/maps, matching strict JSON validation semantics","result":"Metric regressed from 11.009ms to 11.336ms, but this fixes a correctness bug in typed-cache validation; checks and new tests pass","why_kept_despite_metric":"The optimization must not accept invalid JSON that json/v2 would reject","scope":"Strict lazy JSON typed integer parser slow path","risk":"Benchmark metric slower; this branch affects slow negative parsing only, so regression may be noise/code layout","next_action_hint":"Seek layout changes to recover correctness cost without weakening validation."}}
{"run":287,"commit":"757b2ab","metric":11.635292,"metrics":{"build_ms":3656.888,"vm_output":29678473,"go_output":29678473,"binary_size_bytes":22974114},"status":"discard","description":"Split negative lazy integer slow path","timestamp":1777366311799,"segment":0,"confidence":1.1167546219010491,"iterationTokens":1698,"asi":{"hypothesis":"Moving negative integer validation into its own helper may isolate sign-only correctness checks from the positive hot path layout","result":"Median regressed from 11.336ms to 11.635ms and binary grew; extra helper is worse","rollback_reason":"Primary metric worsened","next_action_hint":"Keep negative handling inside parseLazyJSONIntSlow."}}
{"run":288,"commit":"757b2ab","metric":11.354958,"metrics":{"build_ms":3688.307,"vm_output":29678473,"go_output":29678473,"binary_size_bytes":22974050},"status":"discard","description":"Split negative digit validation branches","timestamp":1777366420961,"segment":0,"confidence":1.1164861738984841,"iterationTokens":4915,"asi":{"hypothesis":"Separating the negative-number bounds check from digit validation may improve slow-path code layout after sign-only correctness fix","result":"Median regressed slightly from 11.336ms to 11.355ms","rollback_reason":"Primary metric worsened","next_action_hint":"Keep combined negative digit validation branch."}}
{"run":289,"commit":"757b2ab","metric":11.805125,"metrics":{"build_ms":3728.744,"vm_output":29678473,"go_output":29678473,"binary_size_bytes":22974050},"status":"discard","description":"Use six-slot typed map duplicate tracker","timestamp":1777366474396,"segment":0,"confidence":1.1162658047440834,"iterationTokens":1097,"asi":{"hypothesis":"Six duplicate-tracker slots may balance the previous 4-slot regression and 8-slot hot scanner size for typed string-int map caches","result":"Median regressed from 11.336ms to 11.805ms; eight slots remains better","rollback_reason":"Primary metric worsened","next_action_hint":"Keep eight-slot typed string-int map duplicate tracker."}}
{"run":290,"commit":"757b2ab","metric":11.662125,"metrics":{"build_ms":3710.477,"vm_output":29678473,"go_output":29678473,"binary_size_bytes":22974050},"status":"discard","description":"Move lazy object count before field arrays","timestamp":1777366529252,"segment":0,"confidence":1.1150810881426594,"iterationTokens":1049,"asi":{"hypothesis":"builtinExtractField checks count before scanning keys; moving count earlier in jsonObjectDynamic may improve cache/layout","result":"Median regressed from 11.336ms to 11.662ms; original field layout is better","rollback_reason":"Primary metric worsened","next_action_hint":"Keep jsonObjectDynamic layout raw, keys, values, count."}}
{"run":291,"commit":"db658f3","metric":11.630625,"metrics":{"build_ms":3663.41,"vm_output":29678473,"go_output":29678473,"binary_size_bytes":22974050},"status":"discard","description":"Use ParseFloat fallback for all negative lazy integers","timestamp":1777366623884,"segment":0,"confidence":1.1134602717907882,"iterationTokens":2609,"asi":{"hypothesis":"Negative integers are cold in the benchmark; replacing the manual negative loop with skipJSONValue+ParseFloat may shrink slow-path code and recover layout","result":"Median regressed from 11.336ms to 11.631ms; manual negative loop remains better","rollback_reason":"Primary metric worsened","next_action_hint":"Keep manual negative integer parsing in parseLazyJSONIntSlow."}}
{"run":292,"commit":"9444dc2","metric":11.066291,"metrics":{"build_ms":3691.292,"vm_output":29678473,"go_output":29678473,"binary_size_bytes":22974050},"status":"keep","description":"Check negative digit with lookahead","timestamp":1777366677083,"segment":0,"confidence":1.112590937756242,"iterationTokens":1017,"asi":{"hypothesis":"The sign-only correctness check can use idx+1 lookahead before incrementing, reducing branch/index state in the negative slow path while preserving validation","result":"Median improved from 11.336ms to 11.066ms with checks passing, recovering most of the sign-only validation cost","why_it_worked":"The slow negative branch remains cold, but the lookahead form produces a better code layout than increment-then-check","scope":"Strict lazy JSON typed integer parser slow path","risk":"Small near-noise improvement; ensure boundary cases for '-' remain covered by tests","next_action_hint":"Try similar lookahead for negative leading-zero check or leave as-is if branch-shape sensitive."}}
{"run":293,"commit":"9444dc2","metric":11.359166,"metrics":{"build_ms":3687.215,"vm_output":29678473,"go_output":29678473,"binary_size_bytes":22974050},"status":"discard","description":"Use local next index for negative leading-zero check","timestamp":1777366731850,"segment":0,"confidence":1.1117229601276628,"iterationTokens":1318,"asi":{"hypothesis":"Caching idx+1 in the negative leading-zero check may reduce repeated index arithmetic after the successful lookahead change","result":"Median regressed from 11.066ms to 11.359ms; local variable hurts layout","rollback_reason":"Primary metric worsened","next_action_hint":"Keep direct idx+1 expression in negative leading-zero check."}}
{"run":294,"commit":"9444dc2","metric":11.473125,"metrics":{"build_ms":3704.149,"vm_output":29678473,"go_output":29678473,"binary_size_bytes":22974050},"status":"discard","description":"Range over cached lazy object keys slice","timestamp":1777366787352,"segment":0,"confidence":1.1102492849436765,"iterationTokens":1196,"asi":{"hypothesis":"Ranging over object.keys[:count] may improve bounds-check elimination in cached lazy field extraction","result":"Median regressed from 11.066ms to 11.473ms; index loop remains better","rollback_reason":"Primary metric worsened","next_action_hint":"Keep explicit index loop in cached field extraction."}}
{"run":295,"commit":"9444dc2","metric":11.709916,"metrics":{"build_ms":3927.431,"vm_output":29678473,"go_output":29678473,"binary_size_bytes":22972578},"status":"discard","description":"Lower from_json expect to direct Go helper","timestamp":1777366906880,"segment":0,"confidence":1.1087795115295638,"iterationTokens":3861,"asi":{"hypothesis":"decode.from_json(payload).expect(...) is hot and currently constructs/copies a Result; lowering string from_json expect to a direct JsonToDynamicExpectExtern helper may avoid that overhead","result":"Median regressed from 11.066ms to 11.710ms despite smaller binary; helper/lowering shape is slower","rollback_reason":"Primary metric worsened","next_action_hint":"Keep normal Result expect path for from_json; direct runtime helpers have repeatedly regressed."}}
{"run":296,"commit":"9444dc2","metric":11.645916,"metrics":{"build_ms":3659.191,"vm_output":29678473,"go_output":29678473,"binary_size_bytes":22974050},"status":"discard","description":"Reorder zero number delimiter validation","timestamp":1777366990961,"segment":0,"confidence":1.107950433459787,"iterationTokens":1975,"asi":{"hypothesis":"For zero-valued JSON integers, checking delimiter/end before leading-zero digits may produce better slow-path layout","result":"Median regressed from 11.066ms to 11.646ms; current zero branch order is better","rollback_reason":"Primary metric worsened","next_action_hint":"Keep leading-zero digit check before delimiter check in zero branch."}}
{"run":297,"commit":"6bd6b8b","metric":11.095583,"metrics":{"build_ms":3733.314,"vm_output":29678473,"go_output":29678473,"binary_size_bytes":22974050},"status":"discard","description":"Use no-space typed int-array cache scanner","timestamp":1777367096238,"segment":0,"confidence":1.1071225943321958,"iterationTokens":3282,"asi":{"hypothesis":"Validation-time typed int-array caching is optional; specializing the typed cache scanner to no-whitespace arrays can avoid repeated skipJSONSpaces calls and fall back to generic validation when spaces are present","result":"Median regressed slightly from 11.066ms to 11.096ms; skipJSONSpaces calls are not the bottleneck or help layout","rollback_reason":"Primary metric worsened","next_action_hint":"Keep whitespace-tolerant scanJSONIntArray."}}
{"run":298,"commit":"6bd6b8b","metric":11.187459,"metrics":{"build_ms":3789.254,"vm_output":29678473,"go_output":29678473,"binary_size_bytes":22974050},"status":"discard","description":"Use no-space typed string-int map cache scanner","timestamp":1777367160115,"segment":0,"confidence":1.105001039897971,"iterationTokens":1504,"asi":{"hypothesis":"The typed string-int map cache is optional; specializing it to no-whitespace maps can remove skipJSONSpaces calls and fall back to generic validation for spaced maps","result":"Median regressed from 11.066ms to 11.187ms; whitespace-tolerant scanner is faster overall","rollback_reason":"Primary metric worsened","next_action_hint":"Keep skipJSONSpaces in scanJSONStringIntMap."}}
