{"run":245,"commit":"63c544d","metric":10.940834,"metrics":{"build_ms":3574.298,"vm_output":29678473,"go_output":29678473,"binary_size_bytes":22973970},"status":"keep","description":"Return directly from typed JSON collection scanners","timestamp":1777363195431,"segment":0,"confidence":1.4446364170888777,"iterationTokens":1413,"asi":{"hypothesis":"Unlike the generic validator close-branch change, the typed int-array/string-int-map scanners are hot only on successful cached fields; returning immediately on closing delimiters may avoid an extra loop iteration","result":"Median improved from 11.193ms to 10.941ms with checks passing","why_it_worked":"The validation-time typed collection cache parses three successful collections per iteration, so direct close handling in those specialized scanners avoids repeated loop-top checks","scope":"Specialized lazy JSON typed collection scanners","risk":"Branch-shape sensitive; generic validator direct-close still regressed and should stay unchanged","next_action_hint":"Try similar typed-scanner micro-tuning only within specialized cached collection paths."}}
{"run":246,"commit":"63c544d","metric":11.040208,"metrics":{"build_ms":3651.128,"vm_output":29678473,"go_output":29678473,"binary_size_bytes":22973970},"status":"discard","description":"Fill validation-time int arrays by index","timestamp":1777363279683,"segment":0,"confidence":1.4332148554102555,"iterationTokens":2868,"asi":{"hypothesis":"The typed validation-time int-array scanner usually sees 12 items exactly; allocating length 12 and assigning by index may avoid append overhead","result":"Median regressed from 10.941ms to 11.040ms; append into cap-12 slice remains better","rollback_reason":"Primary metric worsened","next_action_hint":"Keep make([]int, 0, 12) plus append in scanJSONIntArray."}}
{"run":247,"commit":"63c544d","metric":11.035917,"metrics":{"build_ms":3571.79,"vm_output":29678473,"go_output":29678473,"binary_size_bytes":22973970},"status":"discard","description":"Use four-slot duplicate tracker in typed string-int map scanner","timestamp":1777363504781,"segment":0,"confidence":1.421972479001836,"iterationTokens":17535,"asi":{"hypothesis":"The specialized validation-time string-int map scanner often handles small maps; a four-slot duplicate tracker may match the common counts shape","result":"Median regressed from 10.941ms to 11.036ms; four slots is still worse than eight","rollback_reason":"Primary metric worsened","next_action_hint":"Keep eight-slot tracker in scanJSONStringIntMap."}}
{"run":248,"commit":"d7f550c","metric":11.247334,"metrics":{"build_ms":3667.213,"vm_output":29678473,"go_output":29678473,"binary_size_bytes":22974034},"status":"discard","description":"Use four-slot interface lazy object cache after typed caching","timestamp":1777363576055,"segment":0,"confidence":1.4209068162028953,"iterationTokens":4335,"asi":{"hypothesis":"After switching cached values to a single interface array, a four-field top-level cache might be more general with lower penalty than earlier representations","result":"Median regressed from 10.941ms to 11.247ms and binary grew; three slots remains best for the primary workload","rollback_reason":"Primary metric worsened","next_action_hint":"Keep three-slot lazy object cache, but validate broader JSON workloads before finalizing."}}
{"run":249,"commit":"d7f550c","metric":11.079083,"metrics":{"build_ms":3502.173,"vm_output":29678473,"go_output":29678473,"binary_size_bytes":22973970},"status":"checks_failed","description":"Return named specialized decode functions from stdlib constructors","timestamp":1777363659927,"segment":0,"confidence":1.4198427494781112,"iterationTokens":5009,"asi":{"hypothesis":"Changing stdlib int_list/string_int_map constructors to return existing named decoder functions could avoid per-call closure allocations without changing signatures","result":"Benchmark passed but autoresearch checks failed in bytecode/vm; not safe to keep","rollback_reason":"Backpressure checks failed, likely due non-Go backend/VM handling of returning extern function symbols from stdlib constructors","next_action_hint":"Do not retry stdlib named-function returns without first adding cross-backend tests and fixing VM semantics; prefer Go-backend-only lowering if pursuing closure removal."}}
{"run":250,"commit":"d7f550c","metric":11.975084,"metrics":{"build_ms":3598.752,"vm_output":29678473,"go_output":29678473,"binary_size_bytes":22973970},"status":"discard","description":"Store cached lazy JSON object as value after interface fields","timestamp":1777363741400,"segment":0,"confidence":1.4176962429896443,"iterationTokens":4563,"asi":{"hypothesis":"After shrinking jsonObjectDynamic to a single interface value array, storing it as an interface value instead of a pointer might avoid one heap allocation","result":"Median regressed from 10.941ms to 11.975ms; copying/boxing the object value is much worse than pointer storage","rollback_reason":"Primary metric worsened","next_action_hint":"Keep *jsonObjectDynamic pointer representation."}}
{"run":251,"commit":"d7f550c","metric":11.918375,"metrics":{"build_ms":3751.771,"vm_output":29678473,"go_output":29678473,"binary_size_bytes":22973826},"status":"discard","description":"Remove RegisterExtern lock","timestamp":1777363833671,"segment":0,"confidence":1.4155562168456466,"iterationTokens":2853,"asi":{"hypothesis":"Generated programs register builtin externs during startup before concurrent execution, so removing the Register lock might reduce startup overhead","result":"Median regressed from 10.941ms to 11.918ms despite smaller binary; lock removal worsened code/layout or noise","rollback_reason":"Primary metric worsened","next_action_hint":"Keep RegisterExtern locking; do not trade registration safety for this path."}}
{"run":252,"commit":"fdb15c6","metric":10.835917,"metrics":{"build_ms":3738.108,"vm_output":29678473,"go_output":29678473,"binary_size_bytes":22973970},"status":"keep","description":"Limit typed string-int map cache to eight keys","timestamp":1777363930855,"segment":0,"confidence":1.3954669000017839,"iterationTokens":5399,"asi":{"hypothesis":"The validation-time typed string-int map cache is an optimization; for maps beyond the fixed small tracker it can fall back to generic validation instead of carrying map-fallback duplicate tracking in the hot specialized scanner","result":"Median improved slightly from 10.941ms to 10.836ms with checks passing","why_it_worked":"The hot counts map has four keys and stays in the fixed tracker; removing the cold map-fallback branch improves specialized scanner code shape","scope":"Typed lazy JSON string-int map cache path only; generic validation still handles larger maps correctly without typed caching","risk":"Top-level string-int maps with more than eight keys no longer get validation-time typed caching and will use raw lazy fallback, trading speed for smaller hot code","next_action_hint":"Validate larger string-int maps still decode correctly through fallback."}}
{"run":253,"commit":"fdb15c6","metric":11.134666,"metrics":{"build_ms":3569.931,"vm_output":29678473,"go_output":29678473,"binary_size_bytes":22973970},"status":"discard","description":"Limit typed int-array cache to initial capacity","timestamp":1777363979206,"segment":0,"confidence":1.3890123105940433,"iterationTokens":1464,"asi":{"hypothesis":"The validation-time int-array cache is an optimization; returning false beyond cap 12 might simplify append growth code for the hot exact-size arrays","result":"Median regressed from 10.836ms to 11.135ms; explicit cap guard worsens code shape","rollback_reason":"Primary metric worsened","next_action_hint":"Keep plain append with cap 12 in scanJSONIntArray."}}
{"run":254,"commit":"a7228fa","metric":11.314583,"metrics":{"build_ms":3554.152,"vm_output":29678473,"go_output":29678473,"binary_size_bytes":22973970},"status":"discard","description":"Use output map to detect typed string-int duplicate keys","timestamp":1777364045649,"segment":0,"confidence":1.3845420623356632,"iterationTokens":2118,"asi":{"hypothesis":"The typed string-int map scanner already builds the output map, so using map lookup to detect duplicate keys may avoid the separate fixed duplicate tracker","result":"Median regressed from 10.836ms to 11.315ms; extra map lookups are much slower than the fixed tracker","rollback_reason":"Primary metric worsened","next_action_hint":"Keep fixed eight-slot duplicate tracker in typed string-int map scanner."}}
{"run":255,"commit":"0fa4939","metric":11.281417,"metrics":{"build_ms":3636.908,"vm_output":29678473,"go_output":29678473,"binary_size_bytes":22973970},"status":"discard","description":"Remove unused lazy JSON helper functions","timestamp":1777364150229,"segment":0,"confidence":1.3801004949091527,"iterationTokens":2118,"asi":{"hypothesis":"Several old lazy JSON helpers are unused after strict validation and typed caching; removing them may improve code layout and simplify runtime","result":"Median regressed from 10.836ms to 11.281ms; dead-helper removal still hurts code layout/noise","rollback_reason":"Primary metric worsened","next_action_hint":"Leave unused lazy JSON helpers for now; remove during non-performance cleanup only if acceptable."}}
{"run":256,"commit":"0fa4939","metric":11.73775,"metrics":{"build_ms":3909.939,"vm_output":29678473,"go_output":29678473,"binary_size_bytes":22974498},"status":"discard","description":"Lower decode run field int collections to direct Go helpers","timestamp":1777364381044,"segment":0,"confidence":1.377322971300912,"iterationTokens":17572,"asi":{"hypothesis":"A Go-backend-only lowering for decode.run(raw, decode.field(name, decode.list/map(...))) can avoid Field/Run closure allocation and generated error-path code by calling direct ardgo field decode helpers","result":"Median regressed from 10.836ms to 11.738ms and binary grew; the additional generic helpers and call shape are slower than the inlined generated Field path after typed caching","rollback_reason":"Primary metric worsened","next_action_hint":"Do not pursue this direct helper shape; if revisiting closure removal, inspect generated code/escape output for a more targeted inlining strategy rather than runtime generic helpers."}}
{"run":257,"commit":"0fa4939","metric":11.119417,"metrics":{"build_ms":3668.43,"vm_output":29678473,"go_output":29678473,"binary_size_bytes":22973970},"status":"discard","description":"Remove top-level lazy object map fallback tracker","timestamp":1777364428973,"segment":0,"confidence":1.374556605057661,"iterationTokens":1623,"asi":{"hypothesis":"The top-level lazy object cache is an optimization for small objects; removing its duplicate-tracker map fallback after 16 keys may simplify the hot three-field validator while larger objects fall back to full json/v2 parsing","result":"Median regressed from 10.836ms to 11.119ms; map-fallback code shape apparently helps or change is noisy","rollback_reason":"Primary metric worsened","next_action_hint":"Keep top-level map fallback duplicate tracker."}}
{"run":258,"commit":"0fa4939","metric":11.267875,"metrics":{"build_ms":3679.652,"vm_output":29678473,"go_output":29678473,"binary_size_bytes":22974050},"status":"discard","description":"Use positive-int parser in typed JSON scanners","timestamp":1777364479437,"segment":0,"confidence":1.348813312774851,"iterationTokens":1813,"asi":{"hypothesis":"Validation-time typed scanners parse only positive integers in the benchmark; a positive-first parser could avoid negative/fallback branches in the hot array/map paths","result":"Median regressed from 10.836ms to 11.268ms and binary grew; existing parser layout is better","rollback_reason":"Primary metric worsened","next_action_hint":"Keep shared parseLazyJSONIntAt in typed scanners."}}
{"run":259,"commit":"0fa4939","metric":11.785667,"metrics":{"build_ms":3868.879,"vm_output":29678473,"go_output":29678473,"binary_size_bytes":22974386},"status":"discard","description":"Lower decode field expect to direct Go helpers","timestamp":1777364574345,"segment":0,"confidence":1.3249069372908038,"iterationTokens":5185,"asi":{"hypothesis":"Specializing decode.run(...decode.field(...)).expect(...) to direct Go expect helpers can avoid Result/closure/error-path allocation for hot successful field decodes","result":"Median regressed from 10.836ms to 11.786ms and binary grew; the helper boundary/inlining shape is worse than current generated code","rollback_reason":"Primary metric worsened","next_action_hint":"Stop pursuing direct runtime helper lowerings for field decode; if optimizing this area, target generated code shape directly rather than extra ardgo helper calls."}}
{"run":260,"commit":"0fa4939","metric":11.764916,"metrics":{"build_ms":3603.368,"vm_output":29678473,"go_output":29678473,"binary_size_bytes":22973970},"status":"discard","description":"Use branchless-looking cached field value assignment","timestamp":1777364612736,"segment":0,"confidence":1.301614935004641,"iterationTokens":1339,"asi":{"hypothesis":"Assigning a default jsonDynamic field value then overwriting it with typed cache may simplify cached object value storage code","result":"Median regressed from 10.836ms to 11.765ms; computing the raw jsonDynamic slice for hot typed fields is costly","rollback_reason":"Primary metric worsened","next_action_hint":"Keep the current cached != nil branch that avoids slicing raw values on typed cache hits."}}
{"run":261,"commit":"0fa4939","metric":11.281792,"metrics":{"build_ms":3599.484,"vm_output":29678473,"go_output":29678473,"binary_size_bytes":22973970},"status":"discard","description":"Recheck direct Result literals in JsonToDynamic after typed cache","timestamp":1777364652278,"segment":0,"confidence":1.2789767588219214,"iterationTokens":1240,"asi":{"hypothesis":"After typed lazy JSON caching changed JsonToDynamic's hot return value shape, direct Result literals might now beat Ok/Err constructors","result":"Median regressed from 10.836ms to 11.282ms; Ok constructors remain better for JsonToDynamic","rollback_reason":"Primary metric worsened","next_action_hint":"Keep Ok/Err constructors in builtinJsonToDynamic."}}
{"run":262,"commit":"0fa4939","metric":11.760667,"metrics":{"build_ms":3685.94,"vm_output":29678473,"go_output":29678473,"binary_size_bytes":22973970},"status":"discard","description":"Unroll small duplicate checks in typed string-int scanner","timestamp":1777364699168,"segment":0,"confidence":1.2727393493005639,"iterationTokens":1430,"asi":{"hypothesis":"The typed string-int map scanner usually sees four keys, so unrolling duplicate checks for the first few keys may reduce loop overhead","result":"Median regressed from 10.836ms to 11.761ms; branchy switch/unroll hurts code shape","rollback_reason":"Primary metric worsened","next_action_hint":"Keep the simple duplicate-check loop."}}
{"run":263,"commit":"0fa4939","metric":11.2185,"metrics":{"build_ms":3756.309,"vm_output":29678473,"go_output":29678473,"binary_size_bytes":22973970},"status":"discard","description":"Unroll three-field lazy object extraction","timestamp":1777364761212,"segment":0,"confidence":1.2665624826497965,"iterationTokens":3157,"asi":{"hypothesis":"Cached lazy JSON objects currently have three fields in the hot path; unrolling field extraction may avoid loop overhead for units/weights/counts lookups","result":"Median regressed from 10.836ms to 11.219ms; explicit unroll hurts branch/code layout","rollback_reason":"Primary metric worsened","next_action_hint":"Keep simple loop in builtinExtractField for cached objects."}}
{"run":264,"commit":"0fa4939","metric":11.7105,"metrics":{"build_ms":3654.051,"vm_output":29678473,"go_output":29678473,"binary_size_bytes":22974178},"status":"discard","description":"Use Ok constructors for typed collection decoder hits","timestamp":1777364826805,"segment":0,"confidence":1.2641797818351515,"iterationTokens":1167,"asi":{"hypothesis":"Typed-cache decoder hits are hot; Ok constructors might produce better inlining than direct Result literals after recent code layout changes","result":"Median regressed from 10.836ms to 11.711ms and binary grew; direct Result literals are better for typed collection hits","rollback_reason":"Primary metric worsened","next_action_hint":"Keep direct Result literals for typed []int and map[string]int decoder fast paths."}}
{"run":265,"commit":"0fa4939","metric":11.101209,"metrics":{"build_ms":3677.592,"vm_output":29678473,"go_output":29678473,"binary_size_bytes":22973970},"status":"discard","description":"Recheck map[string] fast path in MapKeys after typed cache","timestamp":1777364877479,"segment":0,"confidence":1.2634245129552137,"iterationTokens":2045,"asi":{"hypothesis":"After typed caching, MapKeys over map[string]int is a larger remaining cost; a top-level map[string]V assertion may avoid per-key string assertions","result":"Median regressed from 10.836ms to 11.101ms; generic MapKeys specialization still hurts","rollback_reason":"Primary metric worsened","next_action_hint":"Keep existing all-string scan in MapKeys."}}
{"run":266,"commit":"0fa4939","metric":11.259584,"metrics":{"build_ms":3601.4,"vm_output":29678473,"go_output":29678473,"binary_size_bytes":22973970},"status":"discard","description":"Remove capacity hint from typed string-int map cache","timestamp":1777364918764,"segment":0,"confidence":1.250433402660065,"iterationTokens":1026,"asi":{"hypothesis":"The validation-time typed map cache may not benefit from a fixed capacity hint after recent code layout changes","result":"Median regressed from 10.836ms to 11.260ms; capacity 4 remains better","rollback_reason":"Primary metric worsened","next_action_hint":"Keep make(map[string]int, 4) in scanJSONStringIntMap."}}
{"run":267,"commit":"0fa4939","metric":11.170792,"metrics":{"build_ms":3604.317,"vm_output":29678473,"go_output":29678473,"binary_size_bytes":22973970},"status":"discard","description":"Use constant three-field cache bound","timestamp":1777364954888,"segment":0,"confidence":1.2366885481717622,"iterationTokens":938,"asi":{"hypothesis":"The lazy object cache size is fixed at three fields; using a literal bound may help the compiler versus len(object.keys)","result":"Median regressed from 10.836ms to 11.171ms; len(object.keys) compiles better or layout is favorable","rollback_reason":"Primary metric worsened","next_action_hint":"Keep len(object.keys) for cache bound."}}
{"run":268,"commit":"0fa4939","metric":11.468209,"metrics":{"build_ms":3596.724,"vm_output":29678473,"go_output":29678473,"binary_size_bytes":22973970},"status":"discard","description":"Use local index in typed JSON int-array scanner","timestamp":1777365006106,"segment":0,"confidence":1.2365180726328706,"iterationTokens":1866,"asi":{"hypothesis":"scanJSONIntArray updates an index pointer repeatedly; using a local index and writing back only on success may reduce pointer dereference overhead","result":"Median regressed from 10.836ms to 11.468ms; pointer form compiles better","rollback_reason":"Primary metric worsened","next_action_hint":"Keep pointer-updating scanJSONIntArray."}}
{"run":269,"commit":"144477e","metric":11.524375,"metrics":{"build_ms":3703.244,"vm_output":29678473,"go_output":29678473,"binary_size_bytes":22973970},"status":"discard","description":"Use fixed array backing for typed int-array cache","timestamp":1777365080957,"segment":0,"confidence":1.2360184888611485,"iterationTokens":2192,"asi":{"hypothesis":"The validation-time int-array cache usually has exactly 12 elements; using a fixed [12]int backing array may avoid make([]int,0,12) overhead","result":"Median regressed from 10.836ms to 11.524ms; fixed array escape/copy is worse","rollback_reason":"Primary metric worsened","next_action_hint":"Keep make([]int, 0, 12) for typed array cache."}}
{"run":270,"commit":"11734e7","metric":11.494875,"metrics":{"build_ms":3671.397,"vm_output":29678473,"go_output":29678473,"binary_size_bytes":22973970},"status":"keep","description":"Reject leading-zero numbers in typed lazy JSON caches","timestamp":1777365151574,"segment":0,"confidence":1.2348623361823363,"iterationTokens":2262,"asi":{"hypothesis":"Typed validation-time int array/map caches must validate JSON number syntax themselves; adding leading-zero rejection preserves json/v2 correctness for cached typed values","result":"Metric regressed from 10.836ms to 11.495ms, but this is a correctness fix for invalid JSON like {\"units\":[01]} and {\"counts\":{\"a\":01}}; checks and new tests pass","why_kept_despite_metric":"Avoiding a known JSON validation bug is required; benchmark correctness must not rely on accepting invalid inputs","scope":"Strict lazy JSON typed int parsing validation","risk":"Primary metric is slower; seek later optimizations that recover this correctness cost","next_action_hint":"Look for cheaper leading-zero validation inside the positive integer parser or typed scanners."}}
