{"run":48,"commit":"b2de85f","metric":41.212792,"metrics":{"build_ms":3520.725,"vm_output":29678473,"go_output":29678473,"binary_size_bytes":22936642},"status":"discard","description":"Export Result fields for direct literal access","timestamp":1777350986417,"segment":0,"confidence":13.852749046947059,"iterationTokens":1068,"asi":{"hypothesis":"Exporting Result fields could allow cheaper direct literals and field access in generated/runtime code while preserving methods","result":"After fixing CoerceExtern field-name handling, median regressed from 41.11ms to 41.21ms; no runtime win and API exposure is not justified","rollback_reason":"Primary metric worsened and change broadens public API surface unnecessarily","next_action_hint":"Keep Result fields unexported. If direct generated Result literals are desired, consider a dedicated constructor/intrinsic instead of exporting fields."}}
{"run":49,"commit":"b2de85f","metric":44.821084,"metrics":{"build_ms":3801.93,"vm_output":29678473,"go_output":29678473,"binary_size_bytes":22953202},"status":"discard","description":"Replace json/v2 dynamic parsing with manual jsontext parser","timestamp":1777351138947,"segment":0,"confidence":13.324670134150516,"iterationTokens":4718,"asi":{"hypothesis":"A hand-written jsontext token parser for Dynamic values looked slightly faster in a parse-only microcheck and might reduce JsonToDynamic cost","result":"Median regressed badly from 41.11ms to 44.82ms; manual parser is slower in full generated backend workload despite parse-only prototype","rollback_reason":"Primary metric worsened significantly","next_action_hint":"Keep encoding/json/v2 JsonToDynamic. Avoid manual JSON parser without deeper profiling and broader correctness coverage."}}
{"run":50,"commit":"b2de85f","metric":41.2585,"metrics":{"build_ms":3628.706,"vm_output":29678473,"go_output":29678473,"binary_size_bytes":22936642},"status":"discard","description":"Reorder builtinDynamicValue raw type switch toward collection types","timestamp":1777351185735,"segment":0,"confidence":13.852749046947059,"iterationTokens":1226,"asi":{"hypothesis":"builtinDynamicValue is now hottest for JSON []any/map values, so putting collection cases first may reduce type switch work","result":"Median regressed from 41.11ms to 41.26ms; type switch order change did not help","rollback_reason":"Primary metric worsened","next_action_hint":"Keep original raw type switch order in builtinDynamicValue."}}
{"run":51,"commit":"b2de85f","metric":41.259667,"metrics":{"build_ms":3559.122,"vm_output":29678473,"go_output":29678473,"binary_size_bytes":22936642},"status":"discard","description":"Invert Result.Expect branch to return on ok first","timestamp":1777351237690,"segment":0,"confidence":14.424412588386737,"iterationTokens":1688,"asi":{"hypothesis":"Result.Expect is called on hot success paths; checking ok first and returning may give the compiler/branch predictor a better shape","result":"Median regressed from 41.11ms to 41.26ms; branch shape did not help","rollback_reason":"Primary metric worsened","next_action_hint":"Keep existing Expect implementation."}}
{"run":52,"commit":"efeb280","metric":41.399542,"metrics":{"build_ms":3924.965,"vm_output":29678473,"go_output":29678473,"binary_size_bytes":22936642},"status":"discard","description":"Inline ard/decode::run module calls in Go backend","timestamp":1777351343880,"segment":0,"confidence":14.73111162874036,"iterationTokens":483,"asi":{"hypothesis":"decode::run is only a shorthand that calls decoder(data); lowering it directly should avoid an extra generated function call for each top-level decode","result":"Median regressed from 41.11ms to 41.40ms; Go likely inlines decode.Run already or generated expression shape worsens codegen","rollback_reason":"Primary metric worsened","next_action_hint":"Do not special-case decode::run lowering; focus elsewhere."}}
{"run":53,"commit":"efeb280","metric":41.6095,"metrics":{"build_ms":3642.093,"vm_output":29678473,"go_output":29678473,"binary_size_bytes":22953154},"status":"discard","description":"Emit return block/if expressions as direct statements","timestamp":1777351453011,"segment":0,"confidence":15.051136382359632,"iterationTokens":4084,"asi":{"hypothesis":"Generated decode code returns nested closure expressions for match/if result values; emitting block/if return expressions as direct statements should reduce closure-call overhead","result":"Median regressed from 41.11ms to 41.61ms despite smaller binary; direct statement shape hurt runtime or added control-flow overhead","rollback_reason":"Primary metric worsened","next_action_hint":"Do not broadly rewrite return block/if expressions; if revisited, inspect generated code and target a narrower pattern."}}
{"run":54,"commit":"0f4359a","metric":40.4085,"metrics":{"build_ms":3589.392,"vm_output":29678473,"go_output":29678473,"binary_size_bytes":22901074},"status":"keep","description":"Use pointer receivers for Result IsOk and IsErr","timestamp":1777351508917,"segment":0,"confidence":20.984386538335663,"iterationTokens":1977,"asi":{"hypothesis":"Generated decode checks call IsOk/IsErr on Result temporaries many times; pointer receivers may avoid copying generic Result structs containing slices/maps and reduce generated code size","result":"Median improved from 41.11ms to 40.41ms (~1.7%) and binary size dropped by ~35KB with checks passing","why_it_worked":"Result values for decode often contain slices/maps in either value or error type; pointer receiver method calls avoid value receiver copies in hot checks","risk":"Go automatically takes addresses for addressable Result variables, but non-addressable Result values may no longer call IsOk/IsErr; current tests pass, so generated call sites appear addressable","next_action_hint":"Try pointer receivers for Expect/UnwrapOk/UnwrapErr/Or as they also copy Result values on hot paths"}}
{"run":55,"commit":"8e6785d","metric":40.157208,"metrics":{"build_ms":3725.237,"vm_output":29678473,"go_output":29678473,"binary_size_bytes":22902418},"status":"keep","description":"Use pointer-based Result ExpectRef for generated try success paths","timestamp":1777351611735,"segment":0,"confidence":21.58603217811008,"iterationTokens":3728,"asi":{"hypothesis":"After pointer IsOk/IsErr improved by avoiding Result copies, generated try success paths can use a new pointer receiver ExpectRef while preserving the public value-receiver Expect API","result":"Median improved from 40.41ms to 40.16ms (~0.6%) with checks passing; binary size grew ~1.3KB","why_it_worked":"Generated try temporaries are addressable, so ExpectRef avoids copying Result values on hot successful decode unwraps without breaking non-addressable Result.Expect calls","risk":"Adds a new public-ish runtime helper method and backend emits it for result try success paths; must keep tests covering generated form","next_action_hint":"Consider pointer-based UnwrapErrRef for catch paths only if error-heavy benchmarks matter; decode_pipeline success path unlikely to benefit"}}
{"run":56,"commit":"8e6785d","metric":40.220042,"metrics":{"build_ms":3601.625,"vm_output":29678473,"go_output":29678473,"binary_size_bytes":22902498},"status":"discard","description":"Use slices.Sort for string-key MapKeys fast path","timestamp":1777351663954,"segment":0,"confidence":20.657887311517747,"iterationTokens":1881,"asi":{"hypothesis":"slices.Sort may be faster or inline better than sort.Strings for the MapKeys all-string fast path","result":"Median regressed from 40.16ms to 40.22ms and binary grew slightly","rollback_reason":"Primary metric worsened","next_action_hint":"Keep sort.Strings for string key sorting."}}
{"run":57,"commit":"8e6785d","metric":40.487625,"metrics":{"build_ms":3532.6,"vm_output":29678473,"go_output":29678473,"binary_size_bytes":22918930},"status":"discard","description":"Special-case map[string]V in generic MapKeys","timestamp":1777351702751,"segment":0,"confidence":21.38439959230493,"iterationTokens":1165,"asi":{"hypothesis":"MapKeys can avoid per-key type assertions for concrete map[string]V by detecting the map type up front","result":"Median regressed from 40.16ms to 40.49ms and binary grew significantly; generic map type assertion is costly or hurts codegen","rollback_reason":"Primary metric worsened","next_action_hint":"Keep existing all-string detection and []string direct return; avoid map[string]V generic type assertion specialization."}}
{"run":58,"commit":"ef50c7a","metric":39.362833,"metrics":{"build_ms":3617.366,"vm_output":29678473,"go_output":29678473,"binary_size_bytes":22902386},"status":"keep","description":"Use ExpectRef for addressable result_expect method calls","timestamp":1777351831275,"segment":0,"confidence":20.940695706668343,"iterationTokens":5538,"asi":{"hypothesis":"Result match success bindings use result_expect and are very hot in decode list/map loops; using ExpectRef for addressable subjects should avoid Result copies like try success paths did","result":"Median improved from 40.16ms to 39.36ms (~2.0%) with checks passing","why_it_worked":"decode.List and decode.Map perform result matches for every element/key/value; their generated `Expect(\"expected ok\")` calls now avoid copying Result values","scope":"Only addressable result_expect subjects use ExpectRef; non-addressable expressions still use value-receiver Expect","next_action_hint":"Consider similar pointer-ref emission for result_or if any hot code uses it; or evaluate pointer receivers for Maybe methods in decode nullable/path workloads"}}
{"run":59,"commit":"ef50c7a","metric":39.479458,"metrics":{"build_ms":3737.34,"vm_output":29678473,"go_output":29678473,"binary_size_bytes":22953298},"status":"discard","description":"Use pointer UnwrapOkRef instead of ExpectRef after result checks","timestamp":1777351879270,"segment":0,"confidence":20.920050872031183,"iterationTokens":1913,"asi":{"hypothesis":"Generated code calls ExpectRef only after checking result success, so a pointer UnwrapOkRef without branch/message may be faster","result":"Median regressed from 39.36ms to 39.48ms and binary size grew substantially; removing the branch did not help codegen","rollback_reason":"Primary metric worsened","next_action_hint":"Keep ExpectRef for result_expect/try success despite redundant branch; compiler codegen is better in this workload."}}
{"run":60,"commit":"ef50c7a","metric":39.574584,"metrics":{"build_ms":3906.114,"vm_output":29678473,"go_output":29678473,"binary_size_bytes":22902386},"status":"discard","description":"Use explicit false comparison in Result.IsErr","timestamp":1777351925910,"segment":0,"confidence":19.927183435100947,"iterationTokens":1025,"asi":{"hypothesis":"Changing IsErr from `!r.ok` to `r.ok == false` might alter codegen/branch prediction for hot error checks","result":"Median regressed from 39.36ms to 39.57ms; no benefit","rollback_reason":"Primary metric worsened","next_action_hint":"Keep IsErr as logical negation."}}
{"run":61,"commit":"4c1fedb","metric":39.500583,"metrics":{"build_ms":3658.072,"vm_output":29678473,"go_output":29678473,"binary_size_bytes":22953330},"status":"discard","description":"Use no-argument ExpectOkRef for generated result success unwraps","timestamp":1777352126222,"segment":0,"confidence":18.688585400593446,"iterationTokens":1025,"asi":{"hypothesis":"ExpectRef's panic message parameter appears to escape in gc diagnostics; a no-argument ExpectOkRef with a constant panic string may avoid that overhead while retaining the successful branch shape","result":"Median regressed from 39.36ms to 39.50ms and binary size grew ~51KB; avoiding the message parameter did not help codegen","rollback_reason":"Primary metric worsened","next_action_hint":"Keep ExpectRef with explicit messages; do not replace success unwraps with no-arg ExpectOkRef."}}
{"run":62,"commit":"6219da8","metric":39.124042,"metrics":{"build_ms":3532.656,"vm_output":29678473,"go_output":29678473,"binary_size_bytes":22902386},"status":"keep","description":"Emit implicit-address ExpectRef method calls","timestamp":1777352161328,"segment":0,"confidence":17.913426012305028,"iterationTokens":1893,"asi":{"hypothesis":"For addressable Result temporaries, emitting `res.ExpectRef(...)` instead of `(&res).ExpectRef(...)` lets Go handle the implicit address and may produce cleaner SSA/codegen","result":"Median improved from 39.36ms to 39.12ms (~0.6%) with checks passing and unchanged binary size","why_it_worked":"Generated code uses many Result success unwraps; the simpler selector form appears to codegen slightly better than explicit unary address expressions","scope":"Only addressable generated Result success paths use implicit pointer method calls; non-addressable fallbacks still use value Expect","next_action_hint":"Try the same implicit-address style for other pointer receiver Result methods if explicit address appears elsewhere."}}
{"run":63,"commit":"6219da8","metric":39.216708,"metrics":{"build_ms":3513.446,"vm_output":29678473,"go_output":29678473,"binary_size_bytes":22902386},"status":"discard","description":"Omit automatic discard assignment for every backend bind","timestamp":1777352240371,"segment":0,"confidence":17.29717247858522,"iterationTokens":9137,"asi":{"hypothesis":"The Go backend emits `_ = local` after every bind to suppress unused-variable errors; removing these redundant dead assignments may reduce generated code overhead in hot decode blocks","result":"Median regressed from 39.12ms to 39.22ms; Go likely eliminates these stores and the changed source shape did not improve runtime","rollback_reason":"Primary metric worsened","next_action_hint":"Keep bind discard assignments unless implementing a more targeted dead-code cleanup validated by profiling."}}
{"run":64,"commit":"6219da8","metric":39.208959,"metrics":{"build_ms":3458.081,"vm_output":29678473,"go_output":29678473,"binary_size_bytes":22902386},"status":"discard","description":"Return []any directly for all-string MapKeys with Dynamic keys","timestamp":1777352293724,"segment":0,"confidence":17.03761693099389,"iterationTokens":3811,"asi":{"hypothesis":"For map[any]any values whose keys are all strings, MapKeys can build and return a []any directly instead of doing per-element generic type assertions from string to K","result":"Median regressed from 39.12ms to 39.21ms; the extra branch/code outweighed any conversion benefit","rollback_reason":"Primary metric worsened","next_action_hint":"Keep current MapKeys []string direct return only for K=string; avoid Dynamic-key specializations."}}
{"run":65,"commit":"6219da8","metric":39.472167,"metrics":{"build_ms":3528.077,"vm_output":29678473,"go_output":29678473,"binary_size_bytes":22902386},"status":"discard","description":"Introduce temporaries for non-addressable result_expect binds","timestamp":1777352376168,"segment":0,"confidence":16.914847384349315,"iterationTokens":4589,"asi":{"hypothesis":"Top-level decode results call value-receiver Expect on non-addressable function returns; binding the Result to a temp and using pointer ExpectRef may avoid copying Result values","result":"Median regressed from 39.12ms to 39.47ms; extra temporaries/source shape outweighed copy avoidance for function-return result_expect binds","rollback_reason":"Primary metric worsened","next_action_hint":"Keep non-addressable result_expect as value Expect; pointer ExpectRef only helps existing addressable temporaries."}}
{"run":66,"commit":"6219da8","metric":39.277041,"metrics":{"build_ms":3636.33,"vm_output":29678473,"go_output":29678473,"binary_size_bytes":22902322},"status":"discard","description":"Emit direct Print extern wrapper in Go backend","timestamp":1777352465351,"segment":0,"confidence":16.76744537375389,"iterationTokens":8436,"asi":{"hypothesis":"Generated programs call io::print once per run via CallExtern; emitting a direct PrintExtern helper can avoid registry dispatch and slightly reduce startup/end overhead","result":"Median regressed from 39.12ms to 39.28ms despite a tiny binary-size drop; one print call is not a profitable target","rollback_reason":"Primary metric worsened","next_action_hint":"Do not add direct Print wrapper for decode_pipeline performance; if extern registration/startup is targeted, address RegisterBuiltinExterns more broadly."}}
{"run":67,"commit":"6219da8","metric":39.294958,"metrics":{"build_ms":3473.092,"vm_output":29678473,"go_output":29678473,"binary_size_bytes":22902386},"status":"discard","description":"Preallocate default extern registry map","timestamp":1777352500277,"segment":0,"confidence":16.714019015786107,"iterationTokens":1274,"asi":{"hypothesis":"Every generated Go process registers many builtin externs at startup; preallocating the extern registry map may reduce startup overhead included in the benchmark","result":"Median regressed from 39.12ms to 39.29ms; map growth during registration is not a profitable bottleneck or noise dominates","rollback_reason":"Primary metric worsened","next_action_hint":"Avoid registry preallocation as a decode_pipeline optimization."}}
{"run":68,"commit":"6219da8","metric":39.549917,"metrics":{"build_ms":3483.664,"vm_output":29678473,"go_output":29678473,"binary_size_bytes":22902386},"status":"discard","description":"Use direct Result literals in JsonToDynamic builtin","timestamp":1777352550751,"segment":0,"confidence":17.201634250226697,"iterationTokens":3054,"asi":{"hypothesis":"JsonToDynamic is called once per decode iteration; replacing Ok/Err constructor calls with direct Result literals inside ardgo may shave wrapper overhead","result":"Median regressed from 39.12ms to 39.55ms; constructors are inlined well and direct literals hurt codegen/noise","rollback_reason":"Primary metric worsened","next_action_hint":"Keep builtinJsonToDynamic using Ok/Err constructors."}}
{"run":69,"commit":"6219da8","metric":39.525667,"metrics":{"build_ms":3501.397,"vm_output":29678473,"go_output":29678473,"binary_size_bytes":22902386},"status":"discard","description":"Use insertion sort for small all-string MapKeys","timestamp":1777352589765,"segment":0,"confidence":17.777255642514152,"iterationTokens":1424,"asi":{"hypothesis":"decode_pipeline sorts several four-key maps; a small-slice insertion sort in the all-string MapKeys fast path may beat sort.Strings call overhead generally for small maps","result":"Median regressed from 39.12ms to 39.53ms; hand-written small sort worsened codegen/runtime","rollback_reason":"Primary metric worsened","next_action_hint":"Keep sort.Strings even for small all-string maps."}}
{"run":70,"commit":"6219da8","metric":38.511958,"metrics":{"build_ms":3567.85,"vm_output":29678473,"go_output":29678473,"binary_size_bytes":22953234},"status":"checks_failed","description":"Decode maps through string-key Dynamic maps","timestamp":1777352762768,"segment":0,"confidence":18.037305056908234,"iterationTokens":12202,"asi":{"hypothesis":"JSON object Dynamic values already use string keys; decode.map can avoid copying map[string]any into map[any]any and avoid Dynamic-key MapKeys conversions by using a string-key Dynamic map helper","result":"Benchmark improved from 39.12ms to 38.51ms, but checks failed in bytecode/vm because the new DynamicToStringMap extern was not implemented/registered for VM","rollback_reason":"Backpressure checks failed; cannot keep partial Go-only stdlib extern change","next_action_hint":"Reapply with VM/JS/runtime support for DynamicToStringMap, run go generate ./bytecode/vm, and verify formatter/checker/vm tests."}}
{"run":71,"commit":"86658a5","metric":38.943875,"metrics":{"build_ms":3760.534,"vm_output":29678473,"go_output":29678473,"binary_size_bytes":22953234},"status":"keep","description":"Decode maps through string-key Dynamic maps","timestamp":1777352844145,"segment":0,"confidence":18.220780290202804,"iterationTokens":4855,"asi":{"hypothesis":"JSON object Dynamic values already have string keys; decode.map can use a string-key Dynamic map helper to avoid copying map[string]any into map[any]any and reduce Dynamic-key MapKeys conversions","result":"Median improved from 39.12ms to 38.94ms with full checks passing; earlier 38.51ms checks-failed run showed same direction but more noise","why_it_worked":"Go DynamicToStringMapExtern aliases map[string]any JSON objects directly, and generated decode.map now iterates map[string]any keys before wrapping each key as Dynamic for the user-supplied key decoder","scope":"General stdlib decode.map optimization for JSON/object maps with string keys; VM and JS support added for the new DynamicToStringMap extern","risk":"decode.map now treats JSON/object keys as strings explicitly, which matches JSON object semantics but changes the internal Dynamic map shape used by the decoder implementation","next_action_hint":"Investigate direct Go backend emission for Dyn::from_str inside decode.map to avoid CallExtern/registry overhead on each map key."}}
