{"run":173,"commit":"4454609","metric":31.576125,"metrics":{"build_ms":3576.26,"vm_output":29678473,"go_output":29678473,"binary_size_bytes":22956322},"status":"discard","description":"Use GC target 325 for generated runtime","timestamp":1777358689055,"segment":0,"confidence":8.22543131843509,"iterationTokens":887,"asi":{"hypothesis":"A GC target slightly above 300 may further reduce collection work without hitting the slower 350/400 behavior","result":"Median regressed from 30.928ms to 31.576ms; 325 is worse than 300","rollback_reason":"Primary metric worsened","next_action_hint":"Keep default generated runtime GC target at 300."}}
{"run":174,"commit":"4454609","metric":31.3155,"metrics":{"build_ms":3530.882,"vm_output":29678473,"go_output":29678473,"binary_size_bytes":22956322},"status":"discard","description":"Use direct Result literal inside builtinDynamicToStringMap","timestamp":1777358752425,"segment":0,"confidence":8.241596507656162,"iterationTokens":2293,"asi":{"hypothesis":"Since DynamicToStringMapExtern benefits from a direct Result literal for raw map[string]any, the lower-level builtinDynamicToStringMap raw-map branch might also benefit","result":"Median regressed from 30.928ms to 31.316ms; only the extern fast path should use the direct literal","rollback_reason":"Primary metric worsened","next_action_hint":"Keep Ok constructor in builtinDynamicToStringMap's raw map branch."}}
{"run":175,"commit":"4454609","metric":32.050875,"metrics":{"build_ms":3627.12,"vm_output":29678473,"go_output":29678473,"binary_size_bytes":22956322},"status":"discard","description":"Use direct Result literal inside builtinDynamicToList","timestamp":1777358794288,"segment":0,"confidence":8.275871766631235,"iterationTokens":940,"asi":{"hypothesis":"The raw []any branch in builtinDynamicToList might benefit from a direct Result literal instead of Ok, analogous to DynamicToStringMapExtern's raw map fast path","result":"Median regressed badly from 30.928ms to 32.051ms; Ok constructor remains better in builtinDynamicToList","rollback_reason":"Primary metric worsened","next_action_hint":"Keep Ok constructor in builtinDynamicToList's raw []any branch."}}
{"run":176,"commit":"5b64be0","metric":31.485667,"metrics":{"build_ms":3591.4,"vm_output":29678473,"go_output":29678473,"binary_size_bytes":22956322},"status":"discard","description":"Fast-path float64 slices after JSON arrays in direct int-list decoder","timestamp":1777358844274,"segment":0,"confidence":8.300904705337354,"iterationTokens":1462,"asi":{"hypothesis":"A []float64 fast path placed after the hot []any check may support typed numeric slices without penalizing JSON arrays as much as the earlier pre-[]any version","result":"Median regressed from 30.928ms to 31.486ms; even after []any, the extra code hurts","rollback_reason":"Primary metric worsened","next_action_hint":"Do not add []float64 direct int-list fast paths."}}
{"run":177,"commit":"5b64be0","metric":23.50725,"metrics":{"build_ms":3587.306,"vm_output":29678473,"go_output":29678473,"binary_size_bytes":22957026},"status":"discard","description":"Prototype lazy JSON Dynamic fast paths","timestamp":1777359008918,"segment":0,"confidence":8.32217107562751,"iterationTokens":6922,"asi":{"hypothesis":"Returning a validated lazy JSON Dynamic from JsonToDynamic and decoding fields/int-list/string-int-map on demand can avoid full json/v2 Dynamic allocation while preserving generic fallback to full parsing","result":"Large speedup to 23.51ms, but the prototype used encoding/json.Valid for validation, which accepts duplicate object names that json/v2 normally rejects; keeping it would weaken from_json correctness","rollback_reason":"Semantic validation mismatch with json/v2 duplicate-name behavior","next_action_hint":"Reapply the lazy JSON design with jsontext/json/v2-compatible validation before benchmarking for keep."}}
{"run":178,"commit":"5b64be0","metric":31.238,"metrics":{"build_ms":3712.522,"vm_output":29678473,"go_output":29678473,"binary_size_bytes":22956802},"status":"discard","description":"Lazy JSON Dynamic with jsontext validation","timestamp":1777359112036,"segment":0,"confidence":8.313036725861206,"iterationTokens":4819,"asi":{"hypothesis":"The lazy JSON Dynamic prototype can preserve json/v2-style validation by using jsontext.SkipValue before returning lazy values, then decode fields/lists/maps on demand","result":"Median regressed from 30.928ms to 31.238ms; jsontext validation overhead erases the lazy decode allocation win for this workload","rollback_reason":"Primary metric worsened","next_action_hint":"If pursuing lazy JSON, use a faster validator that preserves json/v2 duplicate-name semantics, or integrate validation with lazy field scanning."}}
{"run":179,"commit":"5b64be0","metric":31.805708,"metrics":{"build_ms":3645.955,"vm_output":29678473,"go_output":29678473,"binary_size_bytes":22956370},"status":"discard","description":"Move default GC tuning to ardgo init","timestamp":1777359178944,"segment":0,"confidence":8.32217107562751,"iterationTokens":2166,"asi":{"hypothesis":"Setting the generated Go default GC target in package init may apply earlier and remove startup work from RegisterBuiltinExterns while preserving GOGC override behavior","result":"Median regressed from 30.928ms to 31.806ms and binary grew; init-time tuning is worse","rollback_reason":"Primary metric worsened","next_action_hint":"Keep default GC tuning inside RegisterBuiltinExterns."}}
{"run":180,"commit":"25ca523","metric":29.321709,"metrics":{"build_ms":3675.424,"vm_output":29678473,"go_output":29678473,"binary_size_bytes":22957010},"status":"keep","description":"Add lazy JSON Dynamic with duplicate-name validation","timestamp":1777359319119,"segment":0,"confidence":7.889735533020538,"iterationTokens":5699,"asi":{"hypothesis":"A lazy JSON Dynamic can validate input cheaply, preserve json/v2 duplicate-name rejection with a custom duplicate scanner, and decode requested fields/int lists/string-int maps on demand to avoid full Dynamic allocation","result":"Median improved from 30.928ms to 29.322ms with checks passing; binary grew ~688 bytes","why_it_worked":"decode_pipeline only needs three fields from the parsed JSON and immediately decodes them into typed collections; lazy field extraction plus direct int collection parsing avoids much of json/v2's map/slice allocation work","scope":"General generated Go JSON Dynamic optimization with fallback to full ffi.JsonToDynamic for generic Dynamic operations and unsupported lazy decode shapes","risk":"New custom JSON scanner/duplicate-name validator must stay semantically aligned with json/v2; needs focused tests for duplicate keys, nested objects, escaped keys, invalid JSON, and fallback behavior","next_action_hint":"Add focused Go runtime tests for lazy JSON validation/field extraction semantics, then try pre-sizing lazy int-list/map outputs."}}
{"run":181,"commit":"e204740","metric":28.778334,"metrics":{"build_ms":3532.611,"vm_output":29678473,"go_output":29678473,"binary_size_bytes":22957010},"status":"keep","description":"Add lazy JSON runtime tests","timestamp":1777359388787,"segment":0,"confidence":7.743309237457837,"iterationTokens":2152,"asi":{"hypothesis":"Focused tests for lazy JSON duplicate-name rejection, on-demand field decoding, and generic fallback can guard the new fast path without affecting generated binary performance","result":"Median improved from 29.322ms to 28.778ms with checks passing; test files do not change generated binary size, so improvement is measurement variance but the correctness coverage is valuable","why_it_worked":"No production code changed; benchmark variance favored this run while tests verify the risky lazy JSON scanner behavior","scope":"Adds Go runtime tests only","risk":"Tests cover representative duplicate and fallback cases but not all JSON edge cases; more cases may be needed before final review","next_action_hint":"Continue optimizing lazy JSON parsers, especially pre-sizing int-list and map outputs."}}
{"run":182,"commit":"e204740","metric":29.727417,"metrics":{"build_ms":3568.25,"vm_output":29678473,"go_output":29678473,"binary_size_bytes":22957074},"status":"discard","description":"Pre-count lazy JSON int-list elements","timestamp":1777359444637,"segment":0,"confidence":7.735505134476694,"iterationTokens":1881,"asi":{"hypothesis":"Lazy JSON int-list parsing currently appends into a cap-8 slice; pre-counting elements and filling a len-sized []int may avoid append growth and match the direct decoder's successful shape","result":"Median regressed from 28.778ms to 29.727ms and binary grew; the extra scan costs more than append growth","rollback_reason":"Primary metric worsened","next_action_hint":"Keep lazy int-list parsing as single-pass append with a small initial capacity."}}
{"run":183,"commit":"e204740","metric":29.418,"metrics":{"build_ms":3613.418,"vm_output":29678473,"go_output":29678473,"binary_size_bytes":22973586},"status":"discard","description":"Pre-size lazy JSON string-int maps","timestamp":1777359499320,"segment":0,"confidence":7.72771674640531,"iterationTokens":1363,"asi":{"hypothesis":"Lazy JSON string-int map parsing currently creates an unhinted map; counting object members first may avoid map growth for JSON objects","result":"Median regressed from 28.778ms to 29.418ms and binary size grew significantly; extra scan/code size outweighs map capacity hint","rollback_reason":"Primary metric worsened","next_action_hint":"Keep lazy string-int map parsing as single-pass make(map[string]int)."}}
{"run":184,"commit":"1cc66f1","metric":25.406,"metrics":{"build_ms":3559.359,"vm_output":29678473,"go_output":29678473,"binary_size_bytes":22957074},"status":"keep","description":"Parse lazy JSON integers manually","timestamp":1777359538877,"segment":0,"confidence":6.823112696707314,"iterationTokens":1476,"asi":{"hypothesis":"Lazy int-list and string-int-map parsers spend hot-path time in strconv.ParseFloat for simple integer JSON numbers; a manual integer parser with ParseFloat fallback can preserve integer-number semantics while avoiding strconv overhead","result":"Median improved from 28.778ms to 25.406ms with checks passing; binary grew by 64 bytes","why_it_worked":"decode_pipeline arrays and map values are plain JSON integer literals, so the new parser stays on a tight digit loop and only uses ParseFloat for decimal/exponent fallback cases","scope":"General lazy JSON integer decoding for decode.int list/map helpers, still supports decimal/exponent integer-valued numbers via fallback","risk":"Manual numeric parsing must preserve overflow and integer-equivalence semantics; add edge-case tests for negatives, decimals, exponents, and invalid values","next_action_hint":"Add numeric edge-case tests, then consider reducing duplicate validation overhead."}}
{"run":185,"commit":"1cc66f1","metric":25.490792,"metrics":{"build_ms":3431.638,"vm_output":29678473,"go_output":29678473,"binary_size_bytes":22957074},"status":"discard","description":"Add lazy JSON integer edge-case tests","timestamp":1777359580831,"segment":0,"confidence":6.82406661294655,"iterationTokens":1417,"asi":{"hypothesis":"Adding tests for lazy JSON integer parsing edge cases should protect correctness without changing generated binary performance","result":"Median regressed slightly from 25.406ms to 25.491ms; production binary unchanged but autoresearch primary did not improve","rollback_reason":"Primary metric worsened, so tests were not kept by the experiment logger","next_action_hint":"Re-add these tests during final cleanup or in a non-primary validation commit; they are correctness coverage, not a speed optimization."}}
{"run":186,"commit":"6b54508","metric":25.037333,"metrics":{"build_ms":3537.008,"vm_output":29678473,"go_output":29678473,"binary_size_bytes":22957074},"status":"keep","description":"Increase lazy int-list initial capacity","timestamp":1777359650387,"segment":0,"confidence":6.721581447318165,"iterationTokens":2605,"asi":{"hypothesis":"Lazy JSON int-list parsing appends 12-item arrays in decode_pipeline and currently grows from cap 8; using an initial cap of 16 can avoid one allocation while remaining a general small-list default","result":"Median improved from 25.406ms to 25.037ms with checks passing and unchanged binary size","why_it_worked":"The units and weights arrays fit in the initial slice capacity, reducing allocations in decodeLazyJSONIntList without the extra scan that made pre-counting regress","scope":"General lazy JSON int-list parser initial capacity for small-to-medium lists","risk":"Slightly higher memory use for very small decoded integer arrays; still much less than pre-counting overhead","next_action_hint":"Try smaller/larger capacities (12, 24/32) to find a robust default."}}
{"run":187,"commit":"087e1b4","metric":25.03275,"metrics":{"build_ms":3566.61,"vm_output":29678473,"go_output":29678473,"binary_size_bytes":22957074},"status":"keep","description":"Use cap 12 for lazy int-list parser","timestamp":1777359696707,"segment":0,"confidence":6.716894286142077,"iterationTokens":1024,"asi":{"hypothesis":"A lazy int-list initial capacity of 12 matches common small JSON arrays with less over-allocation than cap 16, and may preserve the no-growth benefit for decode_pipeline","result":"Median improved very slightly from 25.037ms to 25.033ms with checks passing","why_it_worked":"The benchmark arrays contain 12 elements, so cap 12 avoids append growth while allocating a smaller backing array than cap 16","scope":"General small-list capacity tuning for lazy JSON integer arrays","risk":"This is close to benchmark shape and near noise; broader decode workloads should validate whether 12 is better than 16","next_action_hint":"Try cap 10/24; avoid overfitting if differences are noise."}}
{"run":188,"commit":"087e1b4","metric":25.648375,"metrics":{"build_ms":3557.511,"vm_output":29678473,"go_output":29678473,"binary_size_bytes":22957074},"status":"discard","description":"Use cap 10 for lazy int-list parser","timestamp":1777359737992,"segment":0,"confidence":6.7278015003257385,"iterationTokens":1050,"asi":{"hypothesis":"A slightly smaller lazy int-list initial capacity may reduce allocation size while still helping common small arrays","result":"Median regressed from 25.033ms to 25.648ms; cap 10 forces growth for 12-element arrays and is worse","rollback_reason":"Primary metric worsened","next_action_hint":"Keep cap 12 for now, but validate against broader workloads to avoid overfitting."}}
{"run":189,"commit":"087e1b4","metric":25.363459,"metrics":{"build_ms":3568.977,"vm_output":29678473,"go_output":29678473,"binary_size_bytes":22957074},"status":"discard","description":"Use cap 24 for lazy int-list parser","timestamp":1777359784748,"segment":0,"confidence":6.738744195437105,"iterationTokens":872,"asi":{"hypothesis":"A larger lazy int-list initial capacity may support medium arrays without growth and maybe improve append code shape","result":"Median regressed from 25.033ms to 25.363ms; extra allocation size is worse for this workload","rollback_reason":"Primary metric worsened","next_action_hint":"Keep cap 12 as best tested, but note potential overfit risk."}}
{"run":190,"commit":"3358ee0","metric":22.882,"metrics":{"build_ms":3615.579,"vm_output":29678473,"go_output":29678473,"binary_size_bytes":22957138},"status":"keep","description":"Avoid unquoting simple lazy JSON keys","timestamp":1777359865423,"segment":0,"confidence":6.168936163157333,"iterationTokens":2356,"asi":{"hypothesis":"Lazy JSON field extraction, map parsing, and duplicate validation call strconv.Unquote for every object key; most JSON keys are simple unescaped strings, so slicing the key content directly can avoid allocations and strconv overhead while falling back for escaped keys","result":"Median improved from 25.033ms to 22.882ms with checks passing; binary grew 64 bytes","why_it_worked":"decode_pipeline scans top-level keys multiple times and parses the counts object; avoiding key unquote allocations reduces builtinExtractField and string-map parser overhead significantly","scope":"General lazy JSON scanner optimization for unescaped object names with escaped-key fallback preserving semantics","risk":"Returned key strings are substrings of the original JSON string, retaining that backing string while maps live; acceptable for lazy Dynamic lifetime but should be reviewed","next_action_hint":"Try reducing repeated top-level field scans or specializing lazy field lookup for multiple fields without benchmark-specific names."}}
{"run":191,"commit":"3358ee0","metric":23.077042,"metrics":{"build_ms":3605.743,"vm_output":29678473,"go_output":29678473,"binary_size_bytes":22973714},"status":"discard","description":"Parse top-level lazy JSON object fields eagerly","timestamp":1777359966228,"segment":0,"confidence":6.1781311652724344,"iterationTokens":2705,"asi":{"hypothesis":"decode_pipeline extracts several fields from the same JSON object; parsing the top-level object once into lazy field slices may avoid repeated field scans","result":"Median regressed from 22.882ms to 23.077ms and binary grew substantially; map allocation/code size outweighs avoiding repeated scans","rollback_reason":"Primary metric worsened","next_action_hint":"Keep top-level JSON as a raw lazy string and scan fields on demand."}}
{"run":192,"commit":"ef7693a","metric":22.458958,"metrics":{"build_ms":3675.036,"vm_output":29678473,"go_output":29678473,"binary_size_bytes":22973650},"status":"keep","description":"Use slice duplicate tracking in lazy JSON validator","timestamp":1777360011274,"segment":0,"confidence":6.061387212551486,"iterationTokens":1087,"asi":{"hypothesis":"Lazy JSON duplicate-name validation allocates a map for every object; most JSON objects have few keys, so tracking seen names in a small slice with linear search can reduce allocation overhead","result":"Median improved from 22.882ms to 22.459ms with checks passing; binary grew due lazy JSON code/tests retained on current branch","why_it_worked":"The benchmark JSON has small top-level/counts objects, so linear duplicate checks are cheap and avoid map allocation during every from_json validation","scope":"General duplicate-name validation strategy optimized for small JSON objects","risk":"Large JSON objects with many keys may validate slower than map-based tracking; consider hybrid slice-then-map threshold if broader workloads show regressions","next_action_hint":"Try a fixed array or lazy allocation for duplicate tracking to reduce allocations further without hurting large objects."}}
{"run":193,"commit":"4d06749","metric":22.358958,"metrics":{"build_ms":3562.303,"vm_output":29678473,"go_output":29678473,"binary_size_bytes":22973650},"status":"keep","description":"Use fixed small duplicate tracker in lazy JSON validator","timestamp":1777360068076,"segment":0,"confidence":6.0318890296515155,"iterationTokens":1502,"asi":{"hypothesis":"Replacing the duplicate-name validation slice allocation with a fixed small array and map fallback can remove allocations for common small JSON objects while preserving large-object behavior","result":"Median improved slightly from 22.459ms to 22.359ms with checks passing and unchanged binary size","why_it_worked":"The top-level and nested benchmark objects fit in the fixed array, so duplicate validation avoids per-object slice/map allocation","scope":"General lazy JSON duplicate validation for small objects with fallback for objects exceeding eight keys","risk":"More complex validation code; large objects pay a transition cost to allocate and populate the fallback map","next_action_hint":"Try different fixed capacities only if broader data suggests it; avoid overfitting to four-key objects."}}
{"run":194,"commit":"4d06749","metric":22.8585,"metrics":{"build_ms":3698.325,"vm_output":29678473,"go_output":29678473,"binary_size_bytes":22973650},"status":"discard","description":"Use four-slot duplicate tracker in lazy JSON validator","timestamp":1777360114155,"segment":0,"confidence":6.018696514619296,"iterationTokens":1040,"asi":{"hypothesis":"A four-slot fixed duplicate-name tracker may be enough for common small JSON objects and reduce stack work compared with eight slots","result":"Median regressed from 22.359ms to 22.859ms; four slots are worse despite fitting the benchmark objects","rollback_reason":"Primary metric worsened","next_action_hint":"Keep eight-slot duplicate tracker."}}
{"run":195,"commit":"9e5ada6","metric":22.333375,"metrics":{"build_ms":3617.966,"vm_output":29678473,"go_output":29678473,"binary_size_bytes":22973650},"status":"keep","description":"Use sixteen-slot duplicate tracker in lazy JSON validator","timestamp":1777360152569,"segment":0,"confidence":5.998690049695916,"iterationTokens":837,"asi":{"hypothesis":"A larger fixed duplicate-name tracker may improve codegen or avoid fallback for moderately sized objects while preserving allocation-free validation for common cases","result":"Median improved slightly from 22.359ms to 22.333ms with checks passing and unchanged binary size","why_it_worked":"The larger fixed array did not increase binary size and produced slightly better validation code layout/noise than eight slots","scope":"General lazy JSON duplicate-name validation threshold before map fallback","risk":"Very small improvement near noise; stack footprint is larger and should be validated broadly","next_action_hint":"Do not over-tune this threshold without broader JSON workloads."}}
