{"run":96,"commit":"3d0327f","metric":35.123542,"metrics":{"build_ms":3498.21,"vm_output":29678473,"go_output":29678473,"binary_size_bytes":22954834},"status":"discard","description":"Use direct Result literals in ExtractField raw map fast path","timestamp":1777354465558,"segment":0,"confidence":9.49711374777612,"iterationTokens":1681,"asi":{"hypothesis":"The new builtinExtractField raw map fast path is hot; direct Result literals may avoid Ok constructor overhead for field lookup success/missing cases","result":"Median regressed from 34.87ms to 35.12ms; Ok constructor codegen is better here","rollback_reason":"Primary metric worsened","next_action_hint":"Keep Ok constructors in builtinExtractField raw map fast path."}}
{"run":97,"commit":"3d0327f","metric":35.055,"metrics":{"build_ms":3505.831,"vm_output":29678473,"go_output":29678473,"binary_size_bytes":22954834},"status":"discard","description":"Specialize MapKeys for string key type via zero-value check","timestamp":1777354523928,"segment":0,"confidence":9.253669798897063,"iterationTokens":2700,"asi":{"hypothesis":"Now that decode.map uses map[string]any, MapKeys is hot with K=string; checking the key type once could avoid per-key comma-ok assertions in the all-string fast path","result":"Median regressed from 34.87ms to 35.06ms; extra generic type check/assertion shape hurt codegen","rollback_reason":"Primary metric worsened","next_action_hint":"Keep existing all-string MapKeys implementation."}}
{"run":98,"commit":"7dd3c67","metric":34.857875,"metrics":{"build_ms":3504.094,"vm_output":29678473,"go_output":29678473,"binary_size_bytes":22954834},"status":"keep","description":"Use type switch for DecodeIntErrorsExtern float fast path","timestamp":1777354563298,"segment":0,"confidence":9.218306832831962,"iterationTokens":1250,"asi":{"hypothesis":"DecodeIntErrorsExtern is hot for JSON float64 numbers; a single-case type switch may codegen slightly better than comma-ok assertion now that the slow path is split","result":"Median improved slightly from 34.87ms to 34.86ms with checks passing","why_it_worked":"The hot int decoder success path has a simpler typed value binding shape for the compiler, while fallback behavior is unchanged","scope":"Only the error-list int decode helper used by public decode.int changed; generic DecodeIntExtern remains unchanged","risk":"Very small improvement near noise; keep only because checks pass and code remains straightforward","next_action_hint":"Avoid similar type switch for DecodeStringErrorsExtern; it was already tested and regressed."}}
{"run":99,"commit":"7dd3c67","metric":34.973959,"metrics":{"build_ms":3512.31,"vm_output":29678473,"go_output":29678473,"binary_size_bytes":22954834},"status":"discard","description":"Use type switch for builtinExtractField raw map fast path","timestamp":1777354607844,"segment":0,"confidence":9.187430796848671,"iterationTokens":1218,"asi":{"hypothesis":"Like the int decoder, builtinExtractField's raw map fast path might benefit from a single-case type switch instead of comma-ok assertion","result":"Median regressed from 34.86ms to 34.97ms; type switch shape is worse for map field extraction","rollback_reason":"Primary metric worsened","next_action_hint":"Keep comma-ok assertion in builtinExtractField raw map fast path."}}
{"run":100,"commit":"2c4e5a0","metric":34.413083,"metrics":{"build_ms":3575.172,"vm_output":29678473,"go_output":29678473,"binary_size_bytes":22953138},"status":"keep","description":"Specialize decode.map calls with decode.string keys","timestamp":1777354691491,"segment":0,"confidence":8.705469699723608,"iterationTokens":3245,"asi":{"hypothesis":"For JSON object maps decoded with decode.string keys, the generic decode.map still wraps each raw string key as Dynamic and re-decodes it; a string_map decoder can preserve semantics while skipping the key decoder path for known string keys","result":"Median improved from 34.86ms to 34.41ms (~1.3%) with full checks passing and binary size down ~1.7KB","why_it_worked":"decode_pipeline decodes counts with decode.map(decode.string, decode.int); lowering routes that general stdlib pattern to decode.string_map, avoiding Dyn::from_str, DecodeStringErrors, and key error-path machinery for every object key","scope":"General optimization for ard/decode::map when the key decoder is ard/decode::string, not tied to benchmark paths or field names","risk":"Adds a public stdlib helper and a Go lowering special case for a stdlib pattern; must preserve behavior for custom key decoders via the original map function","next_action_hint":"Consider a similar specialization for decode.map(decode.int, value) only if JSON object int-key decoding is common and can preserve string-to-int error semantics."}}
{"run":101,"commit":"6b4e8cd","metric":34.050334,"metrics":{"build_ms":3538.241,"vm_output":29678473,"go_output":29678473,"binary_size_bytes":22953138},"status":"keep","description":"Specialize decode.map for string-to-int maps","timestamp":1777354752302,"segment":0,"confidence":8.280723249027233,"iterationTokens":2282,"asi":{"hypothesis":"The common decode.map(decode.string, decode.int) pattern can avoid both the generic key decoder path and the value decoder function call by routing to a string_int_map stdlib decoder that calls the int error-list extern directly","result":"Median improved from 34.41ms to 34.05ms (~1.1%) with checks passing and unchanged binary size","why_it_worked":"counts decoding no longer calls a value decoder closure for each map value; it directly matches _decode_int_errors(v) inside the specialized stdlib map decoder","scope":"General specialization for ard/decode string-key integer maps, a common JSON object shape; original generic map remains for custom key/value decoders","risk":"Adds another stdlib helper and compiler special case for a concrete stdlib decoder combination; avoid expanding this combinatorially without broader benchmark evidence","next_action_hint":"Consider measuring broader benchmarks before adding more decode.map scalar specializations."}}
{"run":102,"commit":"7813a78","metric":33.773,"metrics":{"build_ms":3512.153,"vm_output":29678473,"go_output":29678473,"binary_size_bytes":22953138},"status":"keep","description":"Specialize decode.list calls with decode.int elements","timestamp":1777354825297,"segment":0,"confidence":8.104993175443584,"iterationTokens":2668,"asi":{"hypothesis":"The common decode.list(decode.int) pattern can avoid a per-element decoder function call by routing to an int_list stdlib decoder that calls the int error-list extern directly","result":"Median improved from 34.05ms to 33.77ms (~0.8%) with checks passing","why_it_worked":"units and weights decoding no longer invoke the generic decoder closure for each array element; they directly match _decode_int_errors(item) inside a specialized list decoder","scope":"General specialization for ard/decode integer lists; original generic list remains for custom decoders","risk":"Adds a stdlib helper and compiler special case for a concrete stdlib decoder; avoid adding many scalar combinations without broader benchmark evidence","next_action_hint":"Measure broader benchmark suite before considering more decode.list scalar specializations."}}
{"run":103,"commit":"c4fbce6","metric":32.233625,"metrics":{"build_ms":3783.833,"vm_output":29678473,"go_output":29678473,"binary_size_bytes":22955042},"status":"keep","description":"Add direct int-list decode extern","timestamp":1777354955655,"segment":0,"confidence":7.634907475943739,"iterationTokens":4474,"asi":{"hypothesis":"The specialized int_list stdlib decoder still loops in generated Go and constructs/matches a Result for every element; a dedicated DecodeIntListErrors extern can decode raw JSON []any of numbers into []int directly while preserving indexed error paths","result":"Median improved from 33.77ms to 32.23ms (~4.6%) with full checks passing; binary grew ~1.9KB","why_it_worked":"units and weights are hot integer arrays; the Go helper preallocates the output length, fills by index, and only constructs per-element Results on cold fallback/error paths","scope":"General FFI/std_lib optimization for ard/decode integer list decoding, with Go/JS/VM implementations and the original generic list decoder retained for custom decoders","risk":"Adds more FFI surface and duplicates list error path logic; must keep path semantics consistent with generic decode.list","next_action_hint":"Consider a direct string-int map extern next: the specialized string_int_map still loops in generated Go and constructs/matches per-value int Results."}}
{"run":104,"commit":"4abba29","metric":32.203417,"metrics":{"build_ms":3696.222,"vm_output":29678473,"go_output":29678473,"binary_size_bytes":22956546},"status":"keep","description":"Add direct string-int map decode extern","timestamp":1777355071380,"segment":0,"confidence":7.6519940596412015,"iterationTokens":5541,"asi":{"hypothesis":"The specialized string_int_map stdlib decoder still loops in generated Go and matches per-value int Results; a dedicated DecodeStringIntMapErrors extern can decode raw string-key JSON maps to map[string]int directly","result":"Median improved slightly from 32.23ms to 32.20ms with full checks passing; binary grew ~1.5KB","why_it_worked":"counts decoding uses the direct Go helper, which preallocates the output map and only constructs per-value Results on cold fallback/error paths","scope":"General FFI/std_lib optimization for ard/decode string-to-int JSON maps, with Go/JS/VM implementations","risk":"Small improvement near noise and more duplicated FFI error-path logic; should be validated on broader decode workloads before adding more scalar map helpers","next_action_hint":"Further decode-specific helpers have diminishing returns; consider broader suite measurement or profiling current best."}}
{"run":105,"commit":"2eef2cc","metric":31.691375,"metrics":{"build_ms":3569.068,"vm_output":29678473,"go_output":29678473,"binary_size_bytes":22956546},"status":"keep","description":"Fast-path raw arrays in direct int-list decoder","timestamp":1777355129634,"segment":0,"confidence":7.983468211732845,"iterationTokens":2839,"asi":{"hypothesis":"DecodeIntListErrorsExtern hot inputs are already raw JSON []any arrays; checking that directly inside the dedicated helper can avoid constructing a Result via builtinDynamicToList on the success path","result":"Median improved from 32.20ms to 31.69ms (~1.6%) with checks passing","why_it_worked":"units/weights decoding now bypasses DynamicToList Result construction and builtinDynamicValue for raw JSON arrays before filling []int","scope":"General fast path for direct int-list decode helper; fallback preserves Encodable/slice behavior via builtinDynamicToList","risk":"Repeats a raw []any branch that previously regressed in generic DynamicToList, but it is profitable inside the dedicated int-list helper","next_action_hint":"Try analogous raw map[string]any fast path inside DecodeStringIntMapErrorsExtern, even though DynamicToStringMapExtern already has one, to avoid its Result construction."}}
{"run":106,"commit":"2eef2cc","metric":31.813834,"metrics":{"build_ms":3622.682,"vm_output":29678473,"go_output":29678473,"binary_size_bytes":22956546},"status":"discard","description":"Fast-path raw maps in direct string-int map decoder","timestamp":1777355166602,"segment":0,"confidence":8.034701865027177,"iterationTokens":1240,"asi":{"hypothesis":"DecodeStringIntMapErrorsExtern hot inputs are raw JSON map[string]any values; checking that directly could avoid DynamicToStringMapExtern Result construction like the int-list raw array fast path did","result":"Median regressed from 31.69ms to 31.81ms; unlike list decoding, the existing DynamicToStringMapExtern raw path codegens better","rollback_reason":"Primary metric worsened","next_action_hint":"Keep DecodeStringIntMapErrorsExtern calling DynamicToStringMapExtern for map conversion."}}
{"run":107,"commit":"2eef2cc","metric":31.825917,"metrics":{"build_ms":3505.982,"vm_output":29678473,"go_output":29678473,"binary_size_bytes":22956546},"status":"discard","description":"Use type switch in direct int-list decode loop","timestamp":1777355214013,"segment":0,"confidence":8.086597346261808,"iterationTokens":1129,"asi":{"hypothesis":"The scalar DecodeIntErrorsExtern benefited from a float64 type switch; applying the same shape inside the direct int-list loop may improve per-element number decoding","result":"Median regressed from 31.69ms to 31.83ms; the loop body codegen is better with comma-ok assertion","rollback_reason":"Primary metric worsened","next_action_hint":"Keep comma-ok float64 assertion inside DecodeIntListErrorsExtern."}}
{"run":108,"commit":"94ed8c3","metric":31.956625,"metrics":{"build_ms":3576.462,"vm_output":29678473,"go_output":29678473,"binary_size_bytes":22956546},"status":"discard","description":"Use type switch in direct string-int map decode loop","timestamp":1777355301905,"segment":0,"confidence":7.922390193161433,"iterationTokens":1129,"asi":{"hypothesis":"The direct string-int map helper decodes float64 JSON values in a loop; a single-case type switch might improve per-value int decode like it did for scalar DecodeIntErrorsExtern","result":"Median regressed from 31.69ms to 31.96ms; comma-ok assertion remains better inside decode helper loops","rollback_reason":"Primary metric worsened","next_action_hint":"Keep comma-ok float64 assertions in direct list/map decode loops."}}
{"run":109,"commit":"94ed8c3","metric":31.87825,"metrics":{"build_ms":3526.583,"vm_output":29678473,"go_output":29678473,"binary_size_bytes":22956546},"status":"discard","description":"Append into preallocated int-list decode output","timestamp":1777355344373,"segment":0,"confidence":7.471371202355273,"iterationTokens":1165,"asi":{"hypothesis":"DecodeIntListErrorsExtern currently makes a full-length []int and assigns by index; using make([]int,0,len(raw)) plus append may avoid zeroing or improve bounds-check elimination","result":"Median regressed from 31.69ms to 31.88ms; full-length make with index assignment is faster","rollback_reason":"Primary metric worsened","next_action_hint":"Keep direct int-list decoder output as make(len) and index assignment."}}
{"run":110,"commit":"94ed8c3","metric":0,"metrics":{"build_ms":0,"vm_output":0,"go_output":0,"binary_size_bytes":0},"status":"crash","description":"Return named decoder functions from int_list and string_int_map","timestamp":1777355463463,"segment":0,"confidence":7.471371202355273,"iterationTokens":7510,"asi":{"hypothesis":"Specialized stdlib decoder constructors currently return no-capture closures; returning named decoder functions might avoid closure allocation/calls","failure_mode":"Generated Go treated decode.IntList and decode.StringIntMap as direct decoder functions requiring a data argument, so decode.IntList() calls failed to compile","rollback_reason":"Compilation failed","next_action_hint":"Do not rewrite these stdlib helpers to return named function identifiers without understanding Ard function value lowering; consider backend-level no-capture closure optimization instead."}}
{"run":111,"commit":"94ed8c3","metric":0,"metrics":{"build_ms":0,"vm_output":0,"go_output":0,"binary_size_bytes":0},"status":"crash","description":"Inline decode.run calls after specialized decode helpers","timestamp":1777355567608,"segment":0,"confidence":7.471371202355273,"iterationTokens":1583,"asi":{"hypothesis":"Earlier decode.run inlining regressed before current specialized decoders; retrying after int-list/string-int-map helpers might remove wrapper calls around field decoders","failure_mode":"Go backend native emission rejected decode_once as unsupported after lowering run to a call expression whose callee is itself an expression","rollback_reason":"Compilation failed before benchmark","next_action_hint":"Do not inline decode.run this way; a safe implementation would require emitter support for call-expression callees and tests before benchmarking."}}
{"run":112,"commit":"94ed8c3","metric":32.103916,"metrics":{"build_ms":3715.621,"vm_output":29678473,"go_output":29678473,"binary_size_bytes":22956546},"status":"discard","description":"Add direct field decoders for int lists and string-int maps","timestamp":1777355740706,"segment":0,"confidence":7.258778899148234,"iterationTokens":7962,"asi":{"hypothesis":"decode.field(name, specializedDecoder) still constructs a generic field closure and ExtractField Result; direct field decoders for int lists and string-int maps can combine field extraction with the direct decode helpers","result":"Median regressed from 31.69ms to 32.10ms; added helper layers and duplicated field error logic outweighed generic Field overhead","rollback_reason":"Primary metric worsened","next_action_hint":"Keep generic decode.field around specialized list/map decoders; do not add direct field FFI helpers for this workload."}}
{"run":113,"commit":"94ed8c3","metric":31.771583,"metrics":{"build_ms":3659.317,"vm_output":29678473,"go_output":29678473,"binary_size_bytes":22956546},"status":"discard","description":"Use sorting network for four string MapKeys","timestamp":1777355798656,"segment":0,"confidence":7.158118668733529,"iterationTokens":1656,"asi":{"hypothesis":"Small string maps are common in JSON decode; a fixed compare-swap network for four all-string keys may avoid sort.Strings call overhead while preserving deterministic order","result":"Median regressed from 31.69ms to 31.77ms; specialized small sort code still hurts overall codegen/runtime","rollback_reason":"Primary metric worsened","next_action_hint":"Keep sort.Strings for all-string MapKeys, even for four-key maps."}}
{"run":114,"commit":"94ed8c3","metric":31.773792,"metrics":{"build_ms":3674.684,"vm_output":29678473,"go_output":29678473,"binary_size_bytes":22956546},"status":"discard","description":"Use index-only range in direct int-list decoder","timestamp":1777355848546,"segment":0,"confidence":7.3201510116972965,"iterationTokens":1339,"asi":{"hypothesis":"Iterating `for idx := range raw` and loading raw[idx] explicitly might reduce interface copy or improve bounds-check elimination in DecodeIntListErrorsExtern","result":"Median regressed from 31.69ms to 31.77ms; normal range over index,value is better","rollback_reason":"Primary metric worsened","next_action_hint":"Keep `for idx, item := range raw` in DecodeIntListErrorsExtern."}}
{"run":115,"commit":"94ed8c3","metric":31.778042,"metrics":{"build_ms":3510.679,"vm_output":29678473,"go_output":29678473,"binary_size_bytes":22956546},"status":"discard","description":"Remove capacity hint from direct string-int map output","timestamp":1777355895808,"segment":0,"confidence":7.11999010568761,"iterationTokens":1025,"asi":{"hypothesis":"Direct string-int map decoding builds small maps; omitting the capacity hint may let Go use a cheaper small-map allocation path","result":"Median regressed from 31.69ms to 31.78ms; capacity hint remains better","rollback_reason":"Primary metric worsened","next_action_hint":"Keep make(map[string]int, len(raw)) in DecodeStringIntMapErrorsExtern."}}
{"run":116,"commit":"94ed8c3","metric":32.321542,"metrics":{"build_ms":3677.939,"vm_output":29678473,"go_output":29678473,"binary_size_bytes":22956738},"status":"discard","description":"Use Ok/Err constructors in direct int-list decode result","timestamp":1777355944264,"segment":0,"confidence":7.119856539654966,"iterationTokens":1140,"asi":{"hypothesis":"Generic Ok/Err constructors might codegen better than direct Result literals for the direct int-list helper's final success/error return","result":"Median regressed badly from 31.69ms to 32.32ms and binary grew; direct literals are much better here","rollback_reason":"Primary metric worsened","next_action_hint":"Keep direct Result literals in DecodeIntListErrorsExtern final returns."}}
{"run":117,"commit":"94ed8c3","metric":31.9335,"metrics":{"build_ms":3518.489,"vm_output":29678473,"go_output":29678473,"binary_size_bytes":22956546},"status":"discard","description":"Check nil error slices in direct decode helpers","timestamp":1777355994003,"segment":0,"confidence":7.1197229786334475,"iterationTokens":1145,"asi":{"hypothesis":"Direct int-list and string-int map helpers leave errors nil on the hot success path, so `errors == nil` may be cheaper than `len(errors) == 0`","result":"Median regressed from 31.69ms to 31.93ms; len check codegen is better","rollback_reason":"Primary metric worsened","next_action_hint":"Keep len(errors)==0 in direct decode helpers."}}
{"run":118,"commit":"b67fb14","metric":31.888875,"metrics":{"build_ms":3522.498,"vm_output":29678473,"go_output":29678473,"binary_size_bytes":22956546},"status":"discard","description":"Use classic index loop in direct int-list decoder","timestamp":1777356065178,"segment":0,"confidence":7.120789207158463,"iterationTokens":1471,"asi":{"hypothesis":"A classic `for idx := 0; idx < len(raw); idx++` loop might improve bounds-check elimination over range in DecodeIntListErrorsExtern","result":"Median regressed from 31.69ms to 31.89ms; range loop is better","rollback_reason":"Primary metric worsened","next_action_hint":"Keep range loop in DecodeIntListErrorsExtern."}}
