{"type":"config","name":"Optimize Ard generated Go decode_pipeline runtime","metricName":"go_decode_ms","metricUnit":"ms","bestDirection":"lower"}
{"run":1,"commit":"993488b","metric":0,"metrics":{},"status":"crash","description":"Baseline harness failed because generated Go build did not create expected output path","timestamp":1777347699805,"segment":0,"confidence":null,"iterationTokens":87,"asi":{"hypothesis":"Establish baseline benchmark harness for generated Go decode_pipeline runtime","failure_mode":"autoresearch.sh assumed `ard build --target go --out /tmp/decode-go` creates the binary at that path; the binary was missing when Python tried to run it","rollback_reason":"Harness bug, not an optimization result","next_action_hint":"Inspect Go backend build output behavior or use the path printed/returned by build; fix autoresearch.sh before collecting baseline"}}
{"run":2,"commit":"afe08ad","metric":403.949916,"metrics":{"build_ms":3821.509,"vm_output":29678473,"go_output":29678473,"binary_size_bytes":22956946},"status":"keep","description":"Baseline generated Go decode_pipeline runtime after fixing harness","timestamp":1777347794715,"segment":0,"confidence":null,"iterationTokens":3143,"asi":{"hypothesis":"Baseline measurement for generated Go decode_pipeline after harness fixes","baseline_context":"Median of 9 direct generated binary executions; output verified as 29678473; checks passed","samples_ms":[411.469667,405.356083,406.594,403.949916,400.173375,402.467459,399.272541,402.930916,409.125333],"implementation_state":"No optimization changes yet; current target bottleneck likely extern dispatch and reflection-heavy DynamicToList/DynamicToMap in compiler/go decode builtins"}}
{"run":3,"commit":"ad4cfab","metric":401.487458,"metrics":{"build_ms":4543.563,"vm_output":29678473,"go_output":29678473,"binary_size_bytes":22956946},"status":"keep","description":"Remove read lock from extern registry call path","timestamp":1777347829874,"segment":0,"confidence":null,"iterationTokens":1334,"asi":{"hypothesis":"CallExtern is hot in decode_pipeline; avoiding RWMutex RLock/RUnlock on every extern lookup should reduce generated Go decode overhead","result":"Small median improvement from 403.95ms to 401.49ms; likely near noise but change is simple","risk":"ExternRegistry Call is no longer safe during concurrent map writes; typical generated programs register builtins before Main and only read during execution","next_action_hint":"Try larger wins in compiler/go/decode_builtins.go by avoiding reflection in DynamicToList/DynamicToMap and avoiding map copy in ExtractField"}}
{"run":4,"commit":"079d7dc","metric":389.6285,"metrics":{"build_ms":3623.216,"vm_output":29678473,"go_output":29678473,"binary_size_bytes":22956994},"status":"keep","description":"Fast-path JSON dynamic list/map decode builtins","timestamp":1777347872289,"segment":0,"confidence":158.2274702756371,"iterationTokens":2782,"asi":{"hypothesis":"decode_pipeline JSON values are plain []any and map[string]any, so avoiding reflection and avoiding full map copy in ExtractField should reduce decode overhead","result":"Median improved from 401.49ms to 389.63ms (~3.0%); binary size +48 bytes","why_it_worked":"ExtractField no longer copies the entire object map for each field lookup; DynamicToList/DynamicToMap use direct type assertions on common JSON shapes before reflective fallback","next_action_hint":"Consider avoiding copies entirely for DynamicToList/DynamicToMap or eliminating CallExtern varargs/map lookup for builtins"}}
{"run":5,"commit":"5863336","metric":382.846417,"metrics":{"build_ms":3604.721,"vm_output":29678473,"go_output":29678473,"binary_size_bytes":22956994},"status":"keep","description":"Avoid copying JSON dynamic lists and maps on Go decode fast path","timestamp":1777347906182,"segment":0,"confidence":53.46488322104462,"iterationTokens":1236,"asi":{"hypothesis":"For Go backend Dynamic values, returning underlying []any/map[string]any from decode conversion avoids per-decode allocations/copies in hot JSON decode loops","result":"Median improved from 389.63ms to 382.85ms (~1.7%) with checks passing","semantic_risk":"Potential aliasing: callers mutating decoded []any/map[string]any can now mutate the underlying Dynamic value in generated Go. Existing tests did not catch this; future review should decide whether performance justifies aliasing or whether copy-on-write semantics are required","next_action_hint":"Investigate CallExtern overhead and generated decode code; direct builtin calls or cached extern function pointers may be larger wins without aliasing semantics"}}
{"run":6,"commit":"154cf9b","metric":381.583125,"metrics":{"build_ms":3478.911,"vm_output":29678473,"go_output":29678473,"binary_size_bytes":22957058},"status":"keep","description":"Fast-path built-in decode externs in CallExtern","timestamp":1777347951812,"segment":0,"confidence":47.428879946553266,"iterationTokens":365,"asi":{"hypothesis":"Hot decode extern calls spend time in registry map lookup; direct switch cases for built-in decode externs in CallExtern should reduce dispatch overhead","result":"Two measurements after change were 382.84ms and 381.58ms versus prior 382.85ms; real effect is very small and likely around noise","tradeoff":"Adds hardcoded fast paths for built-in decode extern names in the general extern dispatcher; maintainability cost may be higher than the tiny gain","next_action_hint":"Larger wins probably require generated code avoiding CallExtern entirely, or optimizing Result/decoder allocation patterns"}}
{"run":7,"commit":"7a634d0","metric":381.099209,"metrics":{"build_ms":3571.253,"vm_output":29678473,"go_output":29678473,"binary_size_bytes":22957058},"status":"keep","description":"Check float64 first in Go decode int builtin","timestamp":1777348015770,"segment":0,"confidence":77.83425660012247,"iterationTokens":4577,"asi":{"hypothesis":"JSON numbers arrive as float64 in Go backend Dynamic values, so checking float64 first in builtinDecodeInt avoids failed type-switch cases in the hot path","result":"Small median improvement from 381.58ms to 381.10ms; likely modest but directionally consistent","evidence":"Confirmed ffi.JsonToDynamic decodes JSON numeric values as float64","next_action_hint":"Try reducing allocation from Result/error slices or generated empty list literals in successful decodes"}}
{"run":8,"commit":"7a634d0","metric":379.893291,"metrics":{"build_ms":4465.791,"vm_output":29678473,"go_output":29678473,"binary_size_bytes":22957058},"status":"checks_failed","description":"Emit append assignment for list_push statements and map index assignment for map_set statements","timestamp":1777348127917,"segment":0,"confidence":129.04942389860787,"iterationTokens":11592,"asi":{"hypothesis":"Avoiding helper calls for push/set statements should reduce generated Go overhead in decode loops","result":"Benchmark improved to 379.89ms but checks failed due an updated test expecting map_set statement emission in a case where map_set result is assigned, so code correctly kept helper call there","rollback_reason":"checks_failed from test expectation mismatch; experiment needs to be reapplied with only list_push test expectation changed, or a dedicated map_set statement case","next_action_hint":"Reapply list_push statement direct append; keep map_set expression tests unchanged unless adding a true ExprStmt map_set fixture"}}
{"run":9,"commit":"7a634d0","metric":379.583416,"metrics":{"build_ms":3541.66,"vm_output":29678473,"go_output":29678473,"binary_size_bytes":22957058},"status":"checks_failed","description":"Reapply direct list_push/map_set statement emission with partial test update","timestamp":1777348176437,"segment":0,"confidence":153.89134061603121,"iterationTokens":2832,"asi":{"hypothesis":"Direct append/map assignment for ignored push/set results avoids helper call overhead","result":"Benchmark improved to 379.58ms but another go_backend test still expected old ListPush helper in a mutable function param fixture","rollback_reason":"checks_failed due stale test expectation in TestCompileModuleSourceViaBackendIR_MutableFunctionParamsNative","next_action_hint":"Reapply and update both backend_ir_emit_test expectations: list push statements now render as append assignment for locals and dereferenced mutable params"}}
{"run":10,"commit":"e4f270b","metric":380.903375,"metrics":{"build_ms":3538,"vm_output":29678473,"go_output":29678473,"binary_size_bytes":22957058},"status":"keep","description":"Emit direct append/map assignment for ignored push/set results","timestamp":1777348232297,"segment":0,"confidence":225.40875316746835,"iterationTokens":2663,"asi":{"hypothesis":"When list_push/map_set return values are ignored, generated Go can emit native `append` assignment and `map[key] = value` instead of helper calls","result":"Median improved from 381.10ms to 380.90ms with checks passing; smaller effect than earlier noisy failed runs but still lower","scope":"Only ExprStmt calls are rewritten; expressions that use the returned push/set value still call helpers","next_action_hint":"Consider a backend IR or source optimization to preallocate list decoder output capacity, which may reduce append allocations more than helper-call removal"}}
{"run":11,"commit":"c4a5570","metric":240.350958,"metrics":{"build_ms":4743.318,"vm_output":29678473,"go_output":29678473,"binary_size_bytes":22957122},"status":"keep","description":"Avoid reflective method calls when coercing Ard Result values","timestamp":1777348301185,"segment":0,"confidence":147.31896067454585,"iterationTokens":5615,"asi":{"hypothesis":"CoerceExtern spends substantial time reflect-calling IsOk/UnwrapOk on ardgo.Result values returned by decode externs; reading Result fields directly inside package ardgo should cut hot success-path overhead","result":"Large improvement from 380.90ms to 240.35ms (~37%) with checks passing","why_it_worked":"DecodeInt/List/Map/Field extern wrappers return ardgo.Result many times; success-path coercion now avoids reflect.MethodByName and Method.Call for Result","risk":"Uses unsafe-based field access already present for setting unexported fields; limited to source values whose type is ardgo.Result, with old method-based fallback retained for other result-like types","next_action_hint":"Apply analogous direct-field fast path to Maybe coercion or specialize CoerceExtern for common successful decode scalar/list/map results"}}
{"run":12,"commit":"533d166","metric":231.488792,"metrics":{"build_ms":3847.72,"vm_output":29678473,"go_output":29678473,"binary_size_bytes":22956034},"status":"keep","description":"Return DynamicToMap as map[any]any to avoid reflective map coercion","timestamp":1777348369076,"segment":0,"confidence":132.49068914519617,"iterationTokens":4063,"asi":{"hypothesis":"Generated decode.to_map expects [Dynamic:Dynamic] as map[any]any; returning map[string]any forced CoerceExtern to reflect-copy every decoded map","result":"Median improved from 240.35ms to 231.49ms (~3.7%); binary size decreased by about 1KB","why_it_worked":"builtinDynamicToMap now builds the target map[any]any directly, so CoerceExtern can return the Result without reflective map key/value conversion","tradeoff":"Still copies map[string]any JSON objects into map[any]any; direct aliasing is impossible across key types","next_action_hint":"Optimize map key sorting/iteration for map[any]any with string keys, or reduce Result coercion allocations further"}}
{"run":13,"commit":"c722f83","metric":230.069084,"metrics":{"build_ms":4462.633,"vm_output":29678473,"go_output":29678473,"binary_size_bytes":22956034},"status":"keep","description":"Fast-path string-key maps in Go MapKeys","timestamp":1777348407966,"segment":0,"confidence":43.9384584122755,"iterationTokens":1902,"asi":{"hypothesis":"decode_pipeline iterates maps whose keys are strings; MapKeys can avoid generic mapKeyLess sort comparisons by detecting all-string keys and using sort.Strings","result":"Median improved from 231.49ms to 230.07ms (~0.6%) with checks passing","scope":"Fast path applies to map[string]V and map[any]V when all dynamic keys are strings; fallback generic ordering remains for mixed/non-string keys","next_action_hint":"More substantial wins likely require reducing CoerceExtern reflection for struct errors or avoiding Result coercion in generated extern wrappers entirely"}}
{"run":14,"commit":"c722f83","metric":230.53,"metrics":{"build_ms":4490.068,"vm_output":29678473,"go_output":29678473,"binary_size_bytes":22956034},"status":"discard","description":"Add generic direct type assertion fast path to CoerceExtern","timestamp":1777348448332,"segment":0,"confidence":26.368571682354148,"iterationTokens":1405,"asi":{"hypothesis":"Many extern results already have exactly the requested type, so a generic `value.(T)` check before reflection might avoid CoerceExtern overhead","result":"Median regressed from 230.07ms to 230.53ms; direct type assertion overhead did not pay off for this workload","rollback_reason":"Primary metric worsened; discard and revert","next_action_hint":"Do not re-try broad generic type assertion in CoerceExtern. If exact-type fast paths are needed, specialize known hot extern wrappers or avoid CoerceExtern at generation time"}}
{"run":15,"commit":"e2989e6","metric":189.3635,"metrics":{"build_ms":4641.437,"vm_output":29678473,"go_output":29678473,"binary_size_bytes":22956034},"status":"keep","description":"Use fixed field indexes for Ard Result coercion fast path","timestamp":1777348525574,"segment":0,"confidence":12.491287725320227,"iterationTokens":2665,"asi":{"hypothesis":"The hot CoerceExtern Result fast path still uses FieldByName for source/target Result fields; Result layout is fixed in package ardgo, so Field(0/1/2) should avoid name lookup overhead","result":"Large improvement from 230.07ms to 189.36ms (~17.7%) with checks passing","why_it_worked":"decode_pipeline performs many successful Result coercions; removing repeated reflective field-name lookup materially reduced per-decode overhead","risk":"Assumes Result field order remains value, err, ok; if Result layout changes this fast path must be updated","next_action_hint":"Apply analogous fixed field indexes to Maybe coercion, though decode_pipeline may not exercise Maybe; or reduce reflect.TypeFor/isResultType overhead in CoerceExtern"}}
{"run":16,"commit":"e2989e6","metric":190.095416,"metrics":{"build_ms":3856.227,"vm_output":29678473,"go_output":29678473,"binary_size_bytes":22956034},"status":"discard","description":"Replace strings.HasPrefix in Result/Maybe type checks with manual prefix comparison","timestamp":1777348572367,"segment":0,"confidence":8.769196792819086,"iterationTokens":1397,"asi":{"hypothesis":"isResultType/isMaybeType are hot in CoerceExtern; avoiding strings.HasPrefix might reduce overhead","result":"Median regressed from 189.36ms to 190.10ms; manual prefix check did not help","rollback_reason":"Primary metric worsened","next_action_hint":"Do not revisit this micro-optimization; focus on avoiding reflection/CoerceExtern calls entirely or reducing JSON parse overhead"}}
{"run":17,"commit":"e2989e6","metric":212.510208,"metrics":{"build_ms":3757.457,"vm_output":29678473,"go_output":29678473,"binary_size_bytes":22956034},"status":"discard","description":"Use encoding/json v1 for FFI JsonToDynamic","timestamp":1777348607579,"segment":0,"confidence":8.240241596145689,"iterationTokens":1208,"asi":{"hypothesis":"JSON parsing is hot in decode_pipeline; standard encoding/json might outperform encoding/json/v2 for dynamic object parsing","result":"Median regressed badly from 189.36ms to 212.51ms, so json/v2 is faster for this workload","rollback_reason":"Primary metric worsened significantly","next_action_hint":"Keep json/v2. Optimize wrapper/decoder overhead rather than parser implementation"}}
{"run":18,"commit":"6e38025","metric":45.662667,"metrics":{"build_ms":3875.735,"vm_output":29678473,"go_output":29678473,"binary_size_bytes":22954130},"status":"keep","description":"Emit direct wrappers for built-in decode externs in Go backend","timestamp":1777348701881,"segment":0,"confidence":1.8739936798473333,"iterationTokens":6100,"asi":{"hypothesis":"Generated stdlib extern wrappers still pay CallExtern + CoerceExtern overhead for decode builtins; emitting direct calls to typed ardgo helper functions should eliminate most hot dispatch/coercion overhead without benchmark-specific special casing","result":"Very large improvement from 189.36ms to 45.66ms (~75.9%) with checks passing; now near VM runtime for this benchmark","why_it_worked":"Successful DecodeInt/List/Map/Field/JsonToDynamic wrappers no longer allocate/coerce generic any results via reflection. Error conversion is still available on error paths via generic helper functions","scope":"Special-cases general built-in extern binding names (DecodeString/Int/Float/Bool, DynamicToList/Map, ExtractField, JsonToDynamic), not benchmark paths","risk":"Backend now knows selected built-in extern names; adding/changing those builtins requires keeping direct helper functions in sync","next_action_hint":"Inspect generated decode_pipeline code and profile remaining time; likely dominated by JSON parser and stdlib decoder closure/list/map allocation"}}
{"run":19,"commit":"9af0d30","metric":45.309333,"metrics":{"build_ms":3637.187,"vm_output":29678473,"go_output":29678473,"binary_size_bytes":22937554},"status":"keep","description":"Remove obsolete decode fast paths from CallExtern","timestamp":1777348746016,"segment":0,"confidence":0.5695758665229403,"iterationTokens":1970,"asi":{"hypothesis":"After direct backend emission for decode extern wrappers, the hardcoded decode switch in CallExtern is unused by this workload and can be removed to simplify runtime and shrink binaries","result":"Median slightly improved from 45.66ms to 45.31ms and binary size dropped by ~16.6KB","why_it_worked":"Generated decode_pipeline no longer calls CallExtern for these builtins, so removing the switch mainly reduces binary/code footprint without hurting the hot path","risk":"Other generated code using generic CallExtern for decode builtins now goes through registry again, but backend should direct-emit these extern wrappers when compiling stdlib modules","next_action_hint":"Consider whether the earlier no-lock ExternRegistry.Call change is still worthwhile or if restoring locking improves safety without affecting optimized decode path"}}
{"run":20,"commit":"9af0d30","metric":45.541541,"metrics":{"build_ms":3603.492,"vm_output":29678473,"go_output":29678473,"binary_size_bytes":22954066},"status":"discard","description":"Restore read lock in ExternRegistry.Call after direct decode extern emission","timestamp":1777348775711,"segment":0,"confidence":0.32236608922918775,"iterationTokens":1189,"asi":{"hypothesis":"Since decode_pipeline no longer uses CallExtern for hot decode builtins, restoring the registry read lock might improve safety without hurting the primary metric","result":"Median worsened from 45.31ms to 45.54ms and binary grew back by ~16.5KB","rollback_reason":"Primary metric worsened; keep current no-lock registry from earlier experiments for this branch","next_action_hint":"If safety is desired later, consider making the registry immutable after registration or using copy-on-write rather than putting lock overhead back into Call"}}
{"run":21,"commit":"0db495c","metric":45.004917,"metrics":{"build_ms":3672.925,"vm_output":29678473,"go_output":29678473,"binary_size_bytes":22937554},"status":"keep","description":"Avoid append-copy emission for empty list and map literals","timestamp":1777348835306,"segment":0,"confidence":0.31020455914074785,"iterationTokens":6939,"asi":{"hypothesis":"Generated decode code creates many empty lists/maps for output and errors; copying an empty literal via append([]T(nil), []T{}...) is unnecessary versus emitting []T{} or map[K]V{} directly","result":"Median improved from 45.31ms to 45.00ms with checks passing; small but consistent and simpler generated code","why_it_worked":"Successful list/map decoders allocate empty error containers and output containers on every decode; avoiding append-copy removes some work on initialization","risk":"Only applies to copying empty literals, where aliasing/copy semantics are equivalent for mutable collections because no backing elements exist","next_action_hint":"Preallocate decode list/map outputs with len(raw) capacity or avoid allocating errors slices until first error"}}
{"run":22,"commit":"0db495c","metric":45.329042,"metrics":{"build_ms":3944.337,"vm_output":29678473,"go_output":29678473,"binary_size_bytes":22954034},"status":"discard","description":"Use UnwrapOk instead of Expect for checked result try success paths","timestamp":1777348940680,"segment":0,"confidence":0.30081406029367597,"iterationTokens":6995,"asi":{"hypothesis":"Generated try success paths have already checked IsErr, so using UnwrapOk avoids Expect's redundant branch and panic message argument","result":"Median worsened from 45.00ms to 45.33ms, with noisy high samples; optimization did not improve this workload","rollback_reason":"Primary metric worsened","next_action_hint":"Do not retry UnwrapOk substitution without deeper profiling; compiler/inliner may already optimize Expect well enough"}}
