{"run":196,"commit":"d0f8ebb","metric":21.802042,"metrics":{"build_ms":3653.013,"vm_output":29678473,"go_output":29678473,"binary_size_bytes":22973650},"status":"keep","description":"Avoid trimming lazy JSON number slices","timestamp":1777360214098,"segment":0,"confidence":5.8774190356894405,"iterationTokens":1246,"asi":{"hypothesis":"Lazy JSON parser callers already pass number substrings with leading/trailing whitespace excluded, so parseLazyJSONIntNumber can skip strings.TrimSpace and remove that overhead","result":"Median improved from 22.333ms to 21.802ms with checks passing and unchanged binary size","why_it_worked":"The hot array/map number parser now enters the manual digit loop directly instead of calling strings.TrimSpace for every integer","scope":"Internal lazy JSON parser cleanup; generic whitespace handling remains in the caller via skipJSONSpaces/skipJSONValue delimiters","risk":"Relies on all parseLazyJSONIntNumber callers passing trimmed number ranges; current callers do so","next_action_hint":"Try further specialized unsigned digit parsing for positive integers while preserving negative/fallback semantics."}}
{"run":197,"commit":"53cd842","metric":21.452084,"metrics":{"build_ms":3553.695,"vm_output":29678473,"go_output":29678473,"binary_size_bytes":22973714},"status":"keep","description":"Specialize positive lazy JSON integer parsing","timestamp":1777360264683,"segment":0,"confidence":5.8043315858896785,"iterationTokens":1678,"asi":{"hypothesis":"Most lazy JSON integer values are positive digit-only tokens; separating the positive path from negative/floating fallback can simplify the hot digit loop","result":"Median improved from 21.802ms to 21.452ms with checks passing; binary grew by 64 bytes","why_it_worked":"The benchmark's list and map values are positive integers, so parsing avoids sign bookkeeping and ParseFloat helper setup on the hot path","scope":"General lazy JSON integer parser specialization with negative and decimal/exponent fallback preserved","risk":"Manual parser complexity increased; edge-case numeric tests should be restored before final review","next_action_hint":"Try inlining the positive parser at call sites or reducing duplicate validation scans."}}
{"run":198,"commit":"c902755","metric":20.804917,"metrics":{"build_ms":3607.707,"vm_output":29678473,"go_output":29678473,"binary_size_bytes":22973698},"status":"keep","description":"Parse lazy JSON integers in one scan","timestamp":1777360331451,"segment":0,"confidence":5.650791378767367,"iterationTokens":2340,"asi":{"hypothesis":"Lazy JSON integer decoders currently scan each number once to find its end and again to parse digits; parsing digits directly from the JSON string and returning the end offset can remove the duplicate scan","result":"Median improved from 21.452ms to 20.805ms with checks passing; binary shrank slightly","why_it_worked":"The hot path for positive integer tokens now reads each digit once and only falls back to skipJSONValue/ParseFloat for decimals, exponents, or unsupported values","scope":"General lazy JSON integer scanner for int-list and string-int-map decoders","risk":"More manual parsing logic; numeric edge-case tests should be restored before final review","next_action_hint":"Try simplifying/removing the older parseLazyJSONIntNumber helper if now unused."}}
{"run":199,"commit":"c902755","metric":20.860083,"metrics":{"build_ms":3736.021,"vm_output":29678473,"go_output":29678473,"binary_size_bytes":22973698},"status":"discard","description":"Remove unused lazy JSON integer helper","timestamp":1777360407448,"segment":0,"confidence":5.67252225257152,"iterationTokens":2086,"asi":{"hypothesis":"After switching to offset-based integer parsing, the older substring parser is unused; removing it may shrink code or improve compile/runtime layout","result":"Median regressed slightly from 20.805ms to 20.860ms with unchanged binary size; removal did not help","rollback_reason":"Primary metric worsened","next_action_hint":"Leave the unused helper for now or remove during cleanup if code clarity outweighs tiny/noisy perf effects."}}
{"run":200,"commit":"6b2f80f","metric":20.15175,"metrics":{"build_ms":3566.973,"vm_output":29678473,"go_output":29678473,"binary_size_bytes":22973954},"status":"keep","description":"Cache small lazy JSON object fields","timestamp":1777360576315,"segment":0,"confidence":5.4974006236757225,"iterationTokens":6211,"asi":{"hypothesis":"After validation, small top-level JSON objects can be stored as a fixed-array lazy object so repeated decode.field calls avoid rescanning object keys without allocating a map","result":"Median improved from 20.805ms to 20.152ms with checks passing; binary grew ~256 bytes","why_it_worked":"decode_pipeline extracts three fields from the same object; caching up to eight key/value slices in the lazy Dynamic avoids repeated top-level scans while keeping allocation low compared with the earlier map-based eager object attempt","scope":"General lazy JSON optimization for small objects with fallback to raw lazy JSON for larger objects","risk":"jsonObjectDynamic is a larger value stored in an interface and retains the original JSON string; behavior must be validated for generic fallback and missing fields","next_action_hint":"Try different small-object capacities and ensure tests cover jsonObjectDynamic."}}
{"run":201,"commit":"53473e0","metric":19.913167,"metrics":{"build_ms":3533.394,"vm_output":29678473,"go_output":29678473,"binary_size_bytes":22973954},"status":"keep","description":"Use four-slot cached lazy JSON objects","timestamp":1777360640014,"segment":0,"confidence":5.435249479489086,"iterationTokens":1098,"asi":{"hypothesis":"Most small JSON objects decoded lazily have only a few fields; reducing jsonObjectDynamic's fixed cache from eight to four slots can shrink interface payload copies while still covering decode_pipeline's three-field object","result":"Median improved from 20.152ms to 19.913ms with checks passing","why_it_worked":"The top-level benchmark object fits in four slots, so field cache benefits remain while the lazy object value is smaller","scope":"General lazy JSON small-object cache threshold; objects with more than four fields fall back to raw lazy JSON scanning","risk":"This threshold may be too low for broader JSON workloads; validate with real decode benchmarks before finalizing","next_action_hint":"Try six/eight-slot alternatives only with broader evidence; avoid overfitting to three fields."}}
{"run":202,"commit":"53473e0","metric":22.002334,"metrics":{"build_ms":3535.108,"vm_output":29678473,"go_output":29678473,"binary_size_bytes":22973954},"status":"discard","description":"Use two-slot cached lazy JSON objects","timestamp":1777360697038,"segment":0,"confidence":5.677210267416508,"iterationTokens":1041,"asi":{"hypothesis":"A smaller two-slot jsonObjectDynamic could reduce value-copy cost for very small objects","result":"Median regressed from 19.913ms to 22.002ms because the three-field benchmark object no longer fits and falls back to raw rescanning","rollback_reason":"Primary metric worsened","next_action_hint":"Keep at least four cached fields for lazy JSON objects."}}
{"run":203,"commit":"9c3a0a4","metric":19.217459,"metrics":{"build_ms":3643.325,"vm_output":29678473,"go_output":29678473,"binary_size_bytes":22973954},"status":"keep","description":"Use three-slot cached lazy JSON objects","timestamp":1777360748383,"segment":0,"confidence":5.845764271999649,"iterationTokens":871,"asi":{"hypothesis":"A three-slot jsonObjectDynamic still covers common small objects like decode_pipeline's top-level payload while further reducing value size versus four slots","result":"Median improved from 19.913ms to 19.217ms with checks passing","why_it_worked":"The top-level JSON object has exactly three requested fields, so the cache still applies and the smaller fixed arrays reduce interface copy/stack costs","scope":"Lazy JSON small-object cache threshold for generated Go runtime","risk":"High overfit risk: objects with four fields now fall back to raw scanning; broader decode workloads must validate this threshold","next_action_hint":"Consider reverting to four slots if broader benchmarks include four-field top-level objects or if review prioritizes generality over this narrow gain."}}
{"run":204,"commit":"f75eb48","metric":19.182292,"metrics":{"build_ms":3479.542,"vm_output":29678473,"go_output":29678473,"binary_size_bytes":22973954},"status":"keep","description":"Use small capacity hint for lazy string-int maps","timestamp":1777360841668,"segment":0,"confidence":6.133100188271358,"iterationTokens":3717,"asi":{"hypothesis":"Lazy string-int map parsing commonly decodes small JSON objects; using a small fixed map capacity hint can avoid initial map growth without the extra scan that made exact pre-counting regress","result":"Median improved slightly from 19.217ms to 19.182ms with checks passing","why_it_worked":"The counts object has four fields and fits the fixed capacity, avoiding map growth while adding no extra scan or binary size","scope":"General small-object hint for lazy JSON string-int map decoding","risk":"Capacity 4 may over-allocate for tiny maps and underfit larger maps; improvement is near noise and should be validated broadly","next_action_hint":"Try capacity 2/8 to assess sensitivity."}}
{"run":205,"commit":"f75eb48","metric":19.35375,"metrics":{"build_ms":3564.717,"vm_output":29678473,"go_output":29678473,"binary_size_bytes":22973954},"status":"discard","description":"Use capacity 8 for lazy string-int maps","timestamp":1777360921602,"segment":0,"confidence":6.463217131745935,"iterationTokens":999,"asi":{"hypothesis":"A larger fixed capacity hint may help lazy string-int maps with moderately more keys without exact pre-counting","result":"Median regressed from 19.182ms to 19.354ms; capacity 8 over-allocates for the current small map and is slower","rollback_reason":"Primary metric worsened","next_action_hint":"Keep lazy string-int map capacity hint at 4."}}
{"run":206,"commit":"f75eb48","metric":19.411584,"metrics":{"build_ms":3525.703,"vm_output":29678473,"go_output":29678473,"binary_size_bytes":22973954},"status":"discard","description":"Use capacity 2 for lazy string-int maps","timestamp":1777360966226,"segment":0,"confidence":6.692178099515936,"iterationTokens":855,"asi":{"hypothesis":"A smaller map capacity hint may reduce allocation footprint for tiny lazy string-int maps","result":"Median regressed from 19.182ms to 19.412ms; capacity 2 causes growth for four-key maps and is slower","rollback_reason":"Primary metric worsened","next_action_hint":"Keep lazy string-int map capacity hint at 4."}}
{"run":207,"commit":"168d9dd","metric":19.235042,"metrics":{"build_ms":3595.528,"vm_output":29678473,"go_output":29678473,"binary_size_bytes":22973954},"status":"discard","description":"Use direct Result literals for cached lazy field extraction","timestamp":1777361041974,"segment":0,"confidence":6.7423604791635645,"iterationTokens":1768,"asi":{"hypothesis":"builtinExtractField's jsonObjectDynamic path is now hot; direct Result literals may avoid Ok constructor overhead for cached field hits/misses","result":"Median regressed slightly from 19.182ms to 19.235ms; Ok constructors are still better for field extraction","rollback_reason":"Primary metric worsened","next_action_hint":"Keep Ok constructors in builtinExtractField, including jsonObjectDynamic path."}}
{"run":208,"commit":"0b622b6","metric":19.131,"metrics":{"build_ms":3550.558,"vm_output":29678473,"go_output":29678473,"binary_size_bytes":22973954},"status":"keep","description":"Check lazy JSON duplicates before json.Valid","timestamp":1777361104059,"segment":0,"confidence":5.387211265638429,"iterationTokens":1248,"asi":{"hypothesis":"validateLazyJSON currently runs json.Valid before duplicate-name scanning; running the custom duplicate scanner first may improve cache/branch behavior for valid JSON while preserving both checks","result":"Median improved slightly from 19.182ms to 19.131ms with checks passing","why_it_worked":"Both validators scan the same string, and duplicate-first ordering produced a slightly better hot-path layout/cache behavior for the generated workload","scope":"Validation-order tweak for lazy JSON Dynamic","risk":"Very small improvement near noise; invalid JSON may now spend time in duplicate scanning before json.Valid reports invalid syntax","next_action_hint":"Keep if broader validation does not show invalid-input regressions; otherwise prefer json.Valid first for invalid input fast-fail."}}
{"run":209,"commit":"0b622b6","metric":19.292,"metrics":{"build_ms":3702.424,"vm_output":29678473,"go_output":29678473,"binary_size_bytes":22973954},"status":"discard","description":"Recheck generic string-key MapKeys specialization after lazy JSON","timestamp":1777361170514,"segment":0,"confidence":4.531801492360537,"iterationTokens":2085,"asi":{"hypothesis":"MapKeys is now a larger fraction of decode_pipeline runtime after lazy JSON; specializing K=string with a one-time generic type check may avoid per-key assertions","result":"Median regressed from 19.131ms to 19.292ms; generic K=string specialization still hurts","rollback_reason":"Primary metric worsened","next_action_hint":"Keep existing all-string scan in MapKeys."}}
{"run":210,"commit":"919e22c","metric":19.379292,"metrics":{"build_ms":3628.699,"vm_output":29678473,"go_output":29678473,"binary_size_bytes":22973954},"status":"discard","description":"Recheck GC target 100 after lazy JSON","timestamp":1777361257310,"segment":0,"confidence":4.482143294339014,"iterationTokens":1837,"asi":{"hypothesis":"Lazy JSON greatly reduced allocations, so the generated runtime may no longer need a high default GC target; target 100 could reduce memory risk without hurting speed","result":"Median regressed from 19.131ms to 19.379ms; GC target 300 remains faster even after lazy JSON","rollback_reason":"Primary metric worsened","next_action_hint":"Keep default GC target 300, but memory validation remains important."}}
{"run":211,"commit":"919e22c","metric":19.528083,"metrics":{"build_ms":3599.404,"vm_output":29678473,"go_output":29678473,"binary_size_bytes":22973954},"status":"discard","description":"Recheck GC target 200 after lazy JSON","timestamp":1777361301983,"segment":0,"confidence":4.433561581454273,"iterationTokens":908,"asi":{"hypothesis":"A moderate GC target of 200 may be enough after lazy JSON reduced allocations, lowering memory risk compared with 300","result":"Median regressed from 19.131ms to 19.528ms; target 300 remains better","rollback_reason":"Primary metric worsened","next_action_hint":"Keep default GC target 300."}}
{"run":212,"commit":"919e22c","metric":19.680875,"metrics":{"build_ms":3555.44,"vm_output":29678473,"go_output":29678473,"binary_size_bytes":22973954},"status":"discard","description":"Use GC target 500 after lazy JSON","timestamp":1777361374969,"segment":0,"confidence":4.395804879662805,"iterationTokens":944,"asi":{"hypothesis":"With lazy JSON reducing allocation volume, a higher GC target may reduce remaining GC overhead further","result":"Median regressed from 19.131ms to 19.681ms; higher target is worse/noisier","rollback_reason":"Primary metric worsened","next_action_hint":"Keep default GC target 300."}}
{"run":213,"commit":"7884fca","metric":19.18675,"metrics":{"build_ms":3580.722,"vm_output":29678473,"go_output":29678473,"binary_size_bytes":22973986},"status":"discard","description":"Recheck fixed-array four-key MapKeys after lazy JSON","timestamp":1777361453146,"segment":0,"confidence":4.358685828085374,"iterationTokens":2041,"asi":{"hypothesis":"After lazy JSON, MapKeys is a larger remaining cost; a fixed four-key string sorting path may now be worthwhile for small decoded maps","result":"Median regressed slightly from 19.131ms to 19.187ms and binary grew; generic sort.Strings path remains better","rollback_reason":"Primary metric worsened","next_action_hint":"Keep MapKeys without four-key special cases."}}
{"run":214,"commit":"c492982","metric":18.984917,"metrics":{"build_ms":3553.514,"vm_output":29678473,"go_output":29678473,"binary_size_bytes":22973954},"status":"keep","description":"Store cached lazy JSON objects by pointer","timestamp":1777361535803,"segment":0,"confidence":4.271271831024731,"iterationTokens":1396,"asi":{"hypothesis":"jsonObjectDynamic contains fixed key/value arrays; storing it by pointer in Dynamic may avoid repeated large interface value copies during field extraction","result":"Median improved from 19.131ms to 18.985ms with checks passing and unchanged binary size","why_it_worked":"The cached top-level object is passed through decode.field three times; pointer storage reduces copying of the fixed arrays while preserving object cache behavior","scope":"General lazy JSON cached-object representation for generated Go runtime","risk":"Introduces one heap allocation for the cached object and pointer semantics; current workload benefits, but tiny objects with few field accesses may differ","next_action_hint":"Try pointer with four-slot object cache or value with three slots on broader workloads to choose a less overfit representation."}}
{"run":215,"commit":"c492982","metric":19.114542,"metrics":{"build_ms":3582.794,"vm_output":29678473,"go_output":29678473,"binary_size_bytes":22973954},"status":"discard","description":"Use four-slot pointer cached lazy JSON objects","timestamp":1777361585029,"segment":0,"confidence":4.218478594654982,"iterationTokens":1007,"asi":{"hypothesis":"After switching cached lazy JSON objects to pointer representation, a four-slot cache might be more general with less copy penalty than before","result":"Median regressed from 18.985ms to 19.115ms; three slots remains faster for the primary workload","rollback_reason":"Primary metric worsened","next_action_hint":"Keep three-slot pointer cached lazy JSON object for now, but validate threshold broadly due overfit risk."}}
{"run":216,"commit":"dc9ec2d","metric":18.942666,"metrics":{"build_ms":3778.85,"vm_output":29678473,"go_output":29678473,"binary_size_bytes":22973954},"status":"keep","description":"Build cached lazy JSON objects as pointers","timestamp":1777361683529,"segment":0,"confidence":4.1693127841994215,"iterationTokens":2110,"asi":{"hypothesis":"parseLazyJSONObjectSmall currently returns a value that builtinJsonToDynamic then takes the address of; constructing the pointer directly may avoid a struct copy","result":"Median improved slightly from 18.985ms to 18.943ms with checks passing","why_it_worked":"The cached object is already intended to live behind a pointer; filling the heap object directly avoids returning/copying the fixed arrays before boxing","scope":"Internal lazy JSON object construction cleanup","risk":"Very small improvement near noise; pointer allocation remains","next_action_hint":"Look for further reductions in field extraction and MapKeys overhead."}}
{"run":217,"commit":"dc9ec2d","metric":19.0405,"metrics":{"build_ms":3642.256,"vm_output":29678473,"go_output":29678473,"binary_size_bytes":22973954},"status":"discard","description":"Fill lazy int lists by index within initial length","timestamp":1777361754242,"segment":0,"confidence":4.130280001857708,"iterationTokens":1657,"asi":{"hypothesis":"Lazy int-list parsing can allocate len 12 and assign by index, returning out[:count], to avoid append overhead for common small arrays while retaining append fallback for larger arrays","result":"Median regressed from 18.943ms to 19.041ms; append into cap-12 slice is better","rollback_reason":"Primary metric worsened","next_action_hint":"Keep make([]int, 0, 12) plus append in lazy int-list parser."}}
{"run":218,"commit":"a3464c2","metric":19.002541,"metrics":{"build_ms":3628.059,"vm_output":29678473,"go_output":29678473,"binary_size_bytes":22973890},"status":"discard","description":"Store cached lazy object values as strings","timestamp":1777361890396,"segment":0,"confidence":3.4476342301896543,"iterationTokens":4984,"asi":{"hypothesis":"jsonDynamic is just a string alias; storing cached object values as plain strings and casting on extraction may shrink the object representation or codegen","result":"Median regressed slightly from 18.943ms to 19.003ms despite smaller binary; jsonDynamic values are better in the cache","rollback_reason":"Primary metric worsened","next_action_hint":"Keep jsonObjectDynamic values typed as jsonDynamic."}}
{"run":219,"commit":"6ece931","metric":19.003708,"metrics":{"build_ms":3710.871,"vm_output":29678473,"go_output":29678473,"binary_size_bytes":22973954},"status":"discard","description":"Remove typed int-list fast path after lazy JSON","timestamp":1777361958957,"segment":0,"confidence":2.960678378195469,"iterationTokens":1245,"asi":{"hypothesis":"After lazy JSON became the hot path, the already-typed []int fast path in DecodeIntListErrorsExtern may be cold code that hurts branch layout","result":"Median regressed from 18.943ms to 19.004ms; the typed []int branch still helps or is neutral enough to keep","rollback_reason":"Primary metric worsened","next_action_hint":"Keep already-typed []int fast path in DecodeIntListErrorsExtern."}}
