{"run":119,"commit":"6146b17","metric":31.7245,"metrics":{"build_ms":3569.168,"vm_output":29678473,"go_output":29678473,"binary_size_bytes":22956546},"status":"discard","description":"Use direct Result literals in JsonToDynamic helper","timestamp":1777356198234,"segment":0,"confidence":7.121855755081721,"iterationTokens":1471,"asi":{"hypothesis":"JsonToDynamic runs once per DecodeOnce call; returning direct Result literals from builtinJsonToDynamic might avoid generic Ok/Err constructor overhead on the hot parse-success path","result":"Median regressed from 31.69ms to 31.72ms despite identical binary size; generic constructors codegen better or equivalent here","rollback_reason":"Primary metric worsened","next_action_hint":"Keep Ok/Err constructors in builtinJsonToDynamic."}}
{"run":120,"commit":"6146b17","metric":54.652167,"metrics":{"build_ms":3769.919,"vm_output":29678473,"go_output":29678473,"binary_size_bytes":22956546},"status":"discard","description":"Use encoding/json v1 for JsonToDynamic parsing","timestamp":1777356236498,"segment":0,"confidence":7.085994052629286,"iterationTokens":987,"asi":{"hypothesis":"The older encoding/json decoder might parse small Dynamic payloads faster than json/v2 in this workload while preserving the same any/map/slice shapes","result":"Median regressed badly from 31.69ms to 54.65ms; json/v2 is much faster here","rollback_reason":"Primary metric worsened substantially","next_action_hint":"Keep encoding/json/v2 for JsonToDynamic."}}
{"run":121,"commit":"17175af","metric":31.638,"metrics":{"build_ms":3514.991,"vm_output":29678473,"go_output":29678473,"binary_size_bytes":22956546},"status":"keep","description":"Pre-size all-string MapKeys slice by length","timestamp":1777356306988,"segment":0,"confidence":7.076796370653419,"iterationTokens":9374,"asi":{"hypothesis":"MapKeys is hot for map[string]int; filling a len-sized []string by index can avoid append growth checks while preserving deterministic sort semantics and fallback behavior","result":"Median improved from 31.69ms to 31.64ms with checks passing and unchanged binary size","why_it_worked":"The all-string MapKeys fast path now avoids per-key append capacity checks before sort.Strings and direct []string return","scope":"General MapKeys optimization for maps whose keys are all strings; non-string maps still fall back to generic sorted keys","risk":"Slightly more manual indexing; fallback after encountering a non-string key leaves an unused partially filled slice but does not observe it"}}
{"run":122,"commit":"17175af","metric":31.685875,"metrics":{"build_ms":3483.778,"vm_output":29678473,"go_output":29678473,"binary_size_bytes":22956546},"status":"discard","description":"Specialize MapKeys when generic key type is string","timestamp":1777356338079,"segment":0,"confidence":7.096705453525862,"iterationTokens":1648,"asi":{"hypothesis":"After pre-sizing string keys, checking the generic key type once for K=string could avoid the per-key comma-ok assertion in MapKeys while preserving generic fallback","result":"Median regressed from 31.64ms to 31.69ms; the extra generic type test and duplicated path outweigh avoiding the ok check","rollback_reason":"Primary metric worsened","next_action_hint":"Keep the single all-string scan with per-key comma-ok assertions."}}
{"run":123,"commit":"17175af","metric":31.641708,"metrics":{"build_ms":3517.138,"vm_output":29678473,"go_output":29678473,"binary_size_bytes":22956786},"status":"discard","description":"Split slow item path in direct int-list decoder","timestamp":1777356375456,"segment":0,"confidence":7.116726872493441,"iterationTokens":2591,"asi":{"hypothesis":"DecodeIntListErrorsExtern hot items are float64 integers; moving non-fast-path item decoding and error-path construction to a helper may shrink the hot loop and improve inlining","result":"Median was essentially flat but slightly worse than current best (31.64ms to 31.6417ms) and binary grew by 240 bytes","rollback_reason":"Primary metric did not improve","next_action_hint":"Keep the direct int-list slow item path inline; avoid further helper splitting unless profile shows a clear inlining issue."}}
{"run":124,"commit":"17175af","metric":31.818625,"metrics":{"build_ms":3499.274,"vm_output":29678473,"go_output":29678473,"binary_size_bytes":22956786},"status":"discard","description":"Split slow value path in direct string-int map decoder","timestamp":1777356400141,"segment":0,"confidence":7.127281721928554,"iterationTokens":1215,"asi":{"hypothesis":"String-int map values are usually float64 integers; moving fallback DecodeIntErrors and value error-path construction to a helper may shrink the hot map loop","result":"Median regressed from 31.64ms to 31.82ms and binary grew; helper call/code shape is worse","rollback_reason":"Primary metric worsened","next_action_hint":"Keep the string-int map fallback path inline."}}
{"run":125,"commit":"17175af","metric":31.646458,"metrics":{"build_ms":3584.171,"vm_output":29678473,"go_output":29678473,"binary_size_bytes":22956546},"status":"discard","description":"Use sorting network for four pre-sized string MapKeys","timestamp":1777356436769,"segment":0,"confidence":7.137867925754256,"iterationTokens":1355,"asi":{"hypothesis":"After pre-sizing the all-string MapKeys slice, a four-element compare-swap network may avoid sort.Strings overhead for small JSON maps while keeping deterministic ordering","result":"Median regressed slightly from 31.638ms to 31.646ms; sort.Strings remains better even after pre-sizing","rollback_reason":"Primary metric worsened","next_action_hint":"Do not specialize four-key MapKeys sorting; keep sort.Strings."}}
{"run":126,"commit":"17175af","metric":31.825625,"metrics":{"build_ms":3517.163,"vm_output":29678473,"go_output":29678473,"binary_size_bytes":22956546},"status":"discard","description":"Cache map length in MapKeys","timestamp":1777356478136,"segment":0,"confidence":7.139812987811332,"iterationTokens":8648,"asi":{"hypothesis":"MapKeys calls len(m) for the empty check and string key allocation; caching it in a local may reduce repeated map length operations in the hot path","result":"Median regressed from 31.64ms to 31.83ms; compiler already handles len well and local shape is worse","rollback_reason":"Primary metric worsened","next_action_hint":"Do not cache len(m) in MapKeys."}}
{"run":127,"commit":"17175af","metric":31.925333,"metrics":{"build_ms":3485.424,"vm_output":29678473,"go_output":29678473,"binary_size_bytes":22956546},"status":"discard","description":"Collapse direct int-list float integer check","timestamp":1777356507964,"segment":0,"confidence":7.141759110212395,"iterationTokens":1130,"asi":{"hypothesis":"Combining the float64 type assertion and integer equality check in DecodeIntListErrorsExtern may reduce branch nesting in the hot array loop","result":"Median regressed from 31.64ms to 31.93ms; double int conversion/combined condition shape is much worse","rollback_reason":"Primary metric worsened","next_action_hint":"Keep the named intValue temporary in direct int-list decoding."}}
{"run":128,"commit":"0f92edd","metric":31.604791,"metrics":{"build_ms":3481.228,"vm_output":29678473,"go_output":29678473,"binary_size_bytes":22956546},"status":"keep","description":"Fast-path raw ints in direct int-list decoder","timestamp":1777356539373,"segment":0,"confidence":7.2203758732531735,"iterationTokens":1188,"asi":{"hypothesis":"DecodeIntListErrorsExtern falls back to constructing per-item Results for raw int values; adding an int fast path after the hot float64 check may improve non-JSON Dynamic lists without hurting JSON arrays","result":"Median improved from 31.638ms to 31.605ms with checks passing and unchanged binary size","why_it_worked":"The extra int branch is after the successful float64 JSON fast path, so it does not penalize common JSON numbers and may improve code layout/fallback handling","scope":"General direct int-list decoder optimization for Dynamic lists containing Go ints as well as JSON float64 numbers","risk":"Very small improvement near noise; code remains straightforward and semantics unchanged"}}
{"run":129,"commit":"0f92edd","metric":31.895209,"metrics":{"build_ms":3587.459,"vm_output":29678473,"go_output":29678473,"binary_size_bytes":22956546},"status":"discard","description":"Fast-path raw int64s in direct int-list decoder","timestamp":1777356567152,"segment":0,"confidence":7.308593255884775,"iterationTokens":1120,"asi":{"hypothesis":"After raw int helped the direct int-list decoder, adding an int64 branch could speed SQLite-style integer Dynamic lists without affecting JSON float64 arrays","result":"Median regressed from 31.605ms to 31.895ms; the extra branch/layout cost is not worth it for the primary workload","rollback_reason":"Primary metric worsened","next_action_hint":"Keep only the raw int branch, not int64, in DecodeIntListErrorsExtern."}}
{"run":130,"commit":"e02840c","metric":31.43175,"metrics":{"build_ms":3539.731,"vm_output":29678473,"go_output":29678473,"binary_size_bytes":22956546},"status":"keep","description":"Fast-path raw ints in direct string-int map decoder","timestamp":1777356599615,"segment":0,"confidence":7.307267315550588,"iterationTokens":1075,"asi":{"hypothesis":"Like direct int-list decoding, DecodeStringIntMapErrorsExtern can handle raw Go int values without constructing per-value DecodeIntErrors Results; placing the branch after the hot float64 success path may preserve JSON speed","result":"Median improved from 31.605ms to 31.432ms with checks passing and unchanged binary size","why_it_worked":"The map value loop avoids the generic int decode fallback for raw ints, and the added branch also appears to improve code layout for the existing float64 JSON path","scope":"General string-to-int Dynamic map decoder optimization for both JSON float64 values and raw Go int values","risk":"Small branch-shape-sensitive change; int64 was already shown to hurt in the list helper, so avoid broadening without evidence"}}
{"run":131,"commit":"e02840c","metric":31.472208,"metrics":{"build_ms":3488.233,"vm_output":29678473,"go_output":29678473,"binary_size_bytes":22956546},"status":"discard","description":"Fast-path raw int64s in direct string-int map decoder","timestamp":1777356624924,"segment":0,"confidence":7.346371111086693,"iterationTokens":1132,"asi":{"hypothesis":"Adding an int64 branch to DecodeStringIntMapErrorsExtern may help raw integer maps from non-JSON sources, analogous to the kept int branch","result":"Median regressed from 31.432ms to 31.472ms; the extra int64 branch is not worthwhile","rollback_reason":"Primary metric worsened","next_action_hint":"Keep raw int but not int64 fast paths in direct string-int map/list decoders."}}
{"run":132,"commit":"e02840c","metric":31.509333,"metrics":{"build_ms":3521.215,"vm_output":29678473,"go_output":29678473,"binary_size_bytes":22956546},"status":"discard","description":"Check raw int before float64 in string-int map decoder","timestamp":1777356652479,"segment":0,"confidence":7.3464423684050875,"iterationTokens":1118,"asi":{"hypothesis":"Since adding an int branch helped DecodeStringIntMapErrorsExtern, checking int before float64 might further improve raw-int maps","result":"Median regressed from 31.432ms to 31.509ms; JSON float64 remains the primary hot path and must stay first","rollback_reason":"Primary metric worsened","next_action_hint":"Keep float64 check before raw int in direct string-int map decoding."}}
{"run":133,"commit":"e02840c","metric":31.684875,"metrics":{"build_ms":3481.279,"vm_output":29678473,"go_output":29678473,"binary_size_bytes":22956546},"status":"discard","description":"Check raw int before float64 in int-list decoder","timestamp":1777356682149,"segment":0,"confidence":7.3465136271058515,"iterationTokens":1079,"asi":{"hypothesis":"The raw int branch improved DecodeIntListErrorsExtern after the float64 path; checking int first may help raw-int Dynamic lists","result":"Median regressed from 31.432ms to 31.685ms; JSON float64 array values need to remain first","rollback_reason":"Primary metric worsened","next_action_hint":"Keep float64 before int in direct int-list decoding."}}
{"run":134,"commit":"e02840c","metric":31.529833,"metrics":{"build_ms":3494.36,"vm_output":29678473,"go_output":29678473,"binary_size_bytes":22956546},"status":"discard","description":"Use type switch for float/int string-int map values","timestamp":1777356710742,"segment":0,"confidence":7.377299952929213,"iterationTokens":1164,"asi":{"hypothesis":"Now that DecodeStringIntMapErrorsExtern has both float64 and int fast paths, a type switch might avoid repeated interface assertions in the map value loop","result":"Median regressed from 31.432ms to 31.530ms; comma-ok assertions remain better for this loop","rollback_reason":"Primary metric worsened","next_action_hint":"Keep separate float64 then int assertions in DecodeStringIntMapErrorsExtern."}}
{"run":135,"commit":"e02840c","metric":31.5045,"metrics":{"build_ms":3504.446,"vm_output":29678473,"go_output":29678473,"binary_size_bytes":22956546},"status":"discard","description":"Use type switch for float/int int-list values","timestamp":1777356741127,"segment":0,"confidence":7.408345391160314,"iterationTokens":1088,"asi":{"hypothesis":"With both float64 and int fast paths in DecodeIntListErrorsExtern, a type switch may reduce repeated assertions in the list loop","result":"Median regressed from 31.432ms to 31.505ms; separate assertions remain better","rollback_reason":"Primary metric worsened","next_action_hint":"Keep float64 then int comma-ok assertions in DecodeIntListErrorsExtern."}}
{"run":136,"commit":"e02840c","metric":31.653666,"metrics":{"build_ms":3534.785,"vm_output":29678473,"go_output":29678473,"binary_size_bytes":22956546},"status":"discard","description":"Fast-path raw ints in scalar DecodeIntErrors","timestamp":1777356777689,"segment":0,"confidence":7.389693280149936,"iterationTokens":1738,"asi":{"hypothesis":"Raw int fast paths helped direct list/map integer decoders; adding int to the scalar DecodeIntErrorsExtern fast switch may improve generic scalar int decoding","result":"Median regressed from 31.432ms to 31.654ms; scalar fast helper should stay float64-only with raw ints handled in dedicated direct helpers","rollback_reason":"Primary metric worsened","next_action_hint":"Keep DecodeIntErrorsExtern fast path limited to float64."}}
{"run":137,"commit":"e02840c","metric":31.633208,"metrics":{"build_ms":3551.473,"vm_output":29678473,"go_output":29678473,"binary_size_bytes":22956546},"status":"discard","description":"Retry raw map fast path in direct string-int map decoder","timestamp":1777356805406,"segment":0,"confidence":7.37113485470902,"iterationTokens":1485,"asi":{"hypothesis":"With raw int value fast paths now kept, directly accepting map[string]any in DecodeStringIntMapErrorsExtern might avoid DynamicToStringMapExtern Result construction enough to become profitable","result":"Median regressed from 31.432ms to 31.633ms; DynamicToStringMapExtern's existing raw-map path still codegens better","rollback_reason":"Primary metric worsened","next_action_hint":"Keep DecodeStringIntMapErrorsExtern delegating map conversion to DynamicToStringMapExtern."}}
{"run":138,"commit":"63c46ee","metric":31.498667,"metrics":{"build_ms":3564.271,"vm_output":29678473,"go_output":29678473,"binary_size_bytes":22956546},"status":"discard","description":"Fast-path raw ints in DecodeIntExtern","timestamp":1777356856641,"segment":0,"confidence":7.444018437781021,"iterationTokens":2513,"asi":{"hypothesis":"The non-error-list DecodeIntExtern can mirror direct decoder raw int fast paths for non-JSON Dynamic values without affecting the float64 JSON success path","result":"Median regressed from 31.432ms to 31.499ms; DecodeIntExtern is not hot enough and extra branch/layout hurts","rollback_reason":"Primary metric worsened","next_action_hint":"Keep raw int fast paths only in direct list/map decoders, not scalar DecodeIntExtern."}}
{"run":139,"commit":"63c46ee","metric":31.664667,"metrics":{"build_ms":3698.351,"vm_output":29678473,"go_output":29678473,"binary_size_bytes":22956706},"status":"discard","description":"Return generic MapKeys path from string scan","timestamp":1777356926480,"segment":0,"confidence":7.518357716603595,"iterationTokens":2784,"asi":{"hypothesis":"Replacing the allStringKeys flag with an early generic helper return may simplify the hot all-string MapKeys path","result":"Median regressed from 31.432ms to 31.665ms and binary grew; helper split/return shape is worse","rollback_reason":"Primary metric worsened","next_action_hint":"Keep the boolean allStringKeys scan in MapKeys."}}
{"run":140,"commit":"63c46ee","metric":51.527542,"metrics":{"build_ms":3704.802,"vm_output":29678473,"go_output":29678473,"binary_size_bytes":22956546},"status":"discard","description":"Allow duplicate JSON names in JsonToDynamic","timestamp":1777356972663,"segment":0,"confidence":7.409215933853982,"iterationTokens":1750,"asi":{"hypothesis":"jsontext.AllowDuplicateNames(true) disables duplicate-name checking and might speed json/v2 Dynamic parsing for object-heavy payloads","result":"Median regressed badly from 31.432ms to 51.53ms; adding the option is much slower and also weakens strict duplicate-name validation","rollback_reason":"Primary metric worsened and semantics are weaker","next_action_hint":"Keep default json/v2 options for JsonToDynamic."}}
{"run":141,"commit":"f928b41","metric":31.318125,"metrics":{"build_ms":3556.908,"vm_output":29678473,"go_output":29678473,"binary_size_bytes":22956626},"status":"keep","description":"Raise Go GC target for generated runtime","timestamp":1777357016754,"segment":0,"confidence":7.423261704366301,"iterationTokens":1282,"asi":{"hypothesis":"Generated Go programs allocate heavily in dynamic decode paths; raising the runtime GC target from 100 to 200 during Ard runtime registration may reduce GC frequency and improve throughput without changing program results","result":"Median improved from 31.432ms to 31.318ms with checks passing; binary grew by 80 bytes","why_it_worked":"decode_pipeline allocates many short-lived JSON/list/map objects, so a less aggressive GC target reduces collection overhead during the tight generated workload","scope":"General Go runtime tuning applied once when generated programs call RegisterBuiltinExterns, not benchmark-specific code","risk":"Increases peak memory usage for generated Go programs and changes process-wide GC tuning; should be reviewed against memory-sensitive workloads before finalizing","next_action_hint":"Experiment with smaller/larger GC targets (150, 300) to find a robust tradeoff, and consider documenting or making it configurable."}}
{"run":142,"commit":"f928b41","metric":31.411333,"metrics":{"build_ms":3507.369,"vm_output":29678473,"go_output":29678473,"binary_size_bytes":22956626},"status":"discard","description":"Use GC target 150 for generated runtime","timestamp":1777357056303,"segment":0,"confidence":7.556740475572321,"iterationTokens":1186,"asi":{"hypothesis":"A moderate GC target of 150 may retain most of the throughput win from raising GOGC while limiting memory-growth risk compared with 200","result":"Median regressed from 31.318ms to 31.411ms; 150 gives less speedup than 200","rollback_reason":"Primary metric worsened","next_action_hint":"Keep GC target at 200 unless larger targets produce a better tradeoff."}}
{"run":143,"commit":"0102bb6","metric":31.206334,"metrics":{"build_ms":3524.379,"vm_output":29678473,"go_output":29678473,"binary_size_bytes":22956626},"status":"keep","description":"Use GC target 300 for generated runtime","timestamp":1777357087686,"segment":0,"confidence":7.667639423815235,"iterationTokens":862,"asi":{"hypothesis":"A higher GC target than 200 may further reduce collection overhead in allocation-heavy generated Go decode workloads while still keeping GC enabled","result":"Median improved from 31.318ms to 31.206ms with checks passing and unchanged binary size","why_it_worked":"Fewer collections occur during the JSON decode loop, reducing runtime GC overhead while preserving normal Go allocation semantics","scope":"General generated Go runtime tuning via RegisterBuiltinExterns, not benchmark-specific logic","risk":"Likely increases peak heap usage more than the 200 target; memory-sensitive workloads need validation","next_action_hint":"Try 400/500 and a no-change memory sanity check before deciding the final GC target."}}
{"run":144,"commit":"0102bb6","metric":31.50975,"metrics":{"build_ms":3500.313,"vm_output":29678473,"go_output":29678473,"binary_size_bytes":22956626},"status":"discard","description":"Use GC target 400 for generated runtime","timestamp":1777357116844,"segment":0,"confidence":8.0803997121683,"iterationTokens":1003,"asi":{"hypothesis":"Increasing the generated runtime GC target from 300 to 400 might further reduce collection overhead in decode-heavy generated Go programs","result":"Median regressed from 31.206ms to 31.510ms; 400 is slower/noisier and has higher memory risk","rollback_reason":"Primary metric worsened","next_action_hint":"Keep GC target 300 as the best tested tradeoff so far; avoid higher values unless new evidence appears."}}
{"run":145,"commit":"0102bb6","metric":31.27025,"metrics":{"build_ms":3512.977,"vm_output":29678473,"go_output":29678473,"binary_size_bytes":22956626},"status":"discard","description":"Use GC target 250 for generated runtime","timestamp":1777357146029,"segment":0,"confidence":8.353803314287665,"iterationTokens":878,"asi":{"hypothesis":"A GC target of 250 may approach the speed of 300 with somewhat lower peak-memory risk","result":"Median regressed from 31.206ms to 31.270ms; close but worse than 300","rollback_reason":"Primary metric worsened","next_action_hint":"Keep GC target 300 unless memory validation requires backing off."}}
